Product code,Product label,Viet Nam's imports from Saudi Arabia-Value in 2012,Viet Nam's imports from Saudi Arabia-Value in 2013,Viet Nam's imports from Saudi Arabia-Value in 2014,Viet Nam's imports from Saudi Arabia-Value in 2015,Viet Nam's imports from Saudi Arabia-Value in 2016,Viet Nam's imports from Saudi Arabia-Value in 2017,Viet Nam's imports from Saudi Arabia-Value in 2018,Viet Nam's imports from Saudi Arabia-Value in 2019,Viet Nam's imports from Saudi Arabia-Value in 2020,Viet Nam's imports from Saudi Arabia-Value in 2021,Saudi Arabia's exports to world- ,Saudi Arabia's exports to world-Value in 2012,Saudi Arabia's exports to world-Value in 2013,Saudi Arabia's exports to world-Value in 2014,Saudi Arabia's exports to world-Value in 2015,Saudi Arabia's exports to world-Value in 2016,Saudi Arabia's exports to world-Value in 2017,Saudi Arabia's exports to world-Value in 2018,Saudi Arabia's exports to world-Value in 2019,Saudi Arabia's exports to world-Value in 2020,Saudi Arabia's exports to world-Value in 2021,Viet Nam's imports from world- ,Viet Nam's imports from world-Value in 2012,Viet Nam's imports from world-Value in 2013,Viet Nam's imports from world-Value in 2014,Viet Nam's imports from world-Value in 2015,Viet Nam's imports from world-Value in 2016,Viet Nam's imports from world-Value in 2017,Viet Nam's imports from world-Value in 2018,Viet Nam's imports from world-Value in 2019,Viet Nam's imports from world-Value in 2020,Viet Nam's imports from world-Value in 2021
TOTAL,All products,886534,1238815,1336918,1105810,1165277,1308620,1482411,1185156,1149169,,,387373983,375360918,341947183,213376375,178874135,220068596,294535553,251800458,176507506,267546847,,113780431,132032531,147839048,165775858,174978350,213215299,236868823,253442016,261309452,329199265
10121,Pure-bred breeding horses,0,0,0,0,0,0,0,0,0,,,108,101,0,0,0,0,0,0,0,3,,0,180,52,0,0,0,15,0,0,144
10620,"Live reptiles """"e.g. snakes, turtles, alligators, caymans, iguanas, gavials and lizards""""""""",0,0,0,0,0,0,0,0,0,,,0,0,0,0,0,0,0,0,0,0,,558,326,804,786,3074,6749,5271,7094,6209,4630
10632,"Live psittaciformes """"incl. parrots, parrakeets, macaws and cockatoos""""""""",0,0,0,0,0,0,0,0,0,,,0,0,0,0,0,0,0,0,0,0,,0,0,0,79,80,30,71,29,1,24
10639,"Live birds (excluding birds of prey, psittaciformes, parrots, parrakeets, macaws, cockatoos, ...",0,0,0,0,0,0,0,0,0,,,0,147,192,489,428,101,0,0,0,29,,10,150,548,182,177,720,684,918,163,2271
20110,"Carcases or half-carcases of bovine animals, fresh or chilled",0,0,0,0,0,0,0,0,0,,,0,0,2114,177,74,0,0,0,0,0,,0,10,0,3,0,6,5,0,0,
20220,"Frozen bovine cuts, with bone in (excluding carcases and half-carcases)",0,0,0,0,0,0,0,0,0,,,318,257,180,212,159,780,1300,0,0,0,,2426,2767,2394,4111,4630,5928,10968,10960,6644,22727
20410,Fresh or chilled lamb carcases and half-carcases,0,0,0,0,0,0,0,0,0,,,2719,187,0,661,847,813,504,0,0,0,,0,1,0,0,0,0,0,0,0,41
20641,Frozen edible livers of swine,0,0,0,0,0,0,0,0,0,,,,,,,,,,,,,,87,24,87,102,22,13,39,127,88,1022
20690,"Frozen edible offal of sheep, goats, horses, asses, mules and hinnies",0,0,0,0,0,0,0,0,0,,,4415,355,0,40,132,234,243,115,350,34,,138,48,12,244,639,400,891,22,292,2556
20752,"Frozen domestic geese, not cut in pieces",0,0,0,0,0,0,0,0,0,,,0,0,0,0,0,0,0,0,0,0,,0,0,0,0,0,4,39,3,5,18
20910,"Pig fat, free of lean meat, not rendered or otherwise extracted, fresh, chilled, frozen, salted, ...",0,0,0,0,0,0,0,0,0,,,,,,,,,,,,,,210,595,1071,1430,1422,1738,7249,8580,26680,10659
21093,"Meat and edible offal, salted, in brine, dried or smoked, and edible flours and meals of meat ...""",0,0,0,0,0,0,0,0,0,,,0,0,0,0,0,0,0,0,0,0,,0,0,0,0,0,0,0,0,0,25
30199,"Live fish (excluding ornamental fish, trout [Salmo trutta, Oncorhynchus mykiss, Oncorhynchus ...",0,0,0,0,0,0,0,0,0,,,0,0,0,0,0,0,0,407,792,393,,342,372,1308,3819,8071,15971,16447,26033,29020,30359
30221,"Fresh or chilled lesser or Greenland halibut """"Reinhardtius hippoglossoides, Atlantic halibut ...""",0,0,0,0,0,0,0,0,0,,,0,0,0,0,0,0,0,0,0,0,,0,0,0,0,1,0,4,40,7,
30256,"Fresh or chilled blue whiting """"Micromesistius poutassou, Micromesistius australis""""""""",0,0,0,0,0,0,0,0,0,,,0,0,0,0,0,0,0,0,0,0,,2,0,0,0,0,0,0,7,0,
30285,"Fresh or chilled sea bream """"Sparidae""""""""",0,0,0,0,0,0,0,0,0,,,28,533,1708,1541,833,336,1404,0,0,210,,0,0,0,1,17,24,39,51,46,
30314,"Frozen trout """"Salmo trutta, Oncorhynchus mykiss, Oncorhynchus clarki, Oncorhynchus aguabonita, ...""",0,0,0,0,0,0,0,0,0,,,0,0,0,0,0,0,0,0,0,0,,16212,18538,18879,20445,22446,23989,27907,42687,50934,43841
30331,"Frozen lesser or Greenland halibut """"Reinhardtius hippoglossoides"""", Atlantic halibut """"Hippoglossus ...""",0,0,0,0,0,0,0,0,0,,,0,0,0,0,0,0,0,0,0,0,,112,169,0,1,8,2,9,998,2080,516
30341,"Frozen albacore or longfinned tunas """"Thunnus alalunga""""""""",0,0,0,0,0,0,0,0,0,,,0,525,0,0,6,8,0,0,0,0,,1196,3387,9365,25399,37983,34285,26342,42796,95873,46629
30343,"Frozen skipjack or stripe-bellied bonito """"Euthynnus -Katsuwonus- pelamis""""""""",0,0,0,0,0,0,0,0,0,,,0,0,0,0,0,0,0,0,0,0,,54547,57306,61384,52466,32102,47281,70976,45843,29828,29200
30366,"Frozen hake """"Merluccius spp., Urophycis spp.""""""""",0,0,0,0,0,0,0,0,0,,,0,0,0,0,0,0,0,0,0,0,,0,0,74,2,21,3,152,235,1356,1086
30368,"Frozen blue whiting """"Micromesistius poutassou, Micromesistius australis""""""""",0,0,0,0,0,0,0,0,0,,,0,0,0,0,0,0,0,0,0,0,,185,76,0,31,63,35,0,43,357,
30431,"Fresh or chilled fillets of tilapia """"Oreochromis spp.""""""""",0,0,0,0,0,0,0,0,0,,,0,0,0,0,0,0,11,0,0,3,,84,0,0,0,0,1,15,59,300,669
30441,"Fresh or chilled fillets of Pacific salmon """"Oncorhynchus nerka, Oncorhynchus gorbuscha, Oncorhynchus ...""",0,0,0,0,0,0,0,0,0,,,0,0,0,0,0,0,0,0,0,0,,6463,3524,1157,1508,991,364,9333,5090,3062,272
30443,"Fresh or chilled fillets of flat fish """"Pleuronectidae, Bothidae, Cynoglossidae, Soleidae, ...""",0,0,0,0,0,0,0,0,0,,,0,0,0,0,0,0,0,0,0,0,,53,2,10,0,0,19,1,8,0,
30455,"Fresh or chilled meat, whether or not minced, of toothfish """"Dissostichus spp."""" (excluding ...""",0,0,0,0,0,0,0,0,0,,,0,0,0,0,0,0,0,0,0,0,,0,0,0,0,0,0,0,0,0,
30485,"Frozen fillets of toothfish """"Dissostichus spp.""""""""",0,0,0,0,0,0,0,0,0,,,0,0,0,0,0,0,0,0,0,0,,0,0,0,0,0,0,0,0,1,
30487,"Frozen fillets of tuna """"of the genus Thunnus"""", skipjack or stripe-bellied bonito """"Euthynnus ...""",0,0,0,0,0,0,0,0,0,,,0,0,0,5,0,6,21,36,117,8,,8592,7103,14940,27432,18789,11748,8543,13566,8963,14857
30542,"Smoked herring """"Clupea harengus, Clupea pallasii"""", incl. fillets (excluding offal)""""",0,0,0,0,0,0,0,0,0,,,0,0,0,0,0,0,17,0,0,0,,4,0,0,0,0,0,0,0,0,
30549,"Smoked fish, incl. fillets (excluding offal, Pacific salmon, Atlantic salmon, Danube salmon, ...",0,0,0,0,0,0,0,0,0,,,0,243,0,0,0,0,0,0,0,0,,5,0,0,0,1,9,4,0,15,10
30579,"Fish fins and other edible fish offal, smoked, dried, salted or in brine (excluding heads, ...",0,0,0,0,0,0,0,0,0,,,0,0,0,0,0,0,0,0,0,0,,80,42,17,2048,2152,4178,4890,4547,3583,1680
30619,"Frozen crustaceans, even smoked, fit for human consumption, whether in shell or not, incl. ...",0,0,0,0,0,0,0,0,0,,,261,0,0,0,0,67,0,2097,64,0,,1686,36,3,0,110,194,0,115,117,529
30627,"Shrimps and prawns, even smoked, whether in shell or not, live, fresh, chilled, dried, salted ...",0,0,0,0,0,0,0,0,0,,,576,441,437,5,18,0,0,369,0,0,,9674,9453,17067,14558,14554,16301,0,0,0,
30732,"Mussels """"Mytilus spp., Perna spp."""", frozen, even in shell""""",0,0,0,0,0,0,0,0,0,,,0,0,0,0,0,0,0,0,0,0,,0,0,0,0,0,0,995,2155,1306,783
30751,"Octopus """"Octopus spp."""", live, fresh or chilled""""",0,0,0,0,0,0,0,0,0,,,0,0,0,0,0,0,0,0,0,0,,0,4,0,0,1,193,25,0,79,
30789,"Smoked, frozen, dried, salted or in brine, abalone """"Haliotis spp."""", even in shell""""",0,0,0,0,0,0,0,0,0,,,0,0,0,0,0,0,0,0,0,0,,0,30,288,165,649,238,0,0,0,
40310,"Yogurt, whether or not flavoured or containing added sugar or other sweetening matter, fruits, ...",0,0,0,0,0,0,0,0,0,,,85198,165469,176384,236038,124378,208126,190334,188062,108693,111012,,6506,4899,7218,7193,7243,5964,4203,7019,7929,12694
40721,"Fresh eggs of domestic fowls, in shell (excluding fertilised for incubation)",0,0,0,0,0,0,0,0,0,,,51381,71895,62774,8177,26963,15232,981,1472,68,7293,,0,0,0,0,0,0,0,0,0,
40891,"Dried birds' eggs, not in shell, whether or not sweetened (excluding egg yolks)",0,0,0,0,0,0,0,0,0,,,83,0,0,17,2,24,0,365,101,252,,1280,1850,1705,1934,1814,2957,3353,3564,3143,4205
50800,"Coral and similar materials, shells of molluscs, crustaceans or echinoderms, cuttle-bone, powder ...",0,0,0,0,0,0,0,0,0,,,0,0,0,1,0,0,0,0,0,17,,5102,4571,5591,6028,5873,5669,4044,5943,5422,4289
60420,"Foliage, branches and other parts of plants, without flowers or flower buds, and grasses, mosses ...",0,0,0,0,0,0,0,0,0,,,32,0,0,0,144,214,149,131,74,88,,48,3,2,26,45,44,36,74,169,916
70190,Fresh or chilled potatoes (excluding seed),0,0,0,0,0,0,0,0,0,,,22948,0,0,9,0,0,22,0,0,13,,11367,12908,11256,10380,15287,21318,16476,21561,25788,124652
70529,Fresh or chilled chicory (excluding witloof chicory),0,0,0,0,0,0,0,0,0,,,394,2388,2985,3357,2875,3075,1401,582,15,0,,0,0,0,21,2,14,40,168,54,3
70610,Fresh or chilled carrots and turnips,0,0,0,0,0,0,0,0,0,,,1130,909,682,1476,1834,2849,2459,2307,1299,1445,,8949,9341,9847,12538,13866,16896,15407,17436,19932,92807
70810,"Fresh or chilled peas """"Pisum sativum"""", shelled or unshelled""""",0,0,0,0,0,0,0,0,0,,,49,61,38,295,65,82,262,326,178,369,,32,209,301,468,467,234,176,292,119,4484
71021,"Shelled or unshelled peas """"Pisum sativum"""", uncooked or cooked by steaming or by boiling ...""",0,0,0,0,0,0,0,0,0,,,132,39,157,335,479,909,447,206,447,538,,231,424,353,432,424,531,676,702,633,459
71090,"Mixtures of vegetables, uncooked or cooked by steaming or by boiling in water, frozen",0,0,0,0,0,0,0,0,0,,,4469,4989,0,14,33,172,321,360,6,9,,28,58,59,110,109,232,346,394,577,750
71140,"Cucumbers and gherkins provisionally preserved, e.g. by sulphur dioxide gas, in brine, in sulphur ...",0,0,0,0,0,0,0,0,0,,,0,87,45,142,7,19,17,17,461,939,,4,13,123,8,13,20,186,360,12,124
71239,"Dried mushrooms and truffles, whole, cut, sliced, broken or in powder, but not further prepared ...""",0,0,0,0,0,0,0,0,0,,,597,338,64,29,9,27,9,0,0,0,,3807,4209,7306,8344,8782,34646,136560,131661,20034,83481
71320,"Dried, shelled chickpeas """"garbanzos"""", whether or not skinned or split""""",0,0,0,0,0,0,0,0,0,,,1519,1123,973,1598,924,1414,882,1334,927,908,,189,1117,76,22,14,58,87,84,188,486
71332,"Dried, shelled small red """"Adzuki"""" beans """"Phaseolus or Vigna angularis"""", whether or not ...""",0,0,0,0,0,0,0,0,0,,,0,35,0,255,3,50,130,55,185,38,,276,233,263,394,276,1772,1506,633,916,9688
71335,"Dried, shelled cow peas """"Vigna unguiculata"""", whether or not skinned or split""""",0,0,0,0,0,0,0,0,0,,,0,0,0,0,1,0,0,0,0,0,,48,0,113,127,6201,219,245,547,560,1010
71340,"Dried, shelled lentils, whether or not skinned or split",0,0,0,0,0,0,0,0,0,,,0,377,112,398,298,186,370,81,96,9,,7,0,5,7,81,38,140,81,139,374
80131,"Fresh or dried cashew nuts, in shell",0,0,0,0,0,0,0,0,0,,,69,141,178,167,211,77,47,0,0,0,,321547,589723,627454,1105038,1626834,2523137,1900260,1668415,1418765,363369
80212,"Fresh or dried almonds, shelled",0,0,0,0,0,0,0,0,0,,,284,261,1292,1118,606,534,392,5,19,41,,969,1106,1569,3692,16208,28089,99311,91228,75453,88981
80410,Fresh or dried dates,0,0,0,0,0,0,0,2,0,,,74860,102943,129670,140135,141564,182379,201393,229833,245969,322840,,169,394,280,281,410,396,1010,1592,774,1638
80440,Fresh or dried avocados,0,0,0,0,0,0,0,0,0,,,43,45,0,21,139,191,94,28,0,0,,39,42,54,46,68,0,0,0,0,27
80620,Dried grapes,0,0,0,0,0,0,0,0,0,,,4562,5552,5170,5836,460,478,316,6,8,0,,4409,5651,4912,5784,5819,4950,9128,14527,9935,15269
80921,"Fresh sour cherries """"Prunus cerasus""""""""",0,0,0,0,0,0,0,0,0,,,0,0,0,49,83,41,8,0,0,0,,1508,1772,3015,3344,3879,2982,5026,3227,1339,1571
81110,"Frozen strawberries, uncooked or cooked by steaming or boiling in water, whether or not sweetened",0,0,0,0,0,0,0,0,0,,,0,0,0,70,7,17,71,0,0,0,,364,234,565,124,174,558,1237,2039,914,1220
81290,"Fruit and nuts, provisionally preserved, e.g. by sulphur dioxide gas, in brine, in sulphur ...",0,0,0,0,0,0,0,0,0,,,0,0,0,14,0,0,0,0,0,0,,4,3,0,9,26,89,36,17,85,46
81350,Mixtures of nuts or dried fruits,0,0,0,0,0,0,0,0,0,,,56,67,0,39,37,32,4,0,7,10,,184,26,20,117,219,320,417,133,183,233
90121,Roasted coffee (excluding decaffeinated),0,0,0,0,0,0,0,0,0,,,74,115,220,283,876,419,997,182,219,1793,,879,923,1636,1576,2251,2625,2418,2510,1887,3800
90240,"Black fermented tea and partly fermented tea, whether or not flavoured, in immediate packings ...",0,0,0,0,0,0,0,0,0,,,1401,876,2850,2247,1165,3153,2921,245,2376,1950,,1544,2517,4404,4330,3547,1861,7557,7454,6138,90559
90412,"Pepper of the genus Piper, crushed or ground",0,0,0,0,0,0,0,0,0,,,408,153,556,1703,200,121,771,6,3,4,,99,142,299,1172,1391,1270,656,723,2006,2007
90811,"Nutmeg, neither crushed nor ground",0,0,0,0,0,0,0,0,0,,,0,0,72,95,0,0,0,0,0,0,,8956,9139,8413,8072,5653,9819,10472,10279,10695,17281
90822,"Mace, crushed or ground",0,0,0,0,0,0,0,0,0,,,,,,,,,,,,,,0,0,137,145,47,10,14,0,0,481
90831,"Cardamoms, neither crushed nor ground",0,0,0,0,0,0,0,0,0,,,1835,1155,1866,3894,2664,1757,3660,0,351,27,,0,702,230,76,98,718,77,71,128,7506
90961,"Juniper berries and seeds of anise, badian, caraway or fennel, neither crushed nor ground",0,0,0,0,0,0,0,0,0,,,0,34,0,118,62,14,29,0,4,10,,481,680,1109,952,816,764,1363,1348,1247,41092
91099,"Spices (excluding pepper of the genus Piper, fruit of the genus Capsicum or of the genus Pimenta, ...""",0,0,0,0,0,0,1,0,0,,,12490,11820,20474,22761,16156,6983,4084,2092,1810,1604,,171,294,321,583,102,241,217,534,936,2445
100111,Durum wheat seed for sowing,0,0,0,0,0,0,0,0,0,,,0,0,0,2,17,0,0,0,0,0,,120,0,0,0,0,0,0,0,0,
100620,Husked or brown rice,0,0,0,0,0,0,0,0,0,,,954,713,1071,2161,1247,4129,2360,0,0,0,,9,6,51,4,316,78,106,154,439,240
110813,Potato starch,0,0,0,0,0,0,0,0,0,,,624,515,0,0,13,2,20,0,37,0,,4403,4347,4161,5279,7100,7619,9078,9756,12569,8291
110820,Inulin,0,0,0,0,0,0,0,0,0,,,0,0,0,0,0,0,0,0,0,0,,330,452,327,3234,4711,5092,3047,4874,4494,1656
120230,"Groundnut seed, for sowing",0,0,0,0,0,0,0,0,0,,,0,0,0,0,16,0,0,0,0,0,,0,0,0,0,0,0,0,0,0,605
120730,Castor oil seeds,0,0,0,0,0,0,0,0,0,,,0,0,0,1,0,0,0,0,0,0,,0,0,0,0,0,0,0,0,0,3475
120760,"Safflower """"Carthamus tinctorius"""" seeds""""",0,0,0,0,0,0,0,0,0,,,0,0,0,0,0,0,0,0,0,0,,0,0,0,0,0,0,0,66,127,154
121300,"Cereal straw and husks, unprepared, whether or not chopped, ground, pressed or in the form ...",0,0,0,0,0,0,0,0,0,,,0,0,68,51,86,9,15,0,0,5,,56,50,65,30,38,22,15,14,8,119
130190,"Lac; natural gums, resins, gum-resins, balsams and other natural oleoresins (excluding gum ...",0,0,0,0,0,0,0,0,0,,,544,765,375,133,390,209,104,153,0,15,,3246,6266,5831,8777,12235,16759,25949,22270,16483,20628
130211,Opium,0,0,0,0,0,0,0,0,0,,,,,,,,,,,,,,7,25,0,1,0,9,2,16,1,54
130213,Extracts of hops,0,0,0,0,0,0,0,0,0,,,0,0,0,0,0,0,0,0,0,0,,5114,5315,6178,9311,9463,12062,18347,18310,14780,12533
150710,"Crude soya-bean oil, whether or not degummed",0,0,0,0,0,0,0,0,0,,,95271,69714,53502,50985,33001,25471,45941,37369,53748,65387,,41243,70521,83310,117267,47371,33897,33531,38582,51705,62412
151521,Crude maize oil,0,0,0,0,0,0,0,0,0,,,1363,27,0,1170,6967,1604,226,3,447,4342,,0,0,0,0,15,0,0,0,23,152
151530,"Castor oil and fractions thereof, whether or not refined, but not chemically modified",0,0,0,0,0,0,0,0,0,,,27,0,0,2,0,6,0,0,4,10,,1077,1228,1270,1152,1285,1668,1743,1872,1568,2616
151790,Edible mixtures or preparations of animal or vegetable fats or oils and edible fractions of ...,0,0,0,0,0,0,0,0,0,,,0,0,161,109,830,1427,1504,860,368,12,,34762,28572,28204,24200,27723,32134,34578,32165,24425,62717
152190,"Beeswax, other insect waxes and spermaceti, whether or not refined or coloured",0,0,0,0,0,0,0,0,0,,,0,0,0,12,1,0,0,0,109,0,,446,446,404,497,193,359,492,581,343,462
160100,"Sausages and similar products, of meat, meat offal, blood or insects; food preparations based ...",0,0,0,0,0,0,0,0,0,,,352,17566,14966,11251,13285,11867,10233,3951,2973,2898,,427,203,451,1322,801,591,1148,979,945,2821
160241,"Hams of swine and cuts thereof, prepared or preserved",0,0,0,0,0,0,0,0,0,,,,,,,,,,,,,,4,8,1,174,171,249,275,416,361,1993
160510,"Crab, prepared or preserved (excluding smoked)",0,0,0,0,0,0,0,0,0,,,0,0,0,663,0,50,0,0,0,0,,70,48,161,45,93,397,40,39,133,760
170290,"Sugars in solid form, incl. invert sugar and chemically pure maltose, and sugar and sugar syrup ...",0,0,0,0,0,0,0,0,0,,,627,929,769,1724,1207,8739,9272,8940,7162,4069,,21244,26226,28274,27193,36852,34121,33233,34248,35927,28830
170390,Beet molasses resulting from the extraction or refining of sugar,0,0,0,0,0,0,0,0,0,,,0,0,0,17,0,317,481,79,31,12,,17328,5969,7479,11865,6804,10273,3400,7893,8091,11923
170410,"Chewing gum, whether or not sugar-coated",0,0,0,0,0,0,0,0,0,,,25839,30074,25728,24579,21864,21908,27973,26122,22817,26741,,24232,21327,16445,13603,12922,12687,10940,11889,10766,10835
180690,"Chocolate and other preparations containing cocoa, in containers or immediate packings of <= ...",0,0,0,0,0,0,0,0,0,,,2112,2724,2523,2838,7826,12277,34111,24324,1544,2114,,4097,4853,5889,7168,8951,12292,18080,21456,19012,103421
190110,"Food preparations for infant use, put up for retail sale, of flour, groats, meal, starch or ...",0,0,0,0,0,0,0,0,0,,,860,2276,7452,8975,949,3445,7366,14010,7871,18721,,268890,273827,237101,230898,258559,290454,230119,271836,286014,304316
190510,Crispbread,0,0,0,0,0,0,0,0,0,,,747,445,305,348,20,3,16,104,14,122,,293,526,652,604,228,62,29,107,214,2506
200390,"Mushrooms and truffles, prepared or preserved otherwise than by vinegar or acetic acid (excluding ...""",0,0,0,0,0,0,0,0,0,,,0,0,0,24,12,7,121,0,0,0,,172,142,491,1136,869,1221,1194,1296,2040,143518
200591,"Bamboo shoots, prepared or preserved otherwise than by vinegar or acetic acid (excluding frozen)",0,0,0,0,0,0,0,0,0,,,0,0,0,0,0,0,0,0,0,0,,4,88,22,97,150,204,293,260,566,12583
200710,"Homogenised preparations of jams, jellies, marmalades, fruit or nut pur?es and nut pastes, ...",0,0,0,0,0,0,0,0,0,,,81,96,0,167,36,204,88,97,73,48,,1141,573,461,218,246,289,367,431,294,472
200939,"Single citrus fruit juice, unfermented, Brix value > 20 at 20¡ÆC, whether or not containing ...",0,0,0,0,0,0,0,0,0,,,591,111,8752,20579,6856,3829,7277,2435,0,0,,340,215,394,426,582,767,247,323,329,205
200981,"Cranberry """"Vaccinium macrocarpon, Vaccinium oxycoccos, Vaccinium vitis-idaea"""" juice, unfermented, ...""",0,0,0,0,0,0,0,0,0,,,35,563,658,218,493,651,682,2110,2155,2927,,332,65,64,322,361,240,210,467,414,462
210220,Inactive yeasts; other dead single-cell micro-organisms (excluding packaged as medicaments),0,0,0,0,0,0,0,0,0,,,46,42,0,37,10,56,83,32,0,7,,6285,7898,3960,3643,5580,5543,5722,5978,5910,11269
210410,Soups and broths and preparations therefor,0,0,0,0,0,0,0,0,0,,,2452,3470,3700,1739,1785,2233,1523,980,1708,1784,,615,557,579,881,1329,1332,1879,1781,2020,6690
210690,"Food preparations, n.e.s.",0,0,0,0,0,0,0,0,0,,,7117,8703,8022,10108,8531,11114,19647,16531,19116,19447,,227800,369031,426041,476915,509664,526542,586243,798919,795842,949841
220300,Beer made from malt,0,0,0,0,0,0,0,0,0,,,,,,,,,,,,,,3377,3358,11684,7524,8194,11185,12614,15914,7135,25009
220510,"Vermouth and other wine of fresh grapes, flavoured with plants or aromatic substances, in containers ...",0,0,0,0,0,0,0,0,0,,,,,,,,,,,,,,159,118,28,15,38,2,51,28,1,761
230110,"Flours, meals and pellets, of meat or offal, unfit for human consumption; greaves",1759,3972,8276,6560,14367,18364,25667,26163,13689,,,0,0,0,536,199,0,0,235,0,0,,203934,267427,264428,273332,246216,242169,328544,349234,379548,298877
230330,Brewing or distilling dregs and waste,0,0,0,0,0,0,0,0,0,,,0,0,0,0,0,0,0,0,0,0,,146839,128261,176657,148350,212040,142919,234197,303727,270206,392174
230641,"Oilcake and other solid residues, whether or not ground or in the form of pellets, resulting ...""",0,0,0,0,0,0,0,0,0,,,0,0,0,0,0,0,0,0,0,0,,26500,34124,39043,30083,29518,25263,22270,13492,8887,18082
240399,"Chewing tobacco, snuff and other manufactured tobacco and manufactured tobacco substitutes, ...""",0,0,0,0,0,0,0,0,0,,,1241,1162,993,1106,614,555,0,0,0,0,,0,0,0,30,75,134,209,394,604,2108
250200,Unroasted iron pyrites,0,0,0,0,0,0,0,0,0,,,0,0,37,0,0,0,0,0,0,0,,0,0,6,16,0,0,6,13,38,136
250700,"Kaolin and other kaolinic clays, whether or not calcined",0,0,0,0,0,0,0,0,0,,,142,0,243,124,0,117,0,0,0,0,,15806,14601,18156,19369,19730,22533,27072,26128,26480,36003
251010,"Natural calcium phosphates and natural aluminium calcium phosphates, natural and phosphatic ...",0,0,0,0,0,0,0,0,0,,,0,0,0,1,1,0,0,0,0,0,,2,139,2,0,110,74,4,104,70,
251020,"Natural calcium phosphates and natural aluminium calcium phosphates, natural and phosphatic ...",0,0,0,0,0,0,0,0,0,,,0,0,0,0,0,0,0,0,0,0,,1587,932,567,575,458,490,304,227,266,77
251611,"Granite, crude or roughly trimmed (excluding already with the characteristics of setts, curbstones ...",0,0,0,0,0,0,0,0,0,,,72,0,0,0,0,0,0,0,0,0,,3,342,1262,2973,2462,882,808,229,274,4842
251749,"Granules, chippings and powder, whether or not heat-treated, of travertine, ecaussine, alabaster, ...",0,0,0,0,0,0,0,0,0,,,1099,0,0,11,0,0,0,0,0,0,,2538,2804,1292,1512,2523,3266,2286,2341,1460,487
252620,"Natural steatite and talc, crushed or powdered",0,0,0,0,0,0,0,0,0,,,300,622,415,485,573,477,268,307,227,265,,5513,6525,7130,7607,8773,9213,10002,11729,12560,11476
252921,Fluorspar containing by weight <= 97% calcium fluoride,0,0,0,0,0,0,0,0,0,,,1794,975,0,0,0,243,786,0,0,0,,176,64,399,40,666,594,875,1100,1052,2412
252930,"Leucite, nepheline and nepheline syenite",0,0,0,0,0,0,0,0,0,,,0,0,0,0,0,0,0,0,0,0,,719,950,964,725,892,932,799,805,944,297
253010,"Vermiculite, perlite and chlorites, unexpanded",0,0,0,0,0,0,0,0,0,,,0,0,0,0,0,27,7,0,0,0,,333,244,275,2607,277,252,692,769,480,1908
253020,"Kieserite and epsomite """"natural magnesium sulphates""""""""",0,0,0,0,0,0,0,0,0,,,0,0,0,1,0,0,0,0,0,0,,198,0,0,65,71,32,109,1,2,
260300,Copper ores and concentrates,0,0,0,0,0,0,0,0,0,,,11399,71435,69170,84453,113836,177364,457934,381136,472944,673809,,344,2045,3317,10745,15651,21681,4646,257,73,584
260800,Zinc ores and concentrates,0,0,0,0,0,0,0,0,0,,,27225,48777,38236,37328,20837,15272,81903,28909,52487,52939,,0,0,117,30,205,138,431,714,367,1314
262011,Hard zinc spelter,0,0,0,0,0,0,0,0,0,,,0,0,0,0,0,0,57,0,34,384,,0,0,11,1240,3760,4966,0,0,0,
262030,"Slag, ash and residues containing mainly copper",0,0,0,0,0,0,0,0,0,,,0,0,0,94,160,13,386,0,0,0,,127,73,0,0,0,3,0,0,0,
262040,"Slag, as and residues containing mainly aluminium",0,0,0,0,0,0,0,0,0,,,0,0,1106,13679,110,85,0,0,0,0,,5,8,2,3,3,12,22,8,8,626
262060,"Slag, ash and residues, containing arsenic, mercury, thallium or their mixtures, of a kind ...",0,0,0,0,0,0,0,0,0,,,0,0,0,0,0,0,0,0,0,0,,0,0,0,0,0,0,0,0,0,
270112,"Bituminous coal, whether or not pulverised, non-agglomerated",0,0,0,0,0,0,0,0,0,,,0,0,0,10,0,0,0,0,0,0,,175590,186418,185360,240889,398005,823290,1243149,1634989,1415077,2254665
270820,Pitch coke obtained from coal tar or from other mineral tars,0,0,0,0,0,0,0,0,0,,,0,0,0,0,0,0,0,0,0,0,,127,148,125,108,75,79,252,256,18,511
271311,"Petroleum coke, non-calcined",0,0,0,0,0,0,1577,0,324,,,0,0,0,0,0,0,0,0,0,0,,8050,7528,5618,5890,3586,25126,4972,6501,15676,6291
280110,Chlorine,0,0,0,0,0,0,0,0,0,,,30,436,530,696,716,573,395,360,279,447,,33,60,122,119,142,87,13,168,37,42
280200,"Sulphur, sublimed or precipitated; colloidal sulphur",0,0,0,0,0,0,0,0,0,,,13610,0,10225,4363,12890,88179,12476,17324,4094,43,,3080,1350,977,1037,860,948,1149,1280,1538,328
280410,Hydrogen,0,0,0,0,0,0,0,0,0,,,0,52,41,87,176,121,45,26,18,19,,23,183,7,16,36,122,17,36,21,49
280429,Rare gases (excluding argon),0,0,0,0,0,0,0,0,0,,,1863,1135,666,887,510,450,447,817,862,1558,,2007,2043,3034,2293,2679,3501,3796,4490,4033,2585
280440,Oxygen,0,0,0,0,0,0,0,0,0,,,214,271,1268,860,835,1159,1274,608,233,1637,,53,64,122,108,217,190,171,192,248,441
280461,"Silicon containing >= 99,99% by weight of silicon",0,0,0,0,0,0,0,0,0,,,0,0,0,71,0,69,0,0,0,0,,98,217,386,424,522,1543,24868,34616,35920,123366
280700,Sulphuric acid; oleum,0,0,0,0,0,0,0,0,0,,,3629,2724,1539,1531,1633,2641,1450,2256,2481,1374,,11123,7013,6670,10997,12915,22544,26937,21488,13864,26124
280920,"Phosphoric acid; polyphosphoric acids, whether or not chemically defined",0,0,0,0,0,0,0,0,0,,,184,60,0,28,45,83,354,281,27,129,,5183,5603,5672,7574,7746,8642,10927,8772,13929,15485
281213,Phosphorus trichloride,0,0,0,0,0,0,0,0,0,,,0,0,0,0,0,0,0,0,0,0,,0,0,0,0,0,0,0,0,0,164
281610,Hydroxide and peroxide of magnesium,0,0,0,0,0,0,0,0,0,,,0,0,0,2,0,0,0,0,0,0,,3151,4153,3181,2793,2672,3276,3088,2869,2873,3154
281640,"Oxides, hydroxides and peroxides, of strontium or barium",0,0,0,0,0,0,0,0,0,,,0,0,0,0,0,0,0,0,0,0,,58,68,65,135,136,82,537,128,119,98
282410,"Lead monoxide """"litharge, massicot""""""""",0,0,0,0,0,0,0,0,0,,,0,0,0,0,0,0,0,0,0,0,,607,689,674,686,1020,1199,1247,1259,1359,2942
282630,"Sodium hexafluoroaluminate """"synthetic cryolite""""""""",0,0,0,0,0,0,0,0,0,,,240,111,0,219,1797,1469,0,0,0,0,,120,229,226,269,368,142,28,88,49,123
282710,Ammonium chloride,0,0,0,0,0,0,0,0,0,,,0,0,0,9,6,2,0,0,0,6,,3027,2141,2115,4533,20208,25871,28018,35356,27914,62492
282720,Calcium chloride,0,0,0,0,0,0,0,0,0,,,205,189,145,238,151,216,216,0,4,177,,1351,1784,3494,3104,2345,3281,4060,4447,5428,22157
283421,Nitrate of potassium,0,0,0,0,0,0,0,0,0,,,124,49,0,327,0,132,6,0,0,0,,1627,1098,1869,3117,4811,7771,5794,5584,4189,6643
283692,Strontium carbonate,0,0,0,0,0,0,0,0,0,,,0,0,0,0,0,0,0,0,0,0,,416,724,587,710,846,1079,1378,1686,1159,399
284020,"Borates (excluding disodium tetraborate """"refined borax"""")""""",0,0,0,0,0,0,0,0,0,,,0,0,0,0,16,9,181,0,0,0,,771,1892,2614,2683,1135,1014,1204,941,1226,891
284161,Potassium permanganate,0,0,0,0,0,0,0,0,0,,,85,0,0,34,22,20,11,0,0,0,,1225,1332,1241,1446,2265,3054,4841,7008,8699,8717
