845941,"Boring machines for metals, numerically controlled (excl. way-type unit head machines and boring-milling ...",0,0,0,0,0,0,0,0,0,,,0,0,0,0,0,0,0,0,0,0,,0,0,0,0,0,0,805,1140,1758,1510
845961,"Milling machines for metals, numerically controlled (excluding way-type unit head machines, ...",0,0,0,0,0,0,0,0,0,,,0,0,48,10,202,0,102,0,0,0,,9906,19151,20601,28063,30580,31796,56422,74465,46188,13240
846011,"Flat-surface grinding machines, for working metal, in which the positioning in any one axis ...",0,0,0,0,0,0,0,0,0,,,0,503,0,0,0,0,0,0,0,0,,993,1957,2044,4030,4179,13520,0,0,0,
846031,"Sharpening """"tool or cutter grinding"""" machines, numerically controlled""""",0,0,0,0,0,0,0,0,0,,,0,0,0,0,26,5,3,0,0,0,,1114,554,2322,2435,2466,2396,4719,8449,7524,10426
846040,"Honing or lapping machines, for working metals, metal carbides or cermets (excluding gear cutting, ...",0,0,0,0,0,0,0,0,0,,,0,0,0,1,11,0,0,0,0,0,,2380,4066,3000,1959,2586,4872,3127,18385,2436,7752
846229,"Bending, folding, straightening or flattening machines for flat products (excl. numerically ...",0,0,0,0,0,0,0,0,0,,,270,982,589,955,1251,237,195,0,0,0,,36249,40260,38392,45105,50441,56079,54405,55593,32344,23116
846390,"Machine tools for working metal, sintered metal carbides or cermets, without removing metal ...",0,0,0,0,0,0,0,0,0,,,812,39,287,140,916,424,266,0,0,0,,30685,25499,30227,35039,26044,24560,25558,21434,14348,10076
846490,"Machine tools for working stones, concrete, asbestos cement or similar mineral substances or ...",0,0,0,0,0,0,0,0,0,,,222,610,610,429,3568,29132,281,16,0,8,,19890,47517,32029,45845,61177,36762,54655,24614,23202,25673
846595,"Drilling or mortising machines for working wood, cork, bone, hard rubber, hard plastics or ...",0,0,0,0,0,0,0,0,0,,,282,35,0,16,12,32,32,0,0,0,,16214,9324,11242,13804,35040,20011,22062,39617,35728,61793
846596,"Splitting, slicing or paring machines, for working wood",0,0,0,0,0,0,0,0,0,,,0,69,172,734,206,59,87,0,0,3,,6706,4080,9994,5893,7524,7414,11646,12355,6782,115650
846610,"Tool holders, incl. tool holders for any type of tool for working in the hand, and self-opening ...",0,0,0,0,0,0,0,0,0,,,110,0,0,13,12,64,129,0,0,0,,10292,8115,7595,11348,10195,13010,14573,13201,11613,15771
846630,"Dividing heads and other special attachments for machine tools, n.e.s.",0,0,0,0,0,0,0,0,0,,,0,0,0,6,0,107,29,0,0,0,,1556,2131,2488,3549,4245,3600,4819,3897,2474,14618
846691,"Parts and accessories for machine tools for working stone, ceramics, concrete, asbestos-cement ...",0,0,0,0,0,0,0,0,0,,,36,0,228,79,2,23,18,0,0,0,,1800,1613,2429,8703,3384,4188,4215,4405,2150,13753
846711,"Tools for working in the hand, pneumatic, rotary type, incl. combined rotary-percussion",0,0,0,0,0,0,0,0,0,,,0,40,0,47,10,123,125,11,0,2967,,2639,2238,2813,2906,3488,3239,4201,4777,4385,8375
846722,"Saws for working in the hand, with self-contained electric motor",0,0,0,0,0,0,0,0,0,,,0,0,0,92,67,60,46,0,0,0,,2739,2989,3768,4354,4662,4884,4790,4065,6447,20167
846729,"Electromechanical tools for working in the hand, with self-contained electric motor (excluding ...",0,0,0,0,0,0,0,0,0,,,144,97,85,133,202,220,67,0,0,0,,21845,25102,35061,36880,40242,44100,44073,42868,46705,94754
846781,"Chainsaws for working in the hand, with self-contained non-electric motor",0,0,0,0,0,0,0,0,0,,,0,0,0,0,14,17,0,0,0,0,,14599,16217,18447,14950,14045,12948,12915,13256,11409,27846
846791,"Parts of chainsaws, for working in the hand, with self-contained electric or non-electric motor, ...",0,0,0,0,0,0,0,0,0,,,35,0,0,1,1,3,0,0,0,0,,5610,11003,3117,3620,2579,2521,2392,2386,1811,14046
847290,"Office machines, n.e.s.",0,0,0,0,0,0,0,0,0,,,3700,9020,1716,627,1084,260,478,0,0,0,,18902,30609,27157,24718,21286,28467,28876,31746,33783,21716
847310,"Parts and accessories for typewriters or word-processing machines of heading 8469, n.e.s.",0,0,0,0,0,0,0,0,0,,,320,63,1086,378,2260,0,0,0,0,0,,353,60,72,60,745,470,0,0,0,
847621,Automatic beverage-vending machines incorporating heating or refrigerating devices,0,0,0,0,0,0,0,0,0,,,0,180,0,43,0,111,66,0,0,0,,53,22,118,349,1011,1787,1019,1917,2613,1482
847740,Vacuum-moulding machines and other thermoforming machines for working rubber or plastics,0,0,0,0,0,0,0,0,0,,,80,27,1110,2429,187,229,280,161,0,0,,39407,28374,24729,23351,32832,26852,29821,36833,26771,35593
847780,"Machinery for working rubber or plastics or for the manufacture of products from these materials, ...",0,0,0,0,0,0,0,0,0,,,249,569,278,3061,215,131,436,80,0,18,,183767,276245,291776,344647,357441,400596,399760,565325,371136,313529
847910,"Machinery for public works, building or the like, n.e.s.",0,0,0,0,0,0,0,0,0,,,857,678,659,1445,3382,2728,3613,0,568,19,,13815,12252,38272,24233,12018,12189,14855,10731,12079,11902
847930,Presses for the manufacture of particle board or fibre building board of wood or other ligneous ...,0,0,0,0,0,0,0,0,0,,,0,0,0,0,111,3,185,0,0,0,,11426,9108,20718,26716,60716,53533,33098,27511,80921,17874
847950,"Industrial robots, n.e.s.",0,0,0,0,0,0,0,0,0,,,0,379,1716,573,1501,73,1251,0,8,0,,28851,30308,26673,28077,39992,64764,81427,138952,75908,54939
848071,Injection or compression-type moulds for rubber or plastics,0,0,0,0,0,0,0,0,0,,,274,335,511,180,506,483,675,0,130,32,,77823,66201,82405,100139,142649,140383,135082,166749,223820,485987
848130,"Check """"non-return"""" valves for pipes, boiler shells, tanks, vats or the like""""",0,0,0,0,0,0,15,0,0,,,38,526,224,2050,2112,3080,4595,1344,711,124,,61879,32911,23740,29972,26823,29086,23180,26874,28881,32086
848230,Spherical roller bearings,0,0,0,0,0,0,0,0,0,,,0,0,141,3,325,32,28,0,0,4,,1385,2249,2394,3529,5329,5297,3367,4957,5304,15642
848240,Needle roller bearings,0,0,0,0,0,0,0,0,0,,,0,0,0,0,0,9,347,0,0,0,,247,522,776,2108,2137,4108,5759,7424,8795,11259
848250,Cylindrical roller bearings (excluding needle roller bearings),0,0,0,0,0,0,0,0,0,,,0,0,86,0,39,41,97,0,0,2,,1249,2299,2045,6737,8260,5371,6181,6146,8849,22901
848390,"Toothed wheels, chain sprockets and other transmission elements presented separately; parts ...",0,0,0,0,0,0,0,0,0,,,2809,736,402,1146,4345,1423,1393,3,0,4,,15414,17952,28554,26261,27091,30418,33154,33969,37347,120725
848710,Ships' or boats' propellers and blades therefor,0,0,0,0,0,0,0,0,0,,,0,198,83,2,19,7,0,0,0,0,,32298,46437,28588,35871,54108,26365,27944,30636,29682,5517
850151,"AC motors, multi-phase, of an output > 37,5 W but <= 750 W",0,0,0,0,0,0,0,0,0,,,257,2613,297,197,237,913,178,0,0,0,,5482,6577,8500,9234,10418,10395,13198,20721,17428,41231
850164,"AC generators """"alternators"""", of an output > 750 kVA (excl. photovoltaic generators)""""",0,0,0,0,0,0,0,0,0,,,7468,6121,505,4824,10509,5590,6459,527,190,0,,40950,39990,41942,47018,53264,20264,45715,138063,65337,282968
850231,"Generating sets, wind-powered",0,0,0,0,0,0,0,0,0,,,0,0,0,0,0,3,21,0,0,0,,12,61,27,58563,262,6056,85531,100627,217143,998515
850490,"Parts of electrical transformers and inductors, n.e.s.",0,0,0,0,0,0,0,0,0,,,2577,3753,516,4483,3780,3199,5567,329,170,27,,98666,111092,101922,119866,93742,101541,108865,125232,164798,533442
850650,Lithium cells and batteries (excluding spent),0,0,0,0,0,0,0,0,0,,,213,30,231,314,618,777,249,0,0,0,,18492,9783,10496,10803,13351,27929,34399,78234,156660,60785
850860,"Vacuum cleaners, incl. dry cleaners and wet vacuum cleaners (excluding with self-contained ...",0,0,0,0,0,0,0,0,0,,,519,187,616,432,212,279,297,0,4,0,,6341,15429,7870,12997,9607,9692,11220,11509,7407,1437
850980,"Electromechanical domestic appliances, with self-contained electric motor (excluding vacuum ...",0,0,0,0,0,0,0,0,0,,,2164,534,488,1536,1606,499,523,0,0,0,,3673,3831,3044,4265,7503,48538,62847,86408,105462,75533
850990,"Parts of electromechanical domestic appliances, with self-contained electric motor, n.e.s. ...",0,0,0,0,0,0,0,0,0,,,27,0,0,29,12,49,7,0,0,0,,565,340,477,648,987,911,781,1473,1272,10047
851240,"Electrical windscreen wipers, defrosters and demisters, for motor vehicles",0,0,0,0,0,0,0,0,0,,,0,0,0,27,4,1,0,0,0,0,,5121,8696,5358,7478,8332,5785,8217,8573,6676,8693
851529,"Machines for resistance welding of metals, neither fully nor partly automatic",0,0,0,0,0,0,0,0,0,,,186,616,677,837,409,381,1070,0,0,0,,8705,9893,7482,14688,8252,6722,8864,9583,7856,7882
851580,"Electric machines and apparatus for laser or other light or photon beam, ultrasonic, electron ...",0,0,0,0,0,0,0,0,0,,,2514,3465,2041,5068,1162,987,1394,0,0,8,,24688,35966,44075,50773,61815,62202,84432,96794,108846,94100
851610,Electric instantaneous or storage water heaters and immersion heaters,0,0,0,0,0,0,0,0,0,,,26784,25267,28900,27489,26955,20754,17819,18981,19799,22776,,21724,15617,19185,23704,21252,27548,34315,42317,30322,21256
851714,Telephones for cellular networks or for other wireless networks (excl. line telephone sets ...,0,0,0,0,0,0,0,0,0,,,,,,,,,,,,,,0,0,0,0,0,0,0,0,0,
851830,"Headphones and earphones, whether or not combined with microphone, and sets consisting of a ...",0,0,0,0,0,0,0,0,0,,,318,198,573,315,268,259,848,22,0,0,,87705,83238,64725,39993,43262,53104,48513,65047,46788,147087
851981,"Sound recording or sound reproducing apparatus, using magnetic, optical or semiconductor media ...",0,0,0,0,0,0,0,0,0,,,0,0,144,2,33,2,0,0,0,0,,7571,7482,4075,2071,6688,10244,10674,11796,9865,9753
852349,Optical media for the recording of sound or of other phenomena (excluding unrecorded and goods ...,0,0,0,0,0,0,0,0,0,,,33,2389,919,245,164,59,1991,0,0,0,,10310,9453,13375,2754,19727,15354,16650,21863,21351,29100
852841,Cathode-ray tube monitors of a kind solely or principally used in an automatic data-processing ...,0,0,0,0,0,0,0,0,0,,,0,0,71,541,41,6,0,0,0,0,,15710,19218,21416,15278,4756,1483,0,0,0,
852859,"Monitors, not incorporating television reception apparatus (excluding with cathode ray tube ...",0,0,0,0,0,0,0,0,0,,,2094,744,880,1821,1914,1593,4106,8,128,0,,44028,43528,54998,53965,67607,89152,156666,294262,538752,93881
852990,"Parts suitable for use solely or principally with flat panel display modules, transmission ...",0,0,0,0,0,0,0,0,0,,,5828,7672,28049,38986,7202,12352,1687,0,17,0,,414170,653291,1208468,1734824,2235372,3131190,2695355,2934933,4545232,5241639
853010,"Electrical signalling, safety or traffic control equipment for railways or tramways (excluding ...",0,0,0,0,0,0,0,0,0,,,0,0,0,4,0,0,329,0,0,0,,974,470,14,40,842,10790,441,1174,2179,5599
853221,"Fixed electrical capacitors, tantalum (excluding power capacitors)",0,0,0,0,0,0,0,0,0,,,0,0,0,0,0,0,0,0,0,0,,18873,19124,11226,5410,4046,3288,3694,3527,8997,52552
853529,"Automatic circuit breakers for a voltage >= 72,5 kV",0,0,0,0,0,0,0,0,0,,,671,616,2745,1967,3574,5133,7236,2977,143,415,,5145,9851,5368,18197,10079,14606,10004,8573,5979,22503
853690,"Electrical apparatus for switching electrical circuits, or for making connections to or in ...",0,1,0,0,0,0,0,0,0,,,1076,591,2474,1758,1831,2111,6607,1206,1481,1549,,530528,774965,801458,803904,1265449,1725660,1716174,1898459,2079014,2154733
853720,"Boards, cabinets and similar combinations of apparatus for electric control or the distribution ...",0,0,0,0,0,0,0,0,0,,,474,111,715,429,2605,3327,1556,923,7854,11215,,86360,100146,162632,160600,108240,90599,128626,125986,119141,139113
854060,"Cathoderay tubes (excluding television and video-monitor cathoderay tubes, television camera ...",0,0,0,0,0,0,0,0,0,,,0,0,0,0,0,0,90,0,0,0,,22,20,10,9,9,2,20,20,30,71
854099,"Parts of thermionic, cold cathode or photo cathode valves and tubes, n.e.s. (excluding parts ...",0,0,0,0,0,0,0,0,0,,,0,84,153,42,167,7,43,0,0,0,,88,206,79,178,205,118,136,21,11,652
854390,"Parts of electrical machines and apparatus, having individual functions, n.e.s. in chapter ...",0,0,0,0,0,0,0,0,0,,,3754,2538,1030,1975,718,5686,1679,0,0,0,,16838,11362,16804,8521,15738,13708,37328,34479,52893,390276
854411,"Winding wire for electrical purposes, of copper, insulated",0,0,0,0,0,0,0,0,0,,,0,0,351,175,1142,586,420,1248,1708,17682,,179668,167168,166972,163897,186770,230615,249734,259089,272128,301026
854420,"Coaxial cable and other coaxial electric conductors, insulated",0,0,0,0,0,0,0,0,0,,,241581,179522,229684,291416,277652,273353,414574,332520,260007,169988,,45840,52335,69054,62509,91315,84845,100911,116009,120949,115471
854470,"Optical fibre cables made up of individually sheathed fibres, whether or not containing electric ...",0,0,0,0,0,0,0,0,0,,,4197,4310,1585,1389,8438,9428,10398,23679,20308,11582,,14531,17847,35119,64721,34825,40123,33524,29863,49742,39227
854511,"Electrodes of graphite or other carbon, for electric furnaces",0,0,0,0,0,0,0,0,0,,,0,193,0,0,60,8,10,166,434,191,,42696,31567,28131,24365,22349,97246,141291,65559,28039,43125
854590,"Articles of graphite or other carbon, for electrical purposes (excluding electrodes and carbon ...",0,0,0,0,0,0,0,0,0,,,88,0,0,220,251,321,593,0,0,0,,13611,11084,10818,6807,13044,10774,10035,11520,8470,45059
854620,Electrical insulators of ceramics (excluding insulating fittings),0,0,0,0,0,0,0,0,0,,,0,0,0,7,1,67,47,21,0,0,,3698,5183,6285,10749,8145,9972,8931,11651,12170,6668
854790,"Insulating fittings for electrical purposes, of materials other than ceramics or plastics; ...",0,0,0,0,0,0,0,0,0,,,469,187,32,65,268,187,310,199,76,52,,5579,5787,7771,6654,6301,12306,10656,10064,10530,11074
860729,"Brakes (other than air brakes), and parts thereof, for railway or tramway locomotives or rolling ...",0,0,0,0,0,0,0,0,0,,,96,0,0,19,285,689,29,0,0,0,,175,287,180,430,1476,646,398,582,753,1197
870110,Pedestrian-controlled agricultural tractors and similar tractors for industry (excluding tractor ...,0,0,0,0,0,0,0,0,0,,,1138,478,742,126,1316,4829,433,0,0,0,,1669,4527,2376,1248,1437,3345,3749,4055,3781,1003
870130,Track-laying tractors (excluding pedestrian-controlled),0,0,0,0,0,0,0,0,0,,,803,27,577,0,1516,1705,4759,25,0,0,,0,9,2,0,1,56,0,0,0,730
870191,"Tractors, of an engine power <= 18 kW (excl. those of heading 8709, pedestrian-controlled tractors, ...",0,0,0,0,0,0,0,0,0,,,,,,,,,,,,,,0,0,0,0,0,0,5132,1573,1968,12010
870240,"Motor vehicles for the transport of >= 10 persons, incl. driver, with only electric motor for ...",0,0,0,0,0,0,0,0,0,,,,,,,,,,,,,,0,0,0,0,0,0,319,538,73,117
870310,Vehicles for the transport of persons on snow; golf cars and similar vehicles,0,0,0,0,0,0,0,0,0,,,53,68,103,48,401,116,171,0,0,0,,2765,4805,3417,5905,12567,6837,9459,8625,5472,143658
870322,"Motor cars and other motor vehicles principally designed for the transport of persons, incl. ...",0,0,0,0,0,0,0,0,0,,,46031,186737,62326,15556,39730,36580,50491,0,0,0,,26330,27577,56186,129009,136969,248416,466716,913806,599519,519246
870360,"Motor cars and other motor vehicles principally designed for the transport of <10 persons, ...",0,0,0,0,0,0,0,0,0,,,0,0,0,0,0,0,0,0,0,0,,0,0,0,0,0,0,0,0,227,10739
870422,"Motor vehicles for the transport of goods, with only compression-ignition internal combustion ...""",0,0,0,0,0,0,0,0,0,,,12495,6091,16248,9060,12247,28512,24067,897,448,70,,20118,23603,43897,79628,77559,63752,33369,70519,35739,372639
870880,"Suspension systems and parts thereof, incl. shock-absorbers, for tractors, motor vehicles for ...",0,0,0,0,0,0,0,0,0,,,329,80,0,141,454,213,451,0,0,5,,25481,32400,44155,65766,79529,76909,65518,85720,75504,87528
871120,"Motorcycles, incl. mopeds, with reciprocating internal combustion piston engine of a cylinder ...",0,0,0,0,0,0,0,0,0,,,33,154,85,152,78,150,72,0,0,0,,66347,40856,54745,44999,48007,70037,216095,381287,328964,287099
871640,"Trailers and semi-trailers, not designed for running on rails (excluding trailers and semi-trailers ...",0,0,0,0,0,0,0,0,0,,,4169,1066,867,5418,1617,4663,2011,282,76,3,,16846,17865,23172,71913,11054,3756,2069,1311,352,12718
880211,Helicopters of an unladen weight <= 2.000 kg (excl. unmanned of heading 8806),0,0,0,0,0,0,0,0,0,,,1599,4414,2001,3,2683,278,0,0,0,0,,382,176,0,3797,0,0,0,3047,0,67
890110,"Cruise ships, excursion boats and similar vessels principally designed for the transport of ...",0,0,0,0,0,0,0,0,0,,,196,2456,2432,3718,274,24975,55257,0,2640,0,,130,26672,2342,4791,8082,4227,2056,2906,0,8945
890310,Inflatable vessels for pleasure or sports,0,0,0,0,0,0,0,0,0,,,0,30,0,10,6,0,0,0,0,0,,397,94,179,507,545,337,116,283,218,1179
890610,Warships of all kinds,0,0,0,0,0,0,0,0,0,,,,,,,,,,,,,,0,1,0,0,0,0,0,0,0,35024
900290,"Lenses, prisms, mirrors and other optical elements, mounted, of any material, being parts of ...",0,0,0,0,0,0,0,0,0,,,1616,381,293,32,324,183,165,139,0,0,,51213,93622,155261,337966,369005,406857,359803,339506,353836,38942
900319,"Frames and mountings for spectacles, goggles or the like (excluding of plastics)",0,0,0,0,0,0,0,0,0,,,0,0,46,104,146,253,109,0,0,0,,3278,2686,3571,3877,4596,4697,6112,7971,6344,4202
900410,Sunglasses,0,0,0,0,0,0,0,0,0,,,243,102,0,230,246,749,3304,12,0,19,,3876,4510,5665,5679,7390,7230,10383,11204,7298,11207
900490,"Spectacles, goggles and the like, corrective, protective or other (excluding spectacles for ...",0,0,0,0,0,0,0,0,0,,,0,0,0,457,143,202,315,16,4,0,,4347,8336,7473,4638,4337,4281,4557,5884,6978,21307
900651,"Cameras with a through-the-lens viewfinder [single lens reflex """"SLR""""] for roll film of a ...""",0,0,0,0,0,0,0,0,0,,,0,0,0,0,5,0,0,0,0,0,,0,1,0,0,0,5,0,2,1,307
900652,"Cameras for roll film of a width of < 35 mm (excluding instant print cameras, single lens ...""",0,0,0,0,0,0,0,0,0,,,0,0,0,0,0,0,0,0,0,0,,0,3,0,0,1,1,137,23,1,5
900699,"Parts and accessories for photographic flashlights and flashlight apparatus, n.e.s.",0,0,0,0,0,0,0,0,0,,,0,75,0,80,10,8,5,0,0,0,,359449,361052,430006,528685,392144,413606,376964,326210,496748,1103
901060,Projection screens,0,0,0,0,0,0,0,0,0,,,110,145,1043,346,186,282,484,0,6,2,,1849,1960,2033,2201,2437,2655,2283,2989,1631,2319
901420,Instruments and appliances for aeronautical or space navigation (excluding compasses and radio ...,0,0,0,0,0,0,0,0,0,,,81,0,264,521,2483,59,21,0,0,0,,5029,1139,2553,6366,7116,7905,3089,2066,2082,4968
901730,"Micrometers, callipers and gauges (excluding gauges without adjustable devices of subheading ...",0,0,0,0,0,0,0,0,0,,,0,379,0,42,17,39,197,0,0,0,,4806,5444,5522,5532,7146,6733,8596,8976,8270,5952
901849,"Instruments and appliances used in dental sciences, n.e.s.",0,0,0,0,0,0,0,0,0,,,337,716,344,1182,609,3229,1868,0,0,0,,9317,11248,10844,12192,14763,15420,18363,21500,18640,29074
902140,Hearing aids (excluding parts and accessories),0,0,0,0,0,0,0,0,0,,,0,0,39,0,0,40,0,0,0,0,,10066,9929,8810,8344,11722,16830,20269,29951,29854,107018
902490,Parts and accessories for machines and appliances for testing the mechanical properties of ...,0,0,0,0,0,0,0,0,0,,,127,1783,0,891,2071,148,264,0,0,0,,1604,1055,1380,2237,2375,2873,2268,2305,2293,5802
902519,"Thermometers and pyrometers, not combined with other instruments (excluding liquid-filled thermometers ...",0,0,0,0,0,0,0,0,0,,,0,133,140,251,57,140,401,0,0,0,,9608,9193,11711,14686,19486,15162,18935,23896,26869,49493
902820,"Liquid meters, incl. calibrating meters therefor",0,0,0,0,0,0,0,0,0,,,0,0,723,204,714,269,729,14,4,0,,15838,15684,19171,21822,23518,23463,22904,21033,20682,19870
903031,"Multimeters for voltage, current, resistance or electrical power, without recording device",0,0,0,0,0,0,0,0,0,,,31,106,92,153,395,106,47,0,0,0,,4363,5891,6804,7432,8131,9491,7987,11126,10976,5100
903082,Instruments and apparatus for measuring or checking semiconductor wafers or devices,0,0,0,0,0,0,0,0,0,,,0,0,62,186,81,52,561,13,0,0,,17588,8628,18842,11642,15787,23373,21275,73920,106001,37640
903089,"Instruments and apparatus for measuring or checking electrical quantities, without recording ...",0,0,0,0,0,0,0,0,0,,,1317,1134,1035,1246,1830,2384,2438,4,3,0,,7878,16243,17976,25360,20479,16973,22351,27085,28993,42053
903180,"Instruments, appliances and machines for measuring or checking, not elsewhere specified in ...",0,0,0,0,0,0,4,1,2,,,1052,2694,5535,6737,5298,7257,4452,20,22,2,,180663,288694,353264,415075,446259,1011990,703684,841370,760003,545154
910111,"Wrist-watches of precious metal or of metal clad with precious metal, whether or not incorporating ...",0,0,0,0,0,0,0,0,0,,,5107,7097,5637,1290,2747,6205,16277,0,0,0,,1019,1580,2214,1960,2589,3260,4795,3178,1750,3207
910299,"Pocket-watches and the like, incl. stop-watches, with hand or automatic winding (excluding ...",0,0,0,0,0,0,0,0,0,,,104,0,59,22,25,119,2356,0,0,0,,103,92,214,661,590,239,762,1838,554,346
910390,"Clocks with watch movements (excluding electrically operated, wrist-watches, pocket-watches ...",0,0,0,0,0,0,0,0,0,,,0,0,0,10,42,50,475,0,0,0,,4,4,2,3,5,5,1,3,1,90
910591,"Clocks, electrically operated (excluding wrist-watches, pocket-watches and other watches of ...",0,0,0,0,0,0,0,0,0,,,0,0,0,1,0,0,0,0,0,0,,216,119,90,202,1244,1520,1846,395,270,1326
911220,"Clock and watch cases (excluding for wrist-watches, pocket-watches and other watches of heading ...",0,0,0,0,0,0,0,0,0,,,0,0,0,13,38,2,0,0,0,6,,1,2629,14,5,16,12,19,38,18,63
911390,"Watch straps, watch bands and watch bracelets, and parts thereof, n.e.s.",0,0,0,0,0,0,0,0,0,,,0,149,0,1,2,1,30,0,0,4,,5048,12692,1640,1655,3140,7179,6463,19782,27304,45163
911440,Plates and bridges for clocks or watches,0,0,0,0,0,0,0,0,0,,,0,0,0,0,0,0,0,0,0,0,,1,7,31,17,1,10,0,8,2,1
920710,"Keyboard instruments, the sound of which is produced, or must be amplified, electrically (excluding ...",0,0,0,0,0,0,0,0,0,,,0,0,0,0,8,112,0,0,0,0,,12581,10082,8875,14143,11199,11801,10679,9237,7765,10351
920810,Musical boxes,0,0,0,0,0,0,0,0,0,,,0,0,0,0,0,0,0,0,0,0,,0,0,0,7,80,96,153,429,426,354
930190,"Military weapons, incl. sub-machine guns (excluding artillery weapons, rocket launchers, flame-throwers, ...",0,0,0,0,0,0,0,0,0,,,,,,,,,,,,,,0,0,0,0,0,0,0,0,0,238
930390,Firearms and similar devices which operate by the firing of an explosive charge (excluding ...,0,0,0,0,0,0,0,0,0,,,,,,,,,,,,,,0,0,0,0,0,0,0,0,0,142
930629,Parts of cartridges for smooth-barrelled shotguns; lead shot for air rifles and pistols,0,0,0,0,0,0,0,0,0,,,,,,,,,,,,,,0,0,0,0,0,0,0,0,0,18
940110,Seats for aircraft,0,0,0,0,0,0,0,0,0,,,56,82,30,1,101,227,81,0,0,0,,113,104,141,3440,3950,503,775,1180,265,554
940152,Seats of bamboo,0,0,0,0,0,0,0,0,0,,,0,0,0,0,0,0,0,0,0,0,,0,0,0,0,0,0,10,24,3,1
940153,Seats of rattan,0,0,0,0,0,0,0,0,0,,,0,0,0,0,0,0,0,0,0,0,,0,0,0,0,0,0,12,62,11,2
940171,"Upholstered seats, with metal frames (excluding seats for aircraft or motor vehicles, swivel ...",0,0,0,0,0,0,0,0,0,,,57,0,73,270,958,766,341,590,799,132,,2573,4475,6468,6889,8712,9572,12174,15920,12777,88721
940330,Wooden furniture for offices (excluding seats),0,0,0,0,0,0,0,0,0,,,471,1081,1541,1606,676,790,1283,124,74,183,,5906,4093,4401,3813,4376,4892,4791,6993,5030,8048
950440,Playing cards,0,0,0,0,0,0,0,0,0,,,0,0,0,26,6,33,47,0,0,0,,434,1184,903,1791,2469,2287,3118,4003,5183,41105
960200,Worked vegetable or mineral carving material and articles of these materials n.e.s; moulded ...,0,0,0,0,0,0,0,0,0,,,0,0,0,0,13,17,3,0,5,1,,5080,10729,9613,6783,6835,7265,6165,6294,6508,6187
960310,"Brooms and brushes, consisting of twigs or other vegetable materials bound together, with or ...",0,0,0,0,0,0,0,0,0,,,674,447,0,47,49,68,10,0,0,8,,5193,7772,7224,7049,14473,3492,1897,1870,3740,337
960329,"Shaving brushes, hair brushes, nail brushes, eyelash brushes and other brushes for use on the ...",0,0,0,0,0,0,0,0,0,,,117,61,113,239,173,207,275,68,4,0,,923,783,1037,1239,1374,1974,2854,2923,2245,5515
960629,"Buttons (excluding of plastics or base metal, not covered with textile material, press-fasteners, ...",0,0,0,0,0,0,0,0,0,,,0,0,55,45,15,5,0,0,0,0,,48220,50565,51137,52891,55497,54151,58256,57835,40044,10802
970190,Collages and similar decorative plaques,0,0,0,0,0,0,0,0,0,,,894,0,0,561,39,43,92,567,14,0,,19,205,140,62,406,202,162,238,240,352
10221,Pure-bred cattle for breeding,0,0,0,0,0,0,0,0,0,,,163,0,0,0,0,0,237,750,969,48,,11459,6170,9992,13451,3810,18402,8223,5471,15927,13578
10391,"Live swine, weighing < 50 kg (excluding pure-bred for breeding)",0,0,0,0,0,0,0,0,0,,,,,,,,,,,,,,0,0,0,7,0,31,30,44,2552,
10410,Live sheep,0,0,0,0,0,0,0,0,0,,,90334,15942,2650,2195,14680,38150,18378,16597,20149,13950,,17,0,0,0,13,0,0,7,56,
10420,Live goats,0,0,0,0,0,0,0,0,0,,,3558,5893,527,105,17,55,53,182,26,19,,56,40,121,0,1598,4426,64,0,49,168
10613,Live camels and other camelids [Camelidae],0,0,0,0,0,0,0,0,0,,,95796,83154,163138,71269,36692,54760,62210,11368,4770,8567,,0,0,0,85,8,93,7,26,6,
20120,"Fresh or chilled bovine cuts, with bone in (excluding carcases and 1/2 carcases)",0,0,0,0,0,0,0,0,0,,,0,0,0,0,5,0,0,0,0,0,,308,225,205,287,354,659,1132,1478,826,1003
20441,Frozen sheep carcases and half-carcases (excluding lambs),0,0,0,0,0,0,0,0,0,,,141,720,0,1315,198,630,611,27,0,0,,98,132,19,4,9,1,123,188,112,
20622,Frozen edible bovine livers,0,0,0,0,0,0,0,0,0,,,0,0,0,0,0,14,10,0,5,0,,0,0,0,1,0,0,0,0,0,178
20713,Fresh or chilled cuts and edible offal of fowls of the species Gallus domesticus,0,0,0,0,0,0,0,0,0,,,2913,11381,19674,26889,55800,37149,19692,30693,36592,62552,,14,0,0,0,0,0,0,0,0,1236
20726,Fresh or chilled cuts and edible offal of turkeys of the species domesticus,0,0,0,0,0,0,0,0,0,,,11271,0,41,495,65,10,5,0,0,0,,0,44,0,0,0,0,0,1,2,
20741,"Fresh or chilled domestic ducks, not cut in pieces",0,0,0,0,0,0,0,0,0,,,59,0,0,0,0,0,0,0,0,0,,1,8,15,5,3,4,0,0,0,
20743,"Fatty livers of domestic ducks, fresh or chilled",0,0,0,0,0,0,0,0,0,,,0,0,0,7,0,0,0,0,0,0,,19,9,10,10,16,10,24,24,5,21
30111,Live ornamental freshwater fish,0,0,0,0,0,0,0,0,0,,,0,0,0,0,0,9,0,75,0,0,,50,64,33,140,176,398,521,355,1123,8715
30193,"Live carp (Cyprinus carpio, Carassius carassius, Ctenopharyngodon idellus, Hypophthalmichthys ...",0,0,0,0,0,0,0,0,0,,,0,0,0,0,0,0,0,0,0,0,,1,63,164,207,963,266,3116,4321,2278,4328
30231,"Fresh or chilled albacore or longfinned tunas """"Thunnus alalunga""""""""",0,0,0,0,0,0,0,0,0,,,53,0,49,0,1,17,0,0,0,0,,0,0,0,0,0,0,0,0,0,
30243,"Fresh or chilled sardines """"Sardina pilchardus, Sardinops spp."""", sardinella """"Sardinella ...""",0,0,0,0,0,0,0,0,0,,,0,42,0,0,0,1,0,0,0,0,,0,0,0,0,1,0,0,0,13,
