530130,"Flax tow and waste, incl. yarn waste and garnetted stock",715,299,244,0,10,75,16,9,20,193
370255,"Photographic film, sensitised, in rolls, unexposed, with perforations, for colour photography ...""",509,194,104,83,17,115,44,12,32,192
731812,Wood screws of iron or steel (excluding coach screws),149,153,125,192,95,79,123,347,285,192
290372,Dichlorotrifluoroethanes,0,362,2031,967,1123,1103,1666,4405,201,191
830621,"Statuettes and other ornaments, of base metal, plated with precious metal (excluding works ...",557,505,1456,540,435,397,1276,247,389,189
285210,"Compounds, inorganic or organic, of mercury, chemically defined (excluding amalgams)",0,0,132,119,138,192,132,176,156,189
621139,"Men's or boys' tracksuits and other garments, n.e.s. of textile materials (excluding of cotton ...",190,165,263,204,261,269,260,184,177,188
551693,"Woven fabrics containing predominantly, but < 85% artificial staple fibres by weight, other ...",722,847,720,374,197,212,216,147,132,188
30357,"Frozen swordfish """"Xiphias gladius""""""""",0,1,239,139,73,73,7,129,29,187
920890,"Fairground organs, mechanical street organs, mechanical singing birds, musical saws and other ...",268,279,151,163,234,241,173,203,170,187
160530,"Lobster, prepared or preserved (excluding smoked)",80,80,47,55,234,1155,1317,111,320,186
282490,"Lead oxides (excluding monoxide """"litharge, massicot"""")""""",95,117,212,171,99,186,212,281,215,186
581010,"Embroidery on a textile fabric ground without visible ground, in the piece, in strips or in ...",610,632,721,593,591,669,415,193,189,185
30119,Live ornamental fish (excluding freshwater),0,24,380,347,357,357,289,200,242,185
620791,"Men's or boys' singlets and other vests, bathrobes, dressing gowns and similar articles of ...",279,430,326,207,259,234,223,153,236,185
110510,"Flour, meal and powder of potatoes",178,120,75,119,192,183,118,171,125,185
50690,"Bones and horn-cores and their powder and waste, unworked, defatted, degelatinised or simply ...",152,171,116,139,163,159,141,123,96,185
690410,"Building bricks (excluding those of siliceous fossil meals or similar siliceous earths, and ...",580,481,437,189,137,145,186,291,221,184
640510,"Footwear with uppers of leather or composition leather (excluding with outer soles of rubber, ...",381,314,300,470,402,381,350,350,308,183
284180,"Tungstates """"wolframates""""""""",247,186,108,179,348,407,354,761,346,183
480630,"Tracing papers, in rolls of a width > 36 cm or in square or rectangular sheets with one side ...",965,851,872,534,366,413,376,346,240,182
30244,"Fresh or chilled mackerel """"Scomber scombrus, Scomber australasicus, Scomber japonicus""""""""",0,2,52,71,109,93,128,164,169,182
910910,"Clock movements, complete and assembled, electrically operated (excluding watch movements)",0,24,336,402,437,280,234,234,180,182
600538,"Warp knit fabrics of synthetic fibres, of yarns of different colours """"incl. those made on ...""",0,0,0,0,0,483,286,286,251,180
731021,"Cans of iron or steel, of a capacity of < 50 l, which are to be closed by soldering or crimping ...",59,54,20,290,388,73,154,42,47,179
152000,"Glycerol, crude; glycerol waters and glycerol lyes",217,107,183,174,226,199,303,189,153,178
40140,"Milk and cream of a fat content by weight of > 6% but <= 10%, not concentrated nor containing ...",0,34,1001,693,788,316,58,0,122,177
300442,"Medicaments containing pseudoephedrine """"INN"""" or its salts, not containing hormones, steroids ...""",0,0,0,0,0,0,0,0,0,177
151110,Crude palm oil,779,459,573,245,241,342,282,193,201,176
380300,"Tall oil, whether or not refined",111,106,186,290,174,115,165,97,75,175
847030,"Calculating machines, non-electronic",347,212,222,365,122,214,321,304,172,175
720927,"Flat-rolled products of iron or non-alloy steel, of a width of >= 600 mm, not in coils, simply ...""",639,335,428,198,153,106,121,166,127,175
270210,"Lignite, whether or not pulverised, non-agglomerated (excluding jet)",0,0,0,0,0,21,188,161,135,174
550190,"Synthetic filament tow as specified in Note 1 to chapter 55 (excluding that of acrylic, modacrylic, ...",4342,159,102,109,198,144,169,157,147,174
660320,"Umbrella frames, incl. frames mounted on shafts """"sticks"""", for umbrellas and sun umbrellas ...""",273,302,269,462,346,324,657,543,411,173
600623,"Cotton fabrics, knitted or crocheted, of yarns of different colours, of a width of > 30 cm ...""",208,251,375,286,230,160,186,166,192,173
490210,"Newspapers, journals and periodicals, whether or not illustrated or containing advertising ...",2495,2588,2741,2171,1316,588,240,591,189,172
580790,"Labels, badges and similar articles, of textile materials, in the piece, in strips or cut to ...",523,334,523,391,725,283,403,350,199,172
845310,"Machinery for preparing, tanning or working hides, skins or leather (excluding drying machines, ...",757,639,1678,589,293,1128,854,1835,299,171
200840,"Pears, prepared or preserved, whether or not containing added sugar or other sweetening matter ...",178,265,147,194,138,114,186,181,98,171
761520,"Sanitary ware and parts thereof, of aluminium (excluding cans, boxes and similar containers ...",44,94,125,97,55,176,272,123,73,169
846120,"Shaping or slotting machines, for working metals, metal carbides or cermets",655,29,277,192,136,83,44,28,190,168
330130,Resinoids,696,765,550,559,501,529,267,269,356,166
720390,"Spongy ferrous products, obtained from molten pig iron by atomisation, iron of a purity of ...",4582,3269,86,166,159,224,82,128,61,166
430400,"Artificial fur and articles thereof (excluding gloves made of leather and artificial fur, footware ...",101,71,64,107,177,182,174,72,66,166
630800,"Sets consisting of woven fabric and yarn, whether or not with accessories, for making up into ...",168,107,183,159,106,144,96,154,109,164
160412,"Prepared or preserved herrings, whole or in pieces (excluding minced)",175,110,162,50,82,69,91,77,116,163
551694,"Woven fabrics containing predominantly, but < 85% artificial staple fibres by weight, other ...",846,687,742,519,356,320,288,400,498,163
90921,"Coriander seeds, neither crushed nor ground",0,3,95,123,188,105,126,138,145,163
600642,"Dyed fabrics, knitted or crocheted, of artificial fibres, of a width of > 30 cm (excluding ...""",126,522,402,514,202,307,136,117,54,163
510990,"Yarn containing predominantly, but < 85% wool or fine animal hair by weight, put up for retail ...",1480,1361,1121,1333,625,328,343,275,219,162
180100,"Cocoa beans, whole or broken, raw or roasted",13,43,57,53,72,95,236,105,113,162
721011,"Flat-rolled products of iron or non-alloy steel, of a width of >= 600 mm, hot-rolled or cold-rolled ...""",1666,343,610,343,321,433,262,481,324,161
961400,"Smoking pipes, incl. pipe bowls, cigar or cigarette holders, and parts thereof, n.e.s.",162,205,237,187,157,99,134,189,128,161
854040,"Data/graphic display tubes, monochrome; data/graphic display tubes, colour, with a phosphor ...",48,134,63,165,223,142,103,192,225,161
470691,"Mechanical pulp of fibrous cellulosic material (excluding that of bamboo, wood, cotton linters ...",135,51,134,110,51,40,70,82,66,159
30222,"Fresh or chilled plaice """"Pleuronectes platessa""""""""",106,100,121,156,258,291,262,231,155,159
300120,"Extracts of glands or other organs or of their secretions, for organo-therapeutic uses",316,315,341,239,288,515,547,555,658,159
630299,"Toilet linen and kitchen linen of textile materials (excluding of cotton or man-made fibres, ...",244,173,145,129,201,177,194,114,119,158
80111,Desiccated coconuts,6,8,15,18,17,41,51,120,129,158
521213,"Woven fabrics of cotton, containing predominantly, but < 85% cotton by weight, other than those ...",1182,624,754,473,582,409,413,223,130,157
722820,"Bars and rods of silico-manganese steel (excluding semi-finished products, flat-rolled products ...",52,149,100,108,22,31,441,174,212,157
110419,Rolled or flaked grains of cereals (excluding oats),209,148,279,246,241,283,140,276,210,156
270600,"Tar distilled from coal, from lignite or from peat, and other mineral tars, whether or not ...",10547,7978,4248,824,1966,272,217,372,368,156
520849,"Woven fabrics of cotton, containing >= 85% cotton by weight and weighing <= 200 g/m©÷, made ...",3122,2924,3010,3583,3027,2612,2746,2818,979,155
551012,"Multiple """"folded"""" or cabled yarn containing >= 85% artificial staple fibres by weight (excluding ...""",27,65,80,108,72,116,106,159,40,155
30488,"Frozen fillets of dogfish, other sharks, rays and skates """"Rajidae""""""""",0,0,0,0,0,33,20,292,112,155
930629,Parts of cartridges for smooth-barrelled shotguns; lead shot for air rifles and pistols,99,139,159,135,88,102,136,146,180,155
110423,"Hulled, pearled, sliced, kibbled or otherwise worked maize grains (excluding rolled, flaked, ...",35,33,38,2,2,55,127,181,124,155
90922,"Coriander seeds, crushed or ground",0,10,165,167,160,112,91,107,176,155
293332,Piperidine and its salts,312,139,181,283,77,177,254,193,238,155
292217,Methyldiethanolamine and ethyldiethanolamine,0,0,0,0,0,2415,576,217,97,155
260800,Zinc ores and concentrates,6,23,0,6,0,1,0,0,0,155
370232,"Photographic film """"incl. instant print film"""", in rolls, sensitised, unexposed, without perforations, ...""",6,39,271,62,39,35,21,35,128,154
911440,Plates and bridges for clocks or watches,48,80,334,2109,1408,138,99,107,150,154
511211,Woven fabrics containing >= 85% combed wool or combed fine animal hair by weight and weighing ...,345,394,406,348,177,174,301,333,137,154
721113,"Flat-rolled products of iron or non-alloy steel, simply hot-rolled on four faces or in a closed ...""",29,2,4,4,0,66,36,1,13,154
292243,Anthranilic acid and its salts,199,170,225,215,140,207,196,13,93,153
80252,"Fresh or dried pistachios, shelled",0,105,451,423,361,414,341,347,328,153
91012,"Ginger, crushed or ground",0,5,84,503,60,88,148,188,97,153
283322,Sulphate of aluminium,910,1042,864,1284,1330,919,584,170,149,153
840310,"Central heating boilers, non-electric (excluding vapour generating boilers and superheated ...",171,34,79,110,2157,662,204,159,30,153
910819,"Watch movements, complete and assembled, electrically operated, with combined opto-electronic ...",152,388,111,200,307,89,226,87,141,152
470610,Pulp of cotton linters,211,221,89,221,134,443,202,248,152,151
620990,Babies' garments and clothing accessories of textile materials (excluding of cotton or synthetic ...,107,112,114,174,193,194,208,232,382,150
190510,Crispbread,78,113,83,112,118,96,102,102,120,150
730669,"Tubes, pipes and hollow profiles, welded, of non-circular cross-section, of iron or steel (excluding ...",341,228,300,241,189,355,451,110,186,150
550140,"Synthetic filament tow as specified in Note 1 to chapter 55, of polypropylene",0,0,0,0,0,16,40,18,123,149
550120,"Filament tow as specified in Note 1 to chapter 55, of polyesters",114,305,400,377,237,76,195,132,174,148
80280,"Fresh or dried areca nuts, whether or not shelled or peeled",0,0,0,0,41,1756,242,120,8,148
71190,"Vegetables and mixtures of vegetables provisionally preserved, e.g. by sulphur dioxide gas, ...",105,117,154,135,163,215,294,126,123,147
90520,"Vanilla, crushed or ground",0,14,222,47,125,80,13,105,150,147
621520,"Ties, bow ties and cravats of man-made fibres (excluding knitted or crocheted)",372,280,281,438,434,395,458,327,230,147
721020,"Flat-rolled products of iron or non-alloy steel, of a width of >= 600 mm, hot-rolled or cold-rolled ...""",529,567,247,411,461,270,362,357,60,147
310311,"Superphosphates containing by weight => 35 % of diphosphorus pentaoxide """"P2O5"""" (excl. such ...""",0,0,0,0,0,0,227,41,42,147
820713,"Rock-drilling or earth-boring tools, interchangeable, with working parts of sintered metal ...",27,7,37,56,107,91,28,639,13,146
900792,"Parts and accessories for cinematographic projectors, n.e.s.",713,554,139,558,1039,688,553,130,225,146
293941,Ephedrine and its salts,68,106,241,166,48,89,86,191,50,145
843061,"Tamping or compacting machinery, not self-propelled (excluding hand-operated tools)",72,91,247,228,119,248,221,225,89,145
521139,"Woven fabrics of cotton, containing predominantly, but < 85% cotton by weight, mixed principally ...",254,301,517,560,294,288,250,165,168,145
670419,"False beards, eyebrows and eyelashes, switches and the like, of synthetic textile materials ...",299,259,244,344,244,170,148,116,125,144
701341,"Glassware of lead crystal, of a kind used for table or kitchen purposes (excluding articles ...""",173,197,229,273,230,172,151,225,53,144
30569,"Fish, salted or in brine only (excluding fillets, offal, herring, cod, anchovies, tilapia, ...",78,240,267,171,155,116,64,62,40,144
60220,"Edible fruit or nut trees, shrubs and bushes, whether or not grafted",0,0,16,8,7,1,8,38,118,144
910291,"Pocket-watches and the like, incl. stop-watches, electrically operated (excluding of precious ...",135,186,150,160,198,268,162,185,162,142
630229,"Printed bedlinen of textile materials (excluding cotton and man-made fibres, knitted or crocheted)",159,211,220,166,146,113,56,79,66,142
80261,"Fresh or dried macadamia nuts, in shell",0,0,0,0,0,2,8,9,26,142
847971,"Passenger boarding bridges, of a kind used in airports",0,0,0,8857,5458,0,115,0,18,142
230660,"Oilcake and other solid residues, whether or not ground or in the form of pellets, resulting ...",2083,7098,10441,9304,4759,756,3,132,296,142
860390,"Self-propelled railway or tramway coaches, vans and trucks (excluding those powered from an ...",38665,232864,0,0,8,0,63,0,0,141
30356,"Frozen cobia """"Rachycentron canadum""""""""",0,0,26,323,225,204,279,223,187,141
551512,"Woven fabrics containing predominantly, but < 85% polyester staple fibres by weight, mixed ...",420,308,294,178,267,252,291,153,147,141
640212,"Ski-boots, cross-country ski footwear and snowboard boots, with outer soles and uppers of rubber ...",130,73,36,62,130,157,152,235,237,140
440112,"Fuel wood, in logs, billets, twigs, faggots or similar forms, non-coniferous",0,0,0,0,0,67,163,192,117,140
620899,"Women's or girls' singlets and other vests, briefs, panties, n?glig?s, bathrobes, dressing ...",1141,430,371,337,505,267,193,164,147,140
551599,"Woven fabrics containing predominantly, but < 85% synthetic staple fibres, other than those ...",258,190,175,208,163,151,167,96,113,140
200961,"Grape juice, incl. grape must, unfermented, Brix value <= 30 at 20¡ÆC, whether or not containing ...",1543,977,1371,982,771,1253,360,209,148,138
292231,"Amfepramone """"INN"""", methadone """"INN"""" and normethadone """"INN"""", and salts thereof""""",97,95,1,39,39,101,11,88,0,136
940152,Seats of bamboo,0,0,0,0,0,154,170,273,126,136
711031,"Rhodium, unwrought or in powder form",109,711,3529,2986,1392,899,216,709,5235,136
520851,"Plain woven fabrics of cotton, containing >= 85% cotton by weight and weighing <= 100 g/m©÷, ...",237,337,186,298,150,224,228,221,205,136
482020,Exercise books of paper or paperboard,52,99,76,129,86,54,62,129,163,136
170390,Beet molasses resulting from the extraction or refining of sugar,12843,634,9329,3838,3925,3746,6652,4487,172,134
520210,"Cotton yarn waste, incl. thread waste",167,0,23,15,30,20,448,217,101,134
821591,"Spoons, forks, ladles, skimmers, cake-servers, fish-knives, butter-knives, sugar tongs and ...",141,187,218,161,184,183,231,120,99,134
610791,"Men's or boys' bathrobes, dressing gowns and similar articles of cotton, knitted or crocheted",8,5,27,17,219,235,313,45,143,134
530911,"Woven fabrics of flax, containing >= 85% flax by weight, unbleached or bleached",43,83,46,74,47,123,91,70,54,133
120110,"Soya bean seed, for sowing",0,246,561,48,43,132,0,123,98,132
580640,"Narrow fabrics consisting of warp without weft assembled by means of an adhesive """"bolducs"""", ...""",61,12,7,16,9,95,85,90,90,132
261100,Tungsten ores and concentrates,0,625,0,0,329,1945,505,1,0,132
292023,Trimethyl phosphite,0,0,0,0,0,458,306,175,154,131
841090,Parts of hydraulic turbines and water wheels incl. regulators,133,166,439,121,685,236,121,1067,279,130
930190,"Military weapons, incl. sub-machine guns (excluding artillery weapons, rocket launchers, flame-throwers, ...",49,0,0,0,0,0,0,0,0,130
845941,"Boring machines for metals, numerically controlled (excl. way-type unit head machines and boring-milling ...",0,0,0,0,0,366,5,666,405,130
440397,"Poplar and aspen """"Populus spp."""" in the rough, whether or not stripped of bark or sapwood, ...""",0,0,0,0,0,51,0,108,121,130
960190,"Worked bone, tortoiseshell, horn, antlers, coral, mother-of-pearl and other animal carving ...",10654,14807,17651,23972,29263,5108,3094,380,1258,129
970400,"Postage or revenue stamps, stamp-postmarks, first-day covers, postal stationery, stamped paper ...",9,35,182,1060,374,80,83,94,113,129
441019,"Waferboard and similar board, of wood, whether or not agglomerated with resins or other organic ...",1159,1002,1465,636,797,693,641,545,230,127
630630,"Sails for boats, sailboards or landcraft, of textile materials",83,126,121,107,125,131,72,128,114,126
701951,"Woven fabrics, incl. narrow fabrics, of glass, of a width of <= 30 cm (excluding rovings)",645,351,354,141,248,333,378,263,77,125
540333,"Filament yarn of cellulose acetate, incl. monofilament of < 67 decitex, single (excluding sewing ...",37,160,338,311,435,454,248,234,42,125
430219,"Tanned or dressed furskins, whole, with or without heads, tails or paws, not assembled (excluding ...",248,254,237,202,229,146,138,124,120,124
290322,Trichloroethylene,584,304,352,183,261,176,141,96,49,124
845949,"Boring machines for metals, not numerically controlled (excl. way-type unit head machines and ...",0,0,0,0,0,29,173,104,921,122
551090,"Yarn containing predominantly, but < 85% artificial staple fibres by weight, other than that ...",67,273,212,19,159,122,57,94,112,122
110320,Cereal pellets,0,0,1,0,11,5,38,19,6,120
520833,"Woven fabrics of cotton, containing >= 85% cotton by weight and weighing <= 200 g/m©÷, in three-thread ...",279,491,434,448,370,459,624,102,112,120
930690,"Bombs, grenades, torpedos, mines, missiles, and other ammunition and projectiles, and parts ...",29,20,11,54,147,190,159,194,173,120
930200,Revolvers and pistols (excluding those of heading 9303 or 9304 and sub-machine guns for military ...,0,0,839,5,6123,4647,2636,121,171,120
940383,"Furniture of rattan (excl. seats and medical, surgical, dental or veterinary furniture)",0,0,0,0,0,266,93,73,116,119
551623,"Woven fabrics containing predominantly, but < 85% artificial staple fibres, mixed principally ...",482,223,417,370,353,230,181,96,177,119
960629,"Buttons (excluding of plastics or base metal, not covered with textile material, press-fasteners, ...",358,231,305,414,433,244,325,286,123,119
732112,"Appliances for baking, frying, grilling and cooking and plate warmers, for domestic use, of ...",159,166,168,461,91,202,144,62,160,118
120890,Flours and meal of oil seeds or oleaginous fruit (excluding soya and mustard),102,148,51,210,38,31,43,99,44,118
284510,"Heavy water """"deuterium oxide"""" [Euratom]""""",29,222,441,312,589,704,342,184,137,118
740312,"Copper, refined, in the form of wire-bars",1773,1163,798,548,437,1075,1012,598,142,118
901710,"Drafting tables and machines, whether or not automatic (excluding units for automatic data-processing ...",105,374,809,407,246,107,70,187,147,117
291229,"Cyclic aldehydes, without other oxygen function (excluding benzaldehyde)",545,3053,2220,1126,615,1042,2200,1168,235,117
170310,Cane molasses resulting from the extraction or refining of sugar,24049,20003,28812,25560,18678,15300,11298,11068,107,116
271129,"Hydrocarbons in gaseous state, n.e.s. (excluding natural gas)",74,45,38,38,43,61,129,193,143,116
40891,"Dried birds' eggs, not in shell, whether or not sweetened (excluding egg yolks)",226,192,89,145,93,52,40,92,94,116
521120,"Woven fabrics of cotton, containing predominantly, but < 85% cotton by weight, mixed principally ...",4,18,6,18,18,82,17,16,1,116
844511,Carding machines for preparing textile fibres,3509,1734,294,1010,45,605,535,683,202,116
10690,"Live animals (excluding mammals, reptiles, birds, insects, fish, crustaceans, molluscs and ...",115,93,97,146,149,156,116,68,173,115
511119,Woven fabrics containing >= 85% carded wool or carded fine animal hair by weight and weighing ...,614,458,442,591,253,200,355,113,75,115
521039,"Woven fabrics of cotton, containing predominantly, but < 85% cotton by weight, mixed principally ...",458,413,452,224,279,214,248,233,169,115
60311,"Fresh cut roses and buds, of a kind suitable for bouquets or for ornamental purposes",60,36,30,40,69,83,129,119,131,115
540833,"Woven fabrics of yarn containing predominantly, but < 85% artificial filament by weight, incl. ...",378,295,361,367,279,179,111,134,100,113
60420,"Foliage, branches and other parts of plants, without flowers or flower buds, and grasses, mosses ...",0,50,163,63,60,87,135,105,182,113
290323,"Tetrachloroethylene """"perchloroethylene""""""""",174,133,138,120,47,69,99,166,125,113
811219,"Articles of beryllium, n.e.s.",20,173,44,26,51,201,230,65,86,112
844629,"Hand looms for weaving fabrics of a width > 30 cm, shuttle type",1373,328,1708,807,547,680,461,203,44,112
550999,"Yarn containing predominantly, but < 85% synthetic staple fibres by weight, other than that ...",251,226,515,576,263,699,363,96,222,112
570220,"Floor coverings of coconut fibres """"coir"""", woven, whether or not made up""""",124,130,156,110,143,175,126,120,121,111
310551,"Mineral or chemical fertilisers containing nitrates and phosphates (excluding ammonium dihydrogenorthophosphate ...""",58,117,68,65,152,64,64,44,29,111
520547,"Multiple """"folded"""" or cabled cotton yarn, of combed fibres, containing >= 85% cotton by weight ...""",773,776,460,377,271,404,202,169,87,110
520932,"Woven fabrics of cotton, containing >= 85% cotton by weight and weighing > 200 g/m©÷, in three-thread ...",255,118,353,201,228,322,170,163,37,110
71151,"Mushrooms of the genus """"Agaricus"""", provisionally preserved, e.g., by sulphur dioxide gas, ...""",537,936,945,314,325,357,252,117,122,110
720926,"Flat-rolled products of iron or non-alloy steel, of a width of >= 600 mm, not in coils, simply ...""",1506,1479,1070,639,332,596,132,200,53,110
900710,Cinematographic cameras,0,3,1110,357,462,415,111,65,137,109
720854,"Flat-rolled products of iron or non-alloy steel, of a width of >= 600 mm, not in coils, simply ...",213,397,535,241,20,65,101,22,38,109
30329,"Frozen, Nile perch (Lates niloticus) and snakeheads (Channa spp.)",861,67,55,135,56,92,42,211,160,108
570291,"Carpets and other floor coverings, of wool or fine animal hair, woven, not tufted or flocked, ...",88,233,155,650,153,158,135,141,112,108
845110,Dry-cleaning machines for made-up textile articles,258,117,437,544,612,907,252,245,183,108
680210,"Tiles, cubes and other processed articles of natural stone, incl. slate, for mosaics and the ...",441,529,441,396,273,318,267,179,94,108
20712,"Frozen fowls of the species Gallus domesticus, not cut in pieces",316,188,717,158,218,162,388,79,134,108
30351,"Frozen herrings """"Clupea harengus, Clupea pallasii""""""""",312,167,115,149,330,129,122,42,66,107
845951,"Milling machines for metals, knee-type, numerically controlled",69,150,167,0,0,56,883,89,64,107
845819,"Horizontal lathes, incl. turning centres, for removing metal, not numerically controlled",968,299,584,464,1988,939,1286,1019,181,106
911410,"Springs for clocks or watches, incl. hairsprings",78,103,103,100,60,69,77,88,108,106
540600,"Man-made filament yarn, put up for retail sale (excluding sewing thread)",222,306,354,327,367,331,150,118,190,105
30355,"Frozen jack and horse mackerel """"Trachurus spp.""""""""",0,0,74,93,95,127,106,119,178,105
381119,Anti-knock preparations for motor fuels (excluding those based on lead compounds),31,33,14,16,53,33,37,70,79,105
821195,"Handles of base metal for table knives, pocket knives and other knives of heading 8211",222,100,171,401,373,104,130,104,48,104
80522,Fresh or dried clementines incl. monreales,0,0,0,0,0,0,3,0,0,104
390450,"Vinylidene chloride polymers, in primary forms",1558,572,675,313,218,182,318,100,163,103
590800,"Textile wicks, woven, plaited or knitted, for lamps, stoves, lighters, candles or the like; ...",55,128,49,22,21,55,221,120,60,103
900630,"Cameras specially designed for underwater use, for aerial survey or for medical or surgical ...",288,218,241,448,459,263,162,371,176,103
611521,"Pantyhose and tights of synthetic fibres, knitted or crocheted, measuring per single yarn < ...",521,649,714,566,500,369,288,189,111,103
843353,Root or tuber harvesting machines,150,175,303,511,382,708,630,1273,576,102
521049,"Woven fabrics of cotton, containing predominantly, but < 85% cotton by weight, mixed principally ...",180,153,188,165,98,98,116,66,71,102
551299,"Woven fabrics containing >= 85% synthetic staple fibres by weight, dyed, made of yarn of different ...",432,969,1037,501,200,262,194,132,195,102
251690,"Porphyry, basalt and other monumental or building stone, whether or not roughly trimmed or ...",194,380,776,172,95,100,86,157,55,101
200710,"Homogenised preparations of jams, jellies, marmalades, fruit or nut pur?es and nut pastes, ...",35,3,18,27,39,101,83,53,1,101
260120,Roasted iron pyrites,0,0,15,36,42,29,46,35,43,101
30334,"Frozen turbot """"Psetta maxima""""""""",0,68,311,34,380,127,122,66,97,101
551513,"Woven fabrics containing predominantly, but < 85% polyester staple fibres by weight, mixed ...",365,267,381,131,121,304,149,172,108,100
840220,Superheated water boilers,113,35,17,135,11,46,136,6763,51,100
845380,"Machinery for making or repairing articles of hides, skins or leather (excluding footwear and ...",339,595,973,1113,691,1604,362,528,214,100
210420,"Food preparations consisting of finely homogenised mixtures of two or more basic ingredients, ...",712,453,869,195,433,1022,589,408,272,100
252510,Crude mica and mica rifted into sheets or splittings,74,82,14,40,53,51,128,107,100,99
610839,"Women's or girls' nightdresses and pyjamas of textile materials, knitted or crocheted (excluding ...",58,57,56,64,153,154,145,245,101,99
