151620,"Vegetable fats and oils and their fractions, partly or wholly hydrogenated, inter-esterified, ...",10931,10104,12216,13149,12334,15688,15018,12754,13659,16013
844859,"Parts and accessories of machines of heading 8447, n.e.s.",20255,22058,21858,18232,22714,20093,14984,12507,8648,15973
846721,"Drills of all kinds for working in the hand, with self-contained electric motor",12887,9231,14129,16587,17169,16608,14238,13367,15406,15967
841319,"Pumps for liquids, fitted or designed to be fitted with a measuring device (excluding pumps ...",7342,9094,9690,7536,8419,7963,9245,10516,10632,15964
310520,"Mineral or chemical fertilisers containing the three fertilising elements nitrogen, phosphorus ...",6547,16378,10599,12303,13561,10518,13720,14887,15748,15935
540245,"Filament yarn of nylon or other polyamides, incl. monofilament of < 67 decitex, single, untwisted ...",17737,15093,9753,8498,7280,5971,5159,5804,7311,15921
730721,Flanges of stainless steel (excluding cast products),15179,13709,11525,12475,9859,11094,13087,11477,11348,15890
851840,Audio-frequency electric amplifiers,2938,2785,3094,3495,5053,6166,5739,7111,14335,15880
961210,"Typewriter or similar ribbons, inked or otherwise prepared for giving impressions, whether ...",12473,13159,13950,12347,12209,13249,13081,14176,13158,15863
760820,Tubes and pipes of aluminium alloys (excluding hollow profiles),9548,9614,8361,7160,7975,7559,7163,6448,6355,15855
610130,"Overcoats, car coats, capes, cloaks, anoraks, incl. ski jackets, windcheaters, wind-jackets ...",13101,9550,12429,14176,14576,14838,17500,18105,14894,15840
210120,"Extracts, essences and concentrates, of tea or mate, and preparations with a basis of these ...",12576,13196,11291,10277,13157,12864,13926,15331,13595,15811
854419,"Winding wire for electrical purposes, of material other than copper, insulated",18110,14487,11812,14206,10028,12287,13161,12048,17685,15777
80510,Fresh or dried oranges,10197,9445,9752,9525,18925,20064,12996,18409,13647,15760
610442,"Women's or girls' dresses of cotton, knitted or crocheted (excluding petticoats)",7742,10722,10601,10890,10418,9937,12106,13335,12769,15746
110422,"Hulled, pearled, sliced, kibbled or otherwise worked oat grains (excluding rolled, flaked, ...",12053,12335,11709,11274,12641,11166,11250,12223,12034,15718
290410,"Derivatives of hydrocarbons containing only sulpho groups, their salts and ethyl esters",10034,8687,9580,8255,7992,11312,10916,11055,11269,15717
841940,Distilling or rectifying plant,17294,16375,6820,11823,11127,8124,8733,13027,42630,15667
842131,Intake air filters for internal combustion engines,9652,10235,8921,8672,11842,10862,12135,10183,13639,15663
850132,DC motors and DC generators of an output > 750 W but <= 75 kW (excl. photovoltaic generators),8837,9847,10363,9286,13878,14477,14567,10794,11872,15647
854710,"Insulating fittings for electrical purposes, of ceramics",5128,3716,4569,4722,10847,14584,17558,10730,13798,15580
901190,"Parts and accessories for compound optical microscopes, n.e.s.",9070,10520,10157,9370,8934,11703,11647,10979,11908,15515
841710,"Industrial or laboratory furnaces and ovens, non-electric, for the roasting, melting or other ...",19806,14835,25595,11762,19507,26029,19442,10547,8910,15512
382440,"Prepared additives for cements, mortars or concretes",16416,16166,14790,13672,11439,11672,10829,9797,10852,15496
851632,Electro-thermic hairdressing apparatus (excluding hairdryers),3159,3108,4968,4957,5552,6097,8635,15929,12578,15477
160414,"Prepared or preserved tunas, skipjack and Atlantic bonito, whole or in pieces (excluding minced)",10877,9329,9505,12828,10840,13341,12534,13297,14142,15384
20450,"Fresh, chilled or frozen meat of goats",12497,12326,16877,12677,11676,15997,11490,12427,12242,15354
842119,"Centrifuges, incl. centrifugal dryers (excluding isotope separators, cream separators and clothes ...",16814,11449,12334,8763,9661,12483,18216,13416,13402,15339
240399,"Chewing tobacco, snuff and other manufactured tobacco and manufactured tobacco substitutes, ...""",2730,2530,2903,2377,5582,10003,13880,12373,17050,15334
300640,Dental cements and other dental fillings; bone reconstruction cements,8315,9423,11560,11898,11689,12968,14146,15123,16075,15330
630260,"Toilet linen and kitchen linen, of terry towelling or similar terry fabrics of cotton (excluding ...",10811,10701,13066,13562,13181,13629,13860,13752,13424,15314
20220,"Frozen bovine cuts, with bone in (excluding carcases and half-carcases)",12650,6166,17273,13304,8384,14257,18660,23085,19171,15258
292241,Lysine and its esters; salts thereof,12559,11422,9895,8115,9933,10819,11101,10403,10756,15230
293590,Sulphonamides (excl. perfluorooctane sulphonamides),0,0,0,0,0,11270,11214,12429,17919,15213
847740,Vacuum-moulding machines and other thermoforming machines for working rubber or plastics,12013,13371,15751,8108,11662,22416,18485,11083,15355,15205
841690,"Parts of furnace burners such as mechanical stokers, incl. their mechanical grates, mechanical ...",10714,30830,29996,19282,22345,23545,20029,33114,9223,15196
820299,"Saw blades, incl. toothless saw blades, of base metal (excluding bandsaw blades, circular saw ...",28358,29072,41385,31193,27308,29793,22673,11890,12182,15193
550311,"Staple fibres of aramids, not carded, combed or otherwise processed for spinning",14994,13883,26282,13817,12918,12850,14849,17137,10419,15186
391510,"Waste, parings and scrap, of polymers of ethylene",8847,14547,20846,28657,24252,17796,36741,35549,20112,15182
390530,"Poly""""vinyl alcohol"""", in primary forms, whether or not containing unhydrolyzed acetate groups""""",10318,12543,11329,12367,13211,12488,13689,10864,13116,15158
853931,"Discharge lamps, fluorescent, hot cathode",47706,47073,37205,34073,30898,25693,18057,15712,13581,15132
845180,"Machinery for dressing, finishing, coating or impregnating textile yarns, fabrics or other ...",6703,12061,11571,11649,19793,10830,5913,6105,14802,15123
70511,Fresh or chilled cabbage lettuce,4932,5589,5633,6578,10771,11517,12731,14093,14187,15098
620442,Women's or girls' dresses of cotton (excluding knitted or crocheted and petticoats),9784,13487,15281,16248,15236,14738,14959,15312,13868,15065
621420,"Shawls, scarves, mufflers, mantillas, veils and similar articles of wool or fine animal hair ...",10483,8510,9827,9951,14713,14977,15974,17133,11144,15052
251010,"Natural calcium phosphates and natural aluminium calcium phosphates, natural and phosphatic ...",28300,19741,15774,12592,12149,8558,14951,10476,8453,15037
843850,Machinery for the industrial preparation of meat or poultry (excluding cooking and other heating ...,10703,8822,11594,19040,11202,18486,14726,12304,27333,15011
282540,Nickel oxides and hydroxides,1667,1784,2791,2273,4673,9535,11819,10409,3925,14935
841221,"Hydraulic power engines and motors, linear acting """"cylinders""""""""",19038,16323,18151,17397,10693,13236,16132,13575,16868,14933
350190,Caseinates and other casein derivatives; casein glues (excluding those put up for retail sale ...,9207,10442,12600,6968,6446,8100,7386,9638,10738,14931
310590,Mineral or chemical fertilisers containing the two fertilising elements nitrogen and potassium ...,8125,11149,10698,9436,10383,12489,13408,13154,14019,14929
150420,"Fats and oils of fish and their fractions, whether or not refined (excluding liver oils and ...",49328,37644,26655,10560,11216,12742,12950,9409,10964,14928
40410,"Whey and modified whey, whether or not concentrated or containing added sugar or other sweetening ...",15053,16128,16665,11697,8920,11688,11897,11838,11436,14902
860799,"Parts of rolling stock of heading 8603, 8604, 8605 or 8606, n.e.s.",50988,45019,31891,20776,38624,33666,36316,29568,17755,14884
80620,Dried grapes,18511,19364,17384,18873,17455,16440,16025,15984,13566,14883
750512,"Bars, rods, profiles and wire, of nickel alloys, n.e.s. (excluding electrically insulated products)",18700,19108,12477,15621,10478,12097,16472,14136,12322,14874
721070,"Flat products of iron or non-alloy steel, of a width of >= 600 mm, hot-rolled or cold-rolled ...""",10284,9648,10411,11347,9284,9349,12211,17849,12544,14836
481890,"Paper, cellulose wadding or webs of cellulose fibres, of a kind used for household or sanitary ...",2957,3307,6444,6955,7105,8088,10533,12398,12831,14792
740729,"Bars, rods and profiles of copper alloys, n.e.s. (excluding such articles of copper-zinc base ...""",12912,9969,13528,7916,9544,11044,12991,13048,9244,14791
320650,"Inorganic products of a kind used as luminophores, whether or not chemically defined",34872,36508,35559,27533,22200,21572,14868,11981,11470,14731
441990,"Tableware and kitchenware, of wood (excl. of bamboo or tropical wood, and interior fittings, ...",0,0,0,0,0,12008,12725,11840,14481,14716
280200,"Sulphur, sublimed or precipitated; colloidal sulphur",586,2621,1118,524,5772,4008,2703,1589,3296,14711
250810,Bentonite,8259,9148,9887,11942,8985,13003,10761,10415,11907,14700
730840,"Equipment for scaffolding, shuttering, propping or pit-propping (excluding composite sheetpiling ...",9813,7612,6487,9416,7213,4073,5362,4417,4732,14696
842951,Self-propelled front-end shovel loaders,12160,10370,9642,12660,9132,10097,11928,11331,15584,14690
320990,"Paints and varnishes, incl. enamels and lacquers, based on synthetic or chemically modified ...",11814,12306,12131,13015,11341,10320,10602,10487,11623,14644
480258,"Uncoated paper and paperboard, of a kind used for writing, printing or other graphic purposes, ...",6959,8139,8832,11213,13980,11318,9207,10658,14206,14623
901490,"Parts and accessories for compasses and other navigational instruments and appliances, n.e.s.",8817,5410,5055,7121,5610,5309,6545,8901,10254,14622
848240,Needle roller bearings,12112,9701,11426,9698,9042,10113,12098,10485,9115,14613
720810,"Flat-rolled products of iron or non-alloy steel, of a width of >= 600 mm, in coils, simply ...",12174,9494,13094,7376,10406,8215,16835,11019,8743,14610
841239,Pneumatic power engines and motors (excluding linear acting),7102,8631,7111,8129,6616,9815,11679,11495,14046,14591
630231,"Bedlinen of cotton (excluding printed, knitted or crocheted)",12869,12922,15211,15150,12567,14061,15387,14046,13604,14582
870194,"Tractors, of an engine power > 75 kW but <= 130 kW (excl. those of heading 8709, pedestrian-controlled ...",0,0,0,0,0,17110,20835,17839,53120,14566
940290,"Operating tables, examination tables, and other medical, dental, surgical or veterinary furniture ...",8149,9586,11214,14074,13490,10418,14348,13630,16516,14547
160419,"Prepared or preserved fish, whole or in pieces (excluding minced, merely smoked, and salmon, ...""",7986,8225,8935,11064,11688,13789,14510,15857,18431,14535
481039,"Kraft paper and paperboard, coated on one or both sides with kaolin or other inorganic substances, ...",13422,18060,21724,19220,16032,14765,20348,13469,13759,14530
400260,"Isoprene rubber """"IR"""", in primary forms or in plates, sheets or strip""""",13169,11027,10180,9336,12582,11897,11798,11446,14361,14518
590310,"Textile fabrics impregnated, coated, covered or laminated with poly""""vinyl chloride"""" (excluding ...""",13470,15342,17759,14502,12818,13073,12312,13028,13345,14516
321290,"Pigments, incl. metallic powders and flakes, dispersed in non-aqueous media, in liquid or paste ...",17656,16119,14393,12899,11735,12530,12120,12540,12795,14488
740940,"Plates, sheets and strip, of copper-nickel base alloys """"cupro-nickel"""" or copper-nickel-zinc ...""",8115,8227,5579,4109,4387,5999,9531,7255,8344,14483
847759,Machinery for moulding or otherwise forming products from rubber or plastics (excluding injection-moulding ...,4972,7556,20538,8638,11456,9377,10286,14638,12608,14474
290545,Glycerol,9532,11744,11056,8689,7927,9972,11710,10084,7822,14441
730690,"Tubes, pipes and hollow profiles """"e.g., open seam, riveted or similarly closed"""", of iron ...""",10095,6940,9622,7495,7236,5055,4405,8315,7545,14430
731010,"Tanks, casks, drums, cans, boxes and similar containers, of iron or steel, for any material, ...",12070,8853,9606,8081,7811,9497,8952,7714,9789,14423
510529,"Wool, combed (excluding that in fragments """"open tops"""")""""",14309,19711,23667,18141,19961,17799,23018,19339,13595,14422
842531,Winches and capstans powered by electric motor,22290,21416,29730,27380,31304,21693,23727,24781,14784,14421
860800,"Railway or tramway track fixtures and fittings (excluding sleepers of wood, concrete or steel, ...",37136,10089,20697,17069,15564,16656,22033,14012,13531,14394
711411,"Articles of goldsmiths' or silversmiths' wares or parts thereof, of silver, whether or not ...",118585,33222,24321,20312,16632,20896,21571,10858,11412,14375
41000,"Turtles' eggs, birds' nests and other edible products of animal origin, n.e.s.",8099,8421,13929,12906,11621,14897,14210,13506,12308,14370
846490,"Machine tools for working stones, concrete, asbestos cement or similar mineral substances or ...",19462,34018,19597,18381,18812,15472,10899,10006,7849,14337
382450,Non-refractory mortars and concretes,110,149,998,323,620,249,503,2041,7065,14333
851010,"Shavers, electric",15031,14844,13799,13341,12972,14106,13702,12323,13134,14332
760720,"Aluminium foil, backed, of a thickness (excluding any backing) of <= 0,2 mm (excluding stamping ...",8235,8479,8199,9185,11076,9685,10054,10788,12736,14319
842691,Cranes designed for mounting on road vehicles,5669,6812,9079,5863,7116,6651,9550,8257,9244,14310
842010,Calendering or other rolling machines (other than for metals or glass),2749,5973,24945,4591,16890,8726,9206,4518,9442,14295
910229,"Wrist-watches, whether or not incorporating a stop-watch facility, with hand winding only (excluding ...",20477,20292,17506,18546,12822,10997,13260,12569,10556,14282
630140,"Blankets and travelling rugs of synthetic fibres (excluding electric, table covers, bedspreads ...",12272,11088,14160,15057,11745,10629,13875,11250,11057,14254
262019,"Slag, ash and residues containing mainly zinc (excluding hard zinc spelter)",14684,11702,12719,13571,12710,21018,23635,22744,17178,14253
480452,"Kraft paper and paperboard, uncoated, in rolls of a width > 36 cm or in square or rectangular ...",12418,15670,29131,21869,23551,19386,21797,26343,17673,14249
252620,"Natural steatite and talc, crushed or powdered",14646,15552,14699,11271,11282,10506,12395,10289,10967,14235
220870,Liqueurs and cordials,5342,5310,6826,5250,6383,6754,7685,9158,11912,14158
290513,"Butan-1-ol """"n-butyl alcohol""""""""",14901,14252,12787,6952,5580,8216,6997,4782,4989,14115
890110,"Cruise ships, excursion boats and similar vessels principally designed for the transport of ...",0,3929,0,4729,3161,5938,10748,33783,4075,14087
480421,"Unbleached sack kraft paper, uncoated, in rolls of a width > 36 cm (excluding goods of heading ...",8478,8784,11203,11854,6397,8782,11458,12371,11722,14084
391231,"Carboxymethylcellulose and its salts, in primary forms",16112,14485,14857,11701,11040,12378,12831,14097,12499,14078
160529,"Shrimps and prawns, prepared or preserved, in airtight containers (excluding smoked)",0,1028,8864,7890,8960,16205,16118,18342,13449,14076
310510,"Mineral or chemical fertilisers of animal or vegetable origin, in tablets or similar forms, ...",18969,15450,14337,12748,16454,14991,14717,13561,14714,14051
150210,"Tallow of bovine animals, sheep or goats (excluding oil and oleostearin)",0,4066,26887,26257,19448,17936,15538,14233,12886,14043
851490,"Parts of electric industrial or laboratory furnaces and ovens, incl. of those functioning by ...",31524,34372,20425,16519,15772,18998,15554,16582,20416,14029
720429,"Waste and scrap of alloy steel (excluding stainless steel, and waste and scrap, radioactive, ...",13399,10914,14070,7494,11530,7595,10980,14059,9433,13971
283660,Barium carbonate,4338,5886,5712,4539,5630,6719,9408,5316,9660,13946
810820,Unwrought titanium; titanium powders,26203,22256,19416,21706,11784,12063,13567,12616,8679,13921
691310,"Statuettes and other ornamental articles of porcelain or china, n.e.s.",15297,15262,14955,14661,14775,14990,13444,12839,11904,13841
281212,Phosphorus oxychloride,0,0,0,0,0,6455,7070,6840,7943,13826
392340,"Spools, cops, bobbins and similar supports, of plastics",11421,11209,10521,9572,9318,12007,13028,10984,12305,13791
731824,"Cotters and cotter pins, of iron or steel",8562,7956,8914,7310,7223,8842,10020,12769,10556,13783
843010,"Pile-drivers and pile-extractors (excluding those mounted on railway wagons, motor vehicle ...",2048,2058,2170,3298,2802,6215,3209,5196,4345,13757
550390,"Synthetic staple fibres, not carded, combed or otherwise processed for spinning (excluding ...",10675,10587,10125,7633,7878,11025,11470,10428,12512,13756
381210,Prepared rubber accelerators,8651,8675,10701,9606,10051,10997,12391,10175,8077,13730
520524,"Single cotton yarn, of combed fibres, containing >= 85% cotton by weight and with a linear ...""",5350,4695,5520,4637,4611,8659,5824,4878,8606,13721
902000,Breathing appliances and gas masks (excluding protective masks having neither mechanical parts ...,9322,8022,9133,10738,12413,12472,10145,12245,11794,13719
310230,"Ammonium nitrate, whether or not in aqueous solution (excluding that in pellet or similar forms, ...",4700,6024,6129,7383,6056,10442,14694,11494,10202,13708
841229,Hydraulic power engines and motors (excluding hydraulic turbines and water wheels of heading ...,12721,12195,12357,9960,9119,11712,11672,9501,11257,13703
610821,"Women's or girls' briefs and panties of cotton, knitted or crocheted",8680,9633,11054,12681,12220,14061,14603,14368,11130,13678
320416,Synthetic organic reactive dyes; preparations based on synthetic organic reactive dyes of a ...,13792,16133,22662,13337,13797,11228,16227,18529,10735,13671
400510,"Rubber, unvulcanised, compounded with carbon black or silica, in primary forms or in plates, ...",16440,2261,3408,4638,3994,2524,2807,3152,20768,13618
845612,"Machine tools for working any material by removal of material, operated by light or photon ...",0,0,0,0,0,5544,8178,6984,8822,13610
843920,"Machinery for making paper or paperboard (excluding dryers and other heating appliances, calenders ...",10959,8531,2430,53941,35617,2183,2805,3975,48814,13573
730900,"Reservoirs, tanks, vats and similar containers, of iron or steel, for any material other than ...""",7555,5040,3788,4618,4819,7869,8082,4970,10268,13533
852341,"Optical media for the recording of sound or of other phenomena, unrecorded (excluding goods ...",0,322,11682,13363,10451,11822,14775,11226,8099,13532
481099,"Paper and paperboard, coated on one or both sides with kaolin """"China clay"""" or other inorganic ...""",6775,7029,11682,11486,11412,7825,9620,11161,11878,13528
844630,"Weaving machines for weaving fabrics of a width > 30 cm, shuttleless type",10615,16980,15403,20000,16072,20172,17182,32349,12775,13515
711510,"Catalysts in the form of wire cloth or grill, of platinum",9476,3784,12172,8500,9107,8286,9712,10386,9797,13505
30729,"Scallops and other molluscs of the family Pectinidae, smoked, dried, salted or in brine, even ...",19947,28424,23603,29943,32078,4886,3276,7932,4120,13483
853939,"Discharge lamps (excluding flourescent, hot cathode lamps, mercury or sodium vapour lamps, ...",27979,18349,15886,14385,19230,21899,23889,20072,14917,13462
790390,"Zinc powders and flakes (excluding grains of zinc, and spangles of heading 8308, and zinc dust)",5472,5823,5697,4711,5088,6438,5918,8618,8533,13457
700800,Multiple-walled insulating units of glass,4294,2419,2979,1378,1350,2870,7639,5346,6328,13453
732190,"Parts of domestic appliances non-electrically heated of heading 7321, n.e.s.",15699,13620,12795,13894,11676,14039,10446,9289,9544,13431
842840,Escalators and moving walkways,16262,17397,16771,13139,17770,26121,15835,12679,9023,13392
701342,"Glassware for table or kitchen purposes of glass having a linear coefficient of expansion ...""",3010,6920,10451,15157,15715,14792,16899,19179,10900,13391
340391,Textile lubricant preparations and preparations of a kind used for the oil or grease treatment ...,9057,14228,15233,15775,12688,14130,14605,12271,9873,13369
730793,"Butt welding fittings of iron or steel (excluding cast iron or stainless steel products, and ...",6285,6980,6468,6035,4649,4894,6562,7130,6335,13334
30489,"Frozen fish fillets, n.e.s.",0,479,7394,6823,5975,6426,6951,14461,35101,13316
283630,"Sodium hydrogencarbonate """"sodium bicarbonate""""""""",10384,10757,10447,12239,12834,13754,15330,16077,14006,13315
550210,"Artificial filament tow as specified in Note 1 to chapter 55, of acetate",0,0,0,0,0,9591,9368,8947,12270,13312
620443,Women's or girls' dresses of synthetic fibres (excluding knitted or crocheted and petticoats),12935,18430,18085,18023,16576,14655,14450,14724,13741,13292
690220,"Refractory bricks, blocks, tiles and similar refractory ceramic constructional goods containing, ...",18448,18243,13880,14845,17919,13198,22344,13244,15869,13246
620211,"Women's or girls' overcoats, raincoats, car coats, capes, cloaks and similar articles, of wool ...",12220,9988,11730,14752,14568,12732,14176,12954,11119,13220
590320,"Textile fabrics impregnated, coated, covered or laminated with polyurethane (excluding wallcoverings ...",11928,13042,13560,12098,11055,16008,13307,15733,14462,13220
310100,"Animal or vegetable fertilisers, whether or not mixed together or chemically treated; fertilisers ...",9908,12844,14210,9935,9626,9535,11133,9364,10537,13217
853329,Fixed electrical resistors for a power handling capacity > 20 W (excluding heating resistors),11622,9912,8893,7955,7174,8385,13568,11696,13812,13183
170290,"Sugars in solid form, incl. invert sugar and chemically pure maltose, and sugar and sugar syrup ...",8511,9173,9056,9828,9020,9618,11901,11353,10728,13182
760410,"Bars, rods and profiles, of non-alloy aluminium, n.e.s.",6699,8046,8441,8549,9070,6564,10367,10266,8490,13181
853290,"Parts of electrical """"pre-set"""" capacitors, fixed, variable or adjustable, n.e.s.""""",29941,28542,26132,21873,18298,11641,13556,10461,10635,13171
903120,"Test benches for motors, generators, pumps, etc.",11681,10682,12613,15310,8884,8314,16740,17697,15793,13150
320810,"Paints and varnishes, incl. enamels and lacquers, based on polyesters, dispersed or dissolved ...",6494,6818,7920,7456,8455,9064,9531,8298,9371,13058
901480,"Navigational instruments and apparatus (excluding for aeronautical or space navigation, compasses ...",11459,6710,9736,6689,7380,6223,7280,8553,11223,13037
841320,Hand pumps for liquids (excluding those of subheading 8413.11 and 8413.19),4682,5620,6545,6090,6904,9294,9596,10597,13430,13030
960350,"Brushes constituting parts of machines, appliances or vehicles",7896,8101,8604,7439,7218,8590,9762,10195,11426,12989
292250,"Amino-alcohol-phenols, amino-acid-phenols and other amino-compounds with oxygen function (excluding ...",10869,11097,9491,9379,9083,8387,10572,11341,11117,12986
680223,"Granite and articles thereof, simply cut or sawn, with a flat or even surface (excluding with ...",18962,19925,20190,20035,15514,12010,12182,10622,10559,12948
210210,Active yeasts,8382,8309,9251,8932,9477,9859,9787,10863,11976,12944
400821,"Plates, sheets and strip, of non-cellular rubber",12159,10445,9822,9154,9268,9226,9796,9939,11012,12918
630622,Tents of synthetic fibres (excluding umbrella and play tents),1280,1914,3802,8340,8184,9874,8412,7955,9278,12897
610620,"Women's or girls' blouses, shirts and shirt-blouses of man-made fibres, knitted or crocheted ...",8154,13603,13258,13217,12758,11012,11657,11663,11940,12895
480990,"Transfer papers, incl. coated or impregnated paper for duplicator stencils or offset plates, ...",12102,13290,13847,14624,11347,10408,12925,10964,11233,12883
30312,"Frozen Pacific salmon (excluding sockeye salmon """"red salmon"""")""""",0,403,10244,9268,5782,12147,17184,27089,28628,12870
870821,Safety seat belts for motor vehicles,4125,5686,7591,7771,7539,7371,8005,10823,11515,12865
800120,Unwrought tin alloys,14701,7725,9925,8659,20422,27248,13693,10673,5422,12864
852190,"Video recording or reproducing apparatus, whether or not incorporating a video tuner (excluding ...",35706,24232,22696,18512,11813,10305,15973,22000,17360,12853
283699,"Carbonates and peroxocarbonates """"percarbonates""""; commercial ammonium carbonate containing ...""",7754,6207,8187,5791,6663,6542,11275,7118,8055,12833
722211,"Bars and rods of stainless steel, only hot-rolled, only hot-drawn or only hot-extruded, of ...",24972,14723,19451,10560,8905,9026,10977,10144,8332,12826
950730,Fishing reels,7657,9198,12788,11834,11066,8667,8711,11309,11253,12817
730511,"Line pipe of a kind used for oil or gas pipelines, having circular cross-sections and an external ...",239,546,232,1289,351,78,35,63,34,12788
854790,"Insulating fittings for electrical purposes, of materials other than ceramics or plastics; ...",16031,25251,45233,40878,57046,52759,18250,7259,8885,12787
845121,"Drying machines, of a dry linen capacity <= 10 kg (excluding centrifugal driers)",1733,1316,1422,1646,1792,1745,3061,10458,12213,12748
842410,"Fire extinguishers, whether or not charged",8026,9223,10523,10038,8903,8822,10679,9598,11100,12724
400921,"Tubes, pipes and hoses, of vulcanised rubber (excluding hard rubber), reinforced or otherwise ...",9950,7892,8196,9126,8375,9782,11477,10651,10253,12697
620113,"Men's or boys' overcoats, raincoats, car coats, capes, cloaks and similar articles, of man-made ...",10329,8622,10777,13763,13886,14517,17182,18502,12760,12658
790200,"Zinc waste and scrap (excluding ash and residues from zinc production heading 2620"""", ingots ...""",4432,3367,2456,3304,2658,5881,19524,16044,4670,12658
481022,"Lightweight coated paper used for writing, printing or other graphic purposes, total weight ...",31147,34011,34874,30356,23728,24963,27566,18956,13704,12651
320910,"Paints and varnishes, incl. enamels and lacquers, based on acrylic or vinyl polymers, dispersed ...",3944,4156,4624,8111,9495,9550,9258,9004,9277,12624
