721622,"T sections of iron or non-alloy steel, not further worked than hot-rolled, hot-drawn or extruded, ...",58,23,101,201,237,308,851,385,237,39
810830,Titanium waste and scrap (excluding ash and residues containing titanium),2,0,1,1,0,3092,631,0,3,39
510610,Carded wool yarn containing >= 85% wool by weight (excluding that put up for retail sale),0,0,0,0,0,0,6,12,6,39
810600,"Bismuth and articles thereof, n.e.s.; bismuth waste and scrap (excluding ash and residues containing ...",0,0,0,2752,10790,15974,14292,3911,1536,39
510620,"Carded wool yarn containing predominantly, but < 85% wool by weight (excluding that put up ...",0,0,0,0,0,0,0,0,33,39
200860,"Cherries, prepared or preserved, whether or not containing added sugar or other sweetening ...",0,0,0,0,1,0,0,0,3,39
293090,"Organo-sulphur compounds (excl. thiocarbamates and dithiocarbamates, thiuram mono-, di- or ...",0,2,235,136,16,287,150,113,167,38
845630,"Machine tools for working any material by removal of material, operated by electro-discharge ...",343,84,369,108,189,231,416,487,220,38
170240,"Glucose in solid form and glucose syrup, not containing added flavouring or colouring matter, ...",3566,0,0,0,0,0,0,0,0,38
410640,"Tanned or crust hides and skins of reptiles, whether or not split (excluding further prepared)",9,143,4,328,463,151,446,16,10,38
551612,"Woven fabrics containing >= 85% artificial staple fibres by weight, dyed",16,311,76,11,55,38,157,355,363,38
540784,"Woven fabrics of yarn containing predominantly, but < 85% synthetic filament by weight, incl. ...",0,0,0,0,11,3,0,0,0,38
290519,"Saturated monohydric acyclic alcohols (excluding methanol """"methyl alcohol"""", propan-1-ol ...""",0,0,2,0,128,15,55,0,0,38
30445,"Fresh or chilled fillets of swordfish """"Xiphias gladius""""""""",4,35,34,0,0,285,0,0,0,38
970200,"Original engravings, prints and lithographs",1,0,0,240,315,52,8,5,2,38
381700,Mixed alkylbenzenes and mixed alkylnaphthalenes produced by the alkylation of benzene and naphthalene ...,0,0,0,0,0,0,0,0,0,38
90520,"Vanilla, crushed or ground",3,1,8,6,24,17,1,2,7,38
845921,"Drilling machines for working metal, numerically controlled (excluding way-type unit head machines)",27,3,38,166,48,112,532,440,36,37
70700,"Cucumbers and gherkins, fresh or chilled",85,2,6,1,1,41,1,41,22,37
320290,"Inorganic tanning substances; tanning preparations, whether or not containing natural tanning ...",0,4,283,19,57,165,316,256,140,37
551229,"Woven fabrics containing >= 85% acrylic or modacrylic staple fibres by weight, dyed, made of ...",90,0,289,216,182,227,337,56,92,37
843420,"Dairy machinery (excluding refrigerating or heat treatment equipment, cream separators, clarifying ...",5,1,0,2280,0,33,82,2,37,37
851632,Electro-thermic hairdressing apparatus (excluding hairdryers),4,33,2,2,2,4,1,6,3,37
80929,Fresh cherries (excluding sour cherries),0,0,0,0,0,0,0,0,0,37
550520,"Waste of artificial staple fibres, incl. noils, yarn waste and garnetted stock",59,0,110,303,535,445,392,404,302,37
845891,"Lathes, incl. turning centres, for removing metal, numerically controlled (excluding horizontal ...",377,201,207,723,737,836,652,518,647,37
170250,Chemically pure fructose in solid form,0,0,0,0,0,35,0,0,0,36
520642,"Multiple """"folded"""" or cabled cotton yarn containing predominantly, but < 85% cotton by weight, ...""",0,0,83,164,253,83,38,667,241,36
900890,"Parts and accessories for image projectors, photographic enlargers and reducers, n.e.s.",0,0,61,69,98,131,49,85,48,36
110423,"Hulled, pearled, sliced, kibbled or otherwise worked maize grains (excluding rolled, flaked, ...",21,7,2,31,15,7,10,9,5,36
70970,"Fresh or chilled spinach, New Zealand spinach and orache spinach",26,1,2,7,35,65,62,66,16,36
480429,"Sack kraft paper, uncoated, in rolls of a width > 36 cm (excluding unbleached, and goods of ...",17,11,3,8,43,106,261,274,194,36
391520,"Waste, parings and scrap, of polymers of styrene",632,632,1109,2291,2064,2637,2003,525,327,35
681520,Articles of peat (excluding textile products from peat fibres),0,0,0,5,1,0,0,0,0,35
200850,"Apricots, prepared or preserved, whether or not containing added sugar or other sweetening ...",21,6,28,11,16,40,2,36,128,35
440794,"Cherry """"Prunus spp."""", sawn or chipped lengthwise, sliced or peeled, whether or not planed, ...""",0,0,0,0,0,0,0,42,157,35
170390,Beet molasses resulting from the extraction or refining of sugar,0,0,0,0,2,1,18,58,99,35
440111,"Fuel wood, in logs, billets, twigs, faggots or similar forms, coniferous",0,0,0,0,0,0,101,16,3,34
760320,"Powders of aluminium, of lamellar structure, and flakes of aluminium (excluding pellets of ...",0,0,2,16,34,90,103,4,0,34
845929,"Drilling machines for working metal, not numerically controlled (excluding way-type unit head ...",620,879,683,996,245,355,769,1476,647,34
252910,Feldspar,82,95,5,38,48,6,36,199,11,34
391400,"Ion-exchangers based on polymers of heading 3901 to 3913, in primary forms",31,198,105,119,101,1215,28,27,48,34
300320,"Medicaments containing antibiotics, not in measured doses or put up for retail sale (excluding ...",1661,465,355,146,581,1633,1244,306,23,34
570110,"Carpets and other textile floor coverings, of wool or fine animal hair, knotted, whether or ...",0,0,0,1,1,0,0,2,3,34
900130,Contact lenses,0,0,0,10,3,3,5,7,6,33
511211,Woven fabrics containing >= 85% combed wool or combed fine animal hair by weight and weighing ...,82,186,458,283,479,205,734,775,664,33
910599,"Clocks (excluding electrically operated, wrist-watches, pocket-watches and other watches of ...",12,3,0,7,19,61,174,57,12,33
400291,"Synthetic rubber and factice derived from oils, in primary forms or in plates, sheets or strip ...""",7760,5439,804,571,361,4,0,8,6,33
285390,"Phosphides, whether or not chemically defined (excl. ferrophosphorus); inorganic compounds, ...",0,0,0,0,0,0,28,101,88,33
900661,Electronic discharge lamp flashlight apparatus for photographic purposes,0,0,0,0,0,0,0,0,0,33
300431,"Medicaments containing insulin but not antibiotics, put up in measured doses """"incl. those ...""",386,0,0,0,0,0,0,0,145,33
380910,"Finishing agents, dye carriers to accelerate the dyeing or fixing of dyestuffs and other products ...",1,1044,409,0,155,6,0,0,0,33
110419,Rolled or flaked grains of cereals (excluding oats),24,44,22,110,192,341,39,47,32,33
290542,Pentaerythritol,0,0,0,0,0,0,25,0,5,32
842840,Escalators and moving walkways,1,34,0,34,0,0,0,2,18,32
10633,"Live ostriches, and emus [Dromaius novaehollandiae]",0,13,0,0,0,26,0,0,0,32
30732,"Mussels """"Mytilus spp., Perna spp."""", frozen, even in shell""""",0,0,0,0,0,0,664,104,49,32
293499,"Nucleic acids and their salts, whether or not chemically defined; heterocyclic compounds (excl. ...""",143,217,656,18,11,6,219,23,3,32
510529,"Wool, combed (excluding that in fragments """"open tops"""")""""",0,0,0,0,0,0,0,0,0,32
841830,"Freezers of the chest type, of a capacity <= 800 l",48,42,198,368,121,40,19,274,243,32
540824,"Woven fabrics of yarn containing >= 85% artificial filament by weight, incl. monofilament of ...",0,0,1,4,97,15,0,34,5,32
511220,"Woven fabrics containing predominantly, but < 85% combed wool or combed fine animal hair by ...",0,0,0,0,1,0,7,30,4,32
570410,"Floor tiles, of felt, not tufted or flocked, with an area of <= 0,3 m",0,0,0,0,0,1,13,31,68,32
521211,"Woven fabrics of cotton, containing predominantly, but < 85% cotton by weight, other than those ...",0,0,16,12,46,18,0,13,2,32
200510,"Homogenised vegetables put up for retail sale as infant food or for dietetic purposes, in containers ...",9,22,2,80,6,102,189,169,137,31
847010,"Electronic calculators capable of operation without an external source of electric power and ...""",2,0,0,550,1128,352,252,160,0,31
847930,Presses for the manufacture of particle board or fibre building board of wood or other ligneous ...,126,148,531,593,633,371,155,270,40,31
851920,"Sound recording or sound reproducing apparatus, operated by coins, banknotes, bank cards, tokens ...",0,1,0,0,1,79,83,0,2,31
291816,"Gluconic acid, its salts and esters",2,18,15,2,2,17,2,11,14,31
280910,Diphosphorus pentaoxide,0,0,0,0,0,0,0,0,0,31
441850,"Shingles and shakes, of wood",121,175,19,323,147,40,226,33,1,31
293329,"Heterocyclic compounds with nitrogen hetero-atom[s] only, containing an unfused imidazole ring, ...",46,23,35,24,0,54,204,5,26,30
700231,"Tubes of fused quartz or other fused silica, unworked",11,9,0,0,0,0,0,4,13,30
960860,"Refills for ball-point pens, comprising the ball-point and ink-reservoir",4,3,24,17,109,38,15,99,156,30
80620,Dried grapes,1638,2308,2080,912,316,65,124,468,533,30
320190,Tanning extracts of vegetable origin (excluding quebracho extract and wattle extract); tannins ...,0,0,0,0,87,65,66,50,2,30
860721,"Air brakes and parts thereof for railway or tramway locomotives or rolling stock, n.e.s.",0,0,30,111,280,373,115,0,0,30
551429,"Woven fabrics containing predominantly, but < 85% synthetic staple fibres by weight, mixed ...",101,174,376,504,340,455,1173,1467,1756,30
110319,Groats and meal of cereals (excluding wheat and maize),84,86,58,100,74,150,115,100,155,30
310319,"Superphosphates (excl. such products containing by weight => 35 % of diphosphorus pentaoxide, ...",0,0,0,0,0,0,21,11,56,29
70890,"Fresh or chilled leguminous vegetables, shelled or unshelled (excluding peas """"Pisum sativum"""" ...""",143,904,331,3428,125,104,142,104,41,29
410530,"Skins of sheep or lambs, in the dry state """"crust"""", without wool on, whether or not split ...""",0,0,0,12,14,97,217,131,95,29
440722,"Virola, imbuia and balsa, sawn or chipped lengthwise, sliced or peeled, of a thickness of > ...",14,0,6,0,1,2,0,0,0,29
110811,Wheat starch,3766,2494,300,2586,1118,306,702,770,757,29
290219,"Cyclanes, cyclenes and cycloterpenes (excluding cyclohexane)",125,24,1,0,0,0,0,391,32,29
550190,"Synthetic filament tow as specified in Note 1 to chapter 55 (excluding that of acrylic, modacrylic, ...",191,81,531,6,0,0,2,324,0,29
680620,"Exfoliated vermiculite, expanded clays, foamed slag and similar expanded mineral materials, ...",0,0,40,2,0,0,0,5,4,28
750210,"Nickel, not alloyed, unwrought",0,0,0,1,0,0,0,0,0,28
844833,"Spindles, spindle flyers, spinning rings and ring travellers, for machines of heading 8445",11,0,53,0,30,14,29,55,0,28
830621,"Statuettes and other ornaments, of base metal, plated with precious metal (excluding works ...",0,0,0,0,44,12,0,9,6,28
730422,"Drill pipe, seamless, of stainless steel, of a kind used in drilling for oil or gas",123,0,48,3,11,4,0,5,1,28
330119,"Essential oils of citrus fruit, whether or not terpeneless, incl. concretes and absolutes (excluding ...",122,151,30,35,3,1,166,14,0,28
110900,"Wheat gluten, whether or not dried",0,0,0,0,0,126,34,2,0,28
110311,Groats and meal of wheat,84,10,2,1,0,24,28,58,20,27
540783,"Woven fabrics of yarn containing predominantly, but < 85% synthetic filament by weight, incl. ...",137,171,69,71,101,52,138,13,18,27
580500,"Hand-woven tapestries of the type Gobelin, Flanders, Aubusson, Beauvais and the like, and needle-worked ...",1,5,2,3,7,10,8,25,142,27
843930,Machinery for finishing paper or paperboard (excluding calenders),31,365,36,15,104,63,184,432,31,27
901010,Apparatus and equipment for automatically developing photographic or cinematographic film or ...,133,61,87,15,4,6,3,0,0,27
853939,"Discharge lamps (excluding flourescent, hot cathode lamps, mercury or sodium vapour lamps, ...",22924,1762,4841,3529,214,139,281,203,64,27
961390,"Parts of lighters, n.e.s.",150,386,1,0,5,177,709,46,21,27
370242,"Photographic film """"incl. instant print film"""", sensitised, in rolls, unexposed, without perforations, ...""",0,0,0,0,0,0,0,0,0,27
900653,Cameras for roll film of a width of 35 mm (excl. instant print cameras and special cameras ...,0,15,1,0,0,2,1,0,33,27
911310,"Watch straps, watch bands and watch bracelets, and parts thereof, of precious metal or of metal ...",0,0,0,0,0,0,0,0,0,26
730512,"Line pipe of a kind used for oil or gas pipelines, having circular cross-sections and an external ...",11,7,154,16,54,69,17,7,0,26
283531,"Sodium triphosphate """"sodium tripolyphosphate"""", whether or not chemically defined""""",6,3,3,15,3,7,37,190,323,26
290543,Mannitol,5,3,0,7,2,7,13,24,15,26
282090,Manganese oxides (excluding manganese dioxide),2,22,0,0,0,0,0,0,17,26
521215,"Woven fabrics of cotton, containing predominantly, but < 85% cotton by weight, other than those ...",3,0,18,25,17,535,14,81,3,26
280200,"Sulphur, sublimed or precipitated; colloidal sulphur",0,0,6,1,0,0,0,0,0,26
720840,"Flat-rolled products of iron or non-alloy steel, of a width of >= 600 mm, not in coils, simply ...",357,97,120,19,61,139,104,448,257,26
711890,Coin of legal tender,0,0,0,0,0,0,0,0,0,26
310250,"Sodium nitrate (excluding that in pellet or similar forms, or in packages with a gross weight ...",0,0,0,0,96,50,63,5,77,26
843910,"Machinery for making pulp of fibrous cellulosic material (excluding autoclaves, boilers and ...",0,89,0,0,0,2,0,0,178,26
521221,"Woven fabrics of cotton, containing predominantly, but < 85% cotton by weight, other than those ...",0,0,0,0,0,0,0,5,2,26
720120,"Non-alloy pig iron in pigs, blocks or other primary forms, containing by weight >= 0,5% phosphorus",0,0,0,0,0,0,0,0,4,26
511119,Woven fabrics containing >= 85% carded wool or carded fine animal hair by weight and weighing ...,0,0,585,130,37,128,427,472,306,26
732112,"Appliances for baking, frying, grilling and cooking and plate warmers, for domestic use, of ...",29,53,60,50,85,43,6,13,28,25
151519,"Linseed oil and fractions thereof, whether or not refined, but not chemically modified (excluding ...",3,0,0,4,0,0,0,0,12,25
40729,"Fresh birds' eggs, in shell (excluding of domestic fowls, and fertilised for incubation)",37,2245,2552,1117,557,313,170,294,343,25
382000,Anti-freezing preparations and prepared de-icing fluids (excluding prepared additives for mineral ...,38,66,12,0,136,89,186,170,20,25
701720,"Laboratory, hygienic or pharmaceutical glassware, whether or not graduated or calibrated, having ...",0,0,0,0,0,0,0,0,0,25
370320,"Photographic paper, paperboard and textiles, sensitised, unexposed, for colour photography ...""",111,42,40,0,0,3,0,0,7,25
280110,Chlorine,0,0,0,5,0,0,8,12,1,25
290242,M-Xylene,0,0,4,0,0,0,0,0,0,25
280610,"Hydrogen chloride """"hydrochloric acid""""""""",43,28,61,155,14,32,23,34,43,25
283510,"Phosphinates """"hypophosphites"""" and phosphonates """"phosphites""""""""",0,0,45,27,30,0,25,7,0,24
551643,"Woven fabrics containing predominantly, but < 85% artificial staple fibres by weight, mixed ...",0,0,0,0,0,0,0,10,14,24
540744,Woven fabrics of yarn containing >= 85% by weight of filaments of nylon or other polyamides ...,6,0,0,118,400,33,9,354,1522,24
843039,"Coal or rock cutters and tunnelling machinery, not self-propelled (excluding hand-operated ...",29,24,1786,114,2,0,0,2,0,24
550130,"Filament tow as specified in Note 1 to chapter 55, acrylic or modacrylic",0,0,246,372,247,545,116,26,2,24
400239,"Halo-isobutene-isoprene rubber """"CIIR"""" or """"BIIR"""", in primary forms or in plates, sheets ...""",0,70,34,20,32,49,64,18,38,24
960400,Hand sieves and hand riddles (excluding colanders),7,2,2,1,2,2,6,3,2,24
521143,"Woven fabrics of cotton, containing predominantly, but < 85% cotton by weight, mixed principally ...",0,0,0,0,0,0,4,3,10,24
520420,"Cotton sewing thread, put up for retail sale",43,25,36,552,564,268,186,167,92,23
284440,"Radioactive elements, isotopes and compounds, and alloys and dispersions, incl. cermets, ceramic ...",96,8,0,137,88,539,117,115,318,23
20745,Frozen cuts and edible offal of domestic ducks,0,272,183,479,71,133,197,834,4070,23
370298,"Photographic film, sensitised, in rolls, unexposed, with perforations, for monochrome photography, ...",0,147,275,1,70,55,28,183,40,23
40610,"Fresh cheese """"unripened or uncured cheese"""", incl. whey cheese, and curd""""",0,0,0,0,0,23,0,0,0,23
521224,"Woven fabrics of cotton, containing predominantly, but < 85% cotton by weight, other than those ...",5,0,0,6,3,0,0,2,22,23
580136,"Chenille fabrics, of man-made fibres (excluding terry towelling and similar woven terry fabrics, ...",0,4,0,36,31,53,61,677,530,23
310560,Mineral or chemical fertilisers containing the two fertilising elements phosphorus and potassium ...,0,0,0,12,11,109,29,2,28,23
71450,"Yautia """"Xanthosoma spp."""", fresh, chilled, frozen or dried, whether or not sliced or in the ...""",2301,1909,3174,2473,3703,5164,4770,3787,3351,23
40819,"Egg yolks, fresh, cooked by steaming or boiling in water, moulded, frozen or otherwise preserved, ...",0,0,0,0,9,19,728,1480,1091,23
30811,"Live, fresh or chilled, sea cucumbers """"Stichopus japonicus, Holothurioidea""""""""",0,0,766,124,0,44,0,0,1,23
540810,"Woven fabrics of high-tenacity viscose yarn, incl. monofilament of >= 67 decitex and a maximum ...",1,0,67,160,435,203,117,87,181,23
720928,"Flat-rolled products of iron or non-alloy steel, of a width of >= 600 mm, not in coils, simply ...""",2091,2214,1928,62,2149,467,539,1216,57,23
282759,"Bromides and bromide oxides (excluding of sodium, potassium and mercury)",0,0,0,0,0,0,0,0,0,23
292419,"Acyclic amides, incl. acyclic carbamates, and their derivatives, and salts thereof (excluding ...",31,20,638,0,13,185,362,148,132,23
845910,"Way-type unit head machines for drilling, boring, milling, threading or tapping metal",0,47,2,3,70,0,29,8,23,23
291990,"Phosphoric esters and their salts, incl. lactophosphates; their halogenated, sulphonated, ...""",2,57,0,2,34,13,17,29,99,22
293623,"Vitamin B2 and its derivatives, used primarily as vitamins",5,3,3,1,48,607,1270,425,208,22
520821,"Plain woven fabrics of cotton, containing >= 85% cotton by weight and weighing <= 200 g/m, ...",0,0,0,9,1,9,436,270,44,22
540821,"Woven fabrics of yarn containing >= 85% artificial filament by weight, incl. monofilament of ...",0,0,2,328,0,4,0,0,93,22
294110,Penicillins and their derivatives with a penicillanic acid structure; salts thereof,152,49,10,198,81,125,1,9,0,22
851390,"Parts of portable electrical lamps designed to function by their own source of energy, n.e.s.",47,1,141,1,0,0,1,2,11,22
370130,"Photographic plates and film in the flat, sensitised, unexposed, with any side > 255 mm",7098,12452,15104,8839,4265,4703,5050,406,100,22
340420,"Poly""""oxyethylene"""" [polyethylene glycol] waxes""""",34,60,24,0,71,0,15,26,40,22
540774,"Woven fabrics of yarn containing >= 85% synthetic filament by weight, incl. monofilament of ...",0,289,29,3,2,1,16,68,6,22
550911,Single yarn containing >= 85% nylon or other polyamide staple fibres by weight (excluding sewing ...,14284,13352,4963,11,3,22,6,66,44,22
282739,"Chlorides (excluding ammonium, calcium, magnesium, aluminium, nickel and mercury chloride)",23,21,55,74,48,26,9,135,44,21
846241,"Punching or notching machines, incl. presses, and combined punching and shearing machines, ...",188,113,6,66,126,35,14,38,125,21
90300,Mate,0,0,0,5,0,1,0,0,0,21
160239,"Prepared or preserved meat or meat offal of ducks, geese and guinea fowl of the species domesticus ...",1046,2207,1578,634,231,504,652,6741,6028,21
283220,Sulphites (excluding sodium),6,48,39,50,28,39,0,119,50,21
600542,"Dyed warp knit fabrics of artificial fibres """"incl. those made on galloon knitting machines"""", ...""",623,0,36,20,16,122,87,141,20,21
551423,"Woven fabrics containing predominantly, but < 85% polyester staple fibres by weight, mixed ...",5,4,8,53,39,163,38,56,366,21
680911,"Boards, sheets, panels, tiles and similar articles, of plaster or compositions based on plaster, ...",8,28,79,135,133,1324,531,5,292,21
270300,"Peat, incl. peat litter, whether or not agglomerated",8,30,17,0,0,0,19,0,3,21
590500,Textile wallcoverings,0,0,0,0,0,0,9,0,0,21
291711,"Oxalic acid, its salts and esters (excluding inorganic or organic compounds of mercury)",1,0,0,7,6,26,29,6,7,20
551449,"Woven fabrics containing predominantly, but < 85% synthetic staple fibres by weight, mixed ...",27,0,46,934,733,836,255,1024,121,20
600340,"Knitted or crocheted fabrics of artificial fibres, of a width of <= 30 cm (excluding those ...""",0,0,0,0,0,0,5,0,0,20
360610,Liquid or liquefied-gas fuels in containers of a kind used for filling or refilling cigarette ...,0,0,0,0,0,0,0,0,0,20
30274,"Fresh or chilled eels """"Anguilla spp.""""""""",0,0,0,0,0,2,0,0,0,20
71233,"Dried jelly fungi """"Tremella spp."""", whole, cut, sliced, broken or in powder, but not further ...""",0,1,1,1,4,5,7,6,6,20
290944,Monoalkylethers of ethylene glycol or of diethylene glycol (excluding monobutyl ethers),0,7,0,0,0,0,0,4,7,20
291811,"Lactic acid, its salts and esters (excluding inorganic or organic compounds of mercury)",36,9,10,27,29,26,18,20,12,20
910591,"Clocks, electrically operated (excluding wrist-watches, pocket-watches and other watches of ...",1,0,71,9,108,196,137,131,206,20
750620,"Plates, sheets, strip and foil, of nickel alloys (excluding expanded plates, sheets or strip)",64,0,16,38,6,5,16,32,23,20
810297,Molybdenum waste and scrap (excluding ash and residues containing molybdenum),0,0,13,8,0,3,0,18,33,20
40510,Butter (excluding dehydrated butter and ghee),328,184,30,24,55,85,247,119,58,19
291590,"Saturated acyclic monocarboxylic acids, their anhydrides, halides, peroxides and peroxyacids; ...",6,3,5,0,16,102,145,178,70,19
30234,"Fresh or chilled bigeye tunas """"Thunnus obesus""""""""",33634,13146,7627,2301,1,15,0,0,7,19
291429,"Cyclanic, cyclenic or cycloterpenic ketones, without other oxygen function (excluding cyclohexanone, ...",0,3,1,51,54,56,63,34,38,19
280512,Calcium,0,0,0,0,0,1,0,0,0,19
570250,"Carpets and other textile floor coverings, woven, not tufted or flocked, not of pile construction, ...""",179,25,0,0,0,1,0,0,0,19
842641,"Mobile cranes and works trucks fitted with a crane, self-propelled, on tyres (excluding wheel-mounted ...",3399,953,632,844,64,63,824,633,1104,19
910519,Alarm clocks (excluding electrically operated),22,890,1074,1828,1475,1260,175,500,958,19
110313,"Groats and meal of maize """"corn""""""""",3,3,2,6,49,0,0,78,352,19
540834,"Woven fabrics of yarn containing predominantly, but < 85% artificial filament by weight, incl. ...",0,2,0,0,0,0,7,2,13,19
901813,Magnetic resonance imaging apparatus,230,0,0,303,226,1768,323,364,186,19
292019,"Thiophosphoric esters """"phosphorothioates"""" and their salts; their halogenated, sulphonated, ...""",0,0,0,0,0,0,32,0,0,19
521223,"Woven fabrics of cotton, containing predominantly, but < 85% cotton by weight, other than those ...",110,57,105,65,220,145,107,147,68,19
841911,Instantaneous gas water heaters (excluding boilers or water heaters for central heating),0,27,3,6,56,4,0,14,0,19
844120,"Machines for making bags, sacks or envelopes out of paper pulp, paper or paperboard (excluding ...",1072,550,6,96,471,0,228,380,79,18
920190,Harpsichords and other keyboard stringed instruments (excluding pianos),1961,152,14,325,2387,10,15,166,2096,18
290619,"Cyclanic, cyclenic or cycloterpenic alcohols and their halogenated, sulphonated, nitrated or ...",32,5,19,3,5,5,12,10,20,18
560130,Textile flock and dust and mill neps,0,3,6,99,71,309,21,70,56,18
851930,"Turntables """"record-decks""""""""",0,0,1,0,28,8,42,6,5,18
860712,Bogies and driving bissel-bogies for railway or tramway locomotives or rolling stock (excluding ...,0,0,0,0,0,0,0,0,0,18
846596,"Splitting, slicing or paring machines, for working wood",127,225,211,92,128,228,743,506,574,18
80522,Fresh or dried clementines incl. monreales,0,0,0,0,0,0,8,8,3,18
732219,"Radiators for central heating, non-electrically heated, and parts thereof, of iron other than ...",21,29,2,2,12,33,3705,5835,8476,17
300220,Vaccines for human medicine,345,262,5,179,158,129,95,485,357,17
40291,"Milk and cream, concentrated but unsweetened (excluding in solid forms)",2,4,1,0,2,3,4,0,0,17
282560,Germanium oxides and zirconium dioxide,0,0,0,0,0,0,0,3,0,17
846024,"Grinding machines for finishing metal, numerically controlled (excl. flat-surface, cylindrical ...",0,0,0,0,0,0,104,80,21,17
551614,"Woven fabrics containing >= 85% artificial staple fibres by weight, printed",0,0,5,88,0,1,10,80,69,17
852210,Pick-up cartridges,10,42,6,2,3,2,82,27,107,17
844090,"Parts of bookbinding machinery, n.e.s.",0,11,25,3338,4467,1126,274,187,180,17
40150,"Milk and cream of a fat content by weight of > 10%, not concentrated nor containing added sugar ...",207,188,20,84,70,5,154,54,95,17
480610,"Vegetable parchment, in rolls of a width > 36 cm or in square or rectangular sheets with one ...",0,0,1,3,4,18,14,5,28,17
722511,"Flat-rolled products of silicon-electrical steel, of a width of >= 600 mm, grain-oriented",62,454,358,434,1000,5553,1129,993,2085,17
970400,"Postage or revenue stamps, stamp-postmarks, first-day covers, postal stationery, stamped paper ...",0,0,0,0,0,0,0,0,0,17
10639,"Live birds (excluding birds of prey, psittaciformes, parrots, parrakeets, macaws, cockatoos, ...",0,0,0,0,6,0,29,80,61,17
350190,Caseinates and other casein derivatives; casein glues (excluding those put up for retail sale ...,29,94,4,70,182,27,17,45,18,17
370390,"Photographic paper, paperboard and textiles, sensitised, unexposed, for monochrome photography ...",25,0,3,3,3,0,41,0,2,17
300670,Gel preparations designed to be used  in human or veterinary medicine as a lubricant for parts ...,10,2,1,0,3,35,67,29,105,16
292219,"Amino-alcohols, their ethers and esters; salts thereof (other than those containing > one ...""",246,38,0,2,1,0,8,15,105,16
30214,"Fresh or chilled Atlantic salmon """"Salmo salar"""" and Danube salmon """"Hucho hucho""""""""",13,17,0,949,0,114,938,1815,913,16
20727,Frozen cuts and edible offal of turkeys of the species domesticus,0,138,13,0,4,125,182,888,830,16
820510,"Hand-operated drilling, threading or tapping hand tools",670,2720,22,5,23,4,16,1,3,16
720441,"Turnings, shavings, chips, milling waste, sawdust, filings, trimmings and stampings of iron ...",1193,982,766,554,757,1155,517,236,485,16
580430,"Handmade lace in the piece, in strips or in motifs (excluding fabrics of heading 6002 to 6006)",0,0,0,13,4,18,5,0,0,16
