Code,Product label,Exported value in 2012,Exported value in 2013,Exported value in 2014,Exported value in 2015,Exported value in 2016,Exported value in 2017,Exported value in 2018,Exported value in 2019,Exported value in 2020,Exported value in 2021
TOTAL,All products,114529171,132032854,150217139,162016742,176580787,215118607,243698698,264610323,281441457,406755914
851712,"Telephones for cellular networks """"mobile telephones"""" or for other wireless networks""""",10093132,19325914,21333372,25088232,27155262,29646866,31125419,34151090,31090302,39111875
854231,"Electronic integrated circuits as processors and controllers, whether or not combined with ...",1705350,1913693,1602284,3372170,4654262,6024347,7006900,10567498,13019564,31054183
851770,"Parts of telephone sets, telephones for cellular networks or for other wireless networks and ...",2341127,1762614,2073874,5016965,7210675,15847655,18126229,17517831,20864755,28074784
851762,"Machines for the reception, conversion and transmission or regeneration of voice, images or ...",376126,510462,723336,981246,1500963,1970796,3054675,4412803,9643298,14420409
852990,"Parts suitable for use solely or principally with flat panel display modules, transmission ...",95556,111020,271563,318329,356457,605328,2439625,2897438,5170175,13926661
847330,Parts and accessories of automatic data-processing machines or for other machines of heading ...,276348,318107,318241,480268,433810,498371,468664,1066567,3078781,9762658
999999,Commodities not elsewhere specified,369619,527702,550840,618664,246075,287071,3884982,4472089,2888636,8557994
640411,"Sports footwear, incl. tennis shoes, basketball shoes, gym shoes, training shoes and the like, ...",1445604,1596849,2202589,2910309,3795981,4663987,4749936,5410060,4555183,7093347
847130,"Data-processing machines, automatic, portable, weighing <= 10 kg, consisting of at least a ...",1128561,2911179,3166515,4151817,2996363,2859811,2958149,3025524,4197970,5210410
851830,"Headphones and earphones, whether or not combined with microphone, and sets consisting of a ...",478825,636455,491207,653019,1275233,1805684,1648463,1825818,1152140,4975263
640419,Footwear with outer soles of rubber or plastics and uppers of textile materials (excluding ...,706150,1265929,1461937,1941820,2341151,2850821,3500975,3836798,3863755,4972377
640399,"Footwear with outer soles of rubber, plastics or composition leather, with uppers of leather ...",1448934,2494405,2741165,2952812,2815966,2971870,3303147,3664990,3382124,4922094
940161,"Upholstered seats, with wooden frames (excluding convertible into beds)",111926,153236,178537,188256,283180,431639,695244,1194169,1748997,4426010
940360,"Wooden furniture (excluding for offices, kitchens and bedrooms, and seats)",832872,912531,1170711,1337505,1360439,1533406,1700448,1960324,2307078,4244570
640299,Footwear with outer soles and uppers of rubber or plastics (excluding covering the ankle or ...,1185242,1205564,1547538,1657350,1658648,1716139,1889767,2308692,2176232,3564093
854430,"Ignition wiring sets and other wiring sets for vehicles, aircraft or ships",1630398,1868144,1962344,1974574,2008435,2311678,2599179,2825387,2676329,3230456
854140,"Photosensitive semiconductor devices, incl. photovoltaic cells whether or not assembled in ...",111706,135239,92150,551223,1617756,2325299,2000068,3507962,4460421,2997497
940350,Wooden furniture for bedrooms (excluding seats),900200,1002600,1060964,1014195,1088113,1186412,1219627,1325972,1363822,2926426
80132,"Fresh or dried cashew nuts, shelled",1443109,1596348,1930396,2315661,2732522,3385090,3128961,2941542,2843195,2912469
611020,"Jerseys, pullovers, cardigans, waistcoats and similar articles, of cotton, knitted or crocheted ...",929238,1114763,1137552,1123399,1123636,1210243,1551356,1922061,1814401,2841275
852872,"Reception apparatus for television, colour, whether or not incorporating radio-broadcast receivers ...",126561,237058,345204,603392,1207178,1736196,1511458,1604167,1981258,2604020
950300,"Tricycles, scooters, pedal cars and similar wheeled toys; dolls' carriages; dolls; other toys; ...""",212346,245370,354547,447721,600325,803578,875607,1018424,1054139,2439359
852580,"Television cameras, digital cameras and video camera recorders",73245,110450,365356,871378,901312,1358865,2268382,1976684,2066189,2436098
854442,"Electric conductors for a voltage <= 1.000 V, insulated, fitted with connectors, n.e.s.",95075,93819,130558,195000,287157,390205,509215,1087127,1527410,2433154
640391,"Footwear with outer soles of rubber, plastics or composition leather, with uppers of leather, ...",562330,838610,1167426,1277542,1186342,1288475,1429324,1555263,1518887,2289217
90111,Coffee (excluding roasted and decaffeinated),3507401,2513198,3267706,2341585,2967118,3007675,2811711,2135113,1886972,2233123
420292,"Travelling-bags, insulated food or beverage bags, toilet bags, rucksacks, shopping-bags, map-cases, ...",528165,647245,1043043,1149970,1285819,1160254,1319435,1431620,1290469,2141853
850440,Static converters,32006,95515,149927,356884,511639,537759,566389,820351,1185593,2117644
30617,"Frozen shrimps and prawns, even smoked, whether in shell or not, incl. shrimps and prawns in ...",1505834,1988909,2481753,1731416,1820293,2204604,1973110,1961743,1942353,2062075
440122,Wood in chips or particles (excluding those of a kind used principally for dying or tanning ...,807901,1076718,981103,1168713,982046,1047356,1309183,1620144,1468398,1979745
721049,"Flat-rolled products of iron or non-alloy steel, of a width of >= 600 mm, hot-rolled or cold-rolled ...""",55150,61419,116925,135325,323575,476915,592544,470426,492149,1939934
270900,"Petroleum oils and oils obtained from bituminous minerals, crude",8397950,7375358,7224230,3823780,2578325,3108577,2146666,1892580,1568351,1895860
844331,"Machines which perform two or more of the functions of printing, copying or facsimile transmission, ...",889681,1067546,1022358,1053053,1088598,1374461,1772299,1904457,1985644,1816390
620193,"Men's or boys' anoraks, windcheaters, wind jackets and similar articles, of man-made fibres ...",480336,665758,790179,817012,859628,1058541,1435655,1510901,1233445,1792798
400280,"Mixtures of natural rubber, balata, gutta-percha, guayule, chicle or similar types of natural ...",1574,1891,2227,212786,750663,1277635,1102106,1256487,1563367,1780607
844399,"Parts and accessories of printers, copying machines and facsimile machines, n.e.s. (excluding ...",191040,210187,225505,253116,297542,378785,442233,472092,421137,1749655
100630,"Semi-milled or wholly milled rice, whether or not polished or glazed",3465298,2816412,2852873,2620651,2039764,2443631,2461880,2163697,2360612,1706248
611030,"Jerseys, pullovers, cardigans, waistcoats and similar articles, of man-made fibres, knitted ...",581468,692154,937915,1146904,1188910,1390720,1504113,1656412,1315052,1684502
610463,"Women's or girls' trousers, bib and brace overalls, breeches and shorts of synthetic fibres, ...",226495,303976,444073,579426,657799,872311,945371,1049498,1196848,1543758
620343,"Men's or boys' trousers, bib and brace overalls, breeches and shorts of synthetic fibres (excluding ...",480199,603948,780841,920727,950496,1097543,1306111,1343366,1196554,1507200
610910,"T-shirts, singlets and other vests of cotton, knitted or crocheted",751407,859329,911514,1067847,1142849,1076741,1245442,1386020,1303431,1486337
853400,Printed circuits,272144,344284,443344,533718,535173,639625,756251,1064644,1093481,1462489
620293,"Women's or girls' anoraks, windcheaters, wind jackets and similar articles, of man-made fibres ...",301976,433030,568407,602096,629982,764681,1035278,1152580,923086,1434119
846729,"Electromechanical tools for working in the hand, with self-contained electric motor (excluding ...",584,421,624,885,439,327,292,5148,271037,1404944
720711,"Semi-finished products of iron or non-alloy steel containing, by weight, < 0,25% of carbon, ...",12792,17564,38086,7444,3,4390,3844,123863,750139,1337445
520512,"Single cotton yarn, of uncombed fibres, containing >= 85% cotton by weight and with a linear ...""",318785,416721,580296,550759,834846,1037592,1069960,1202747,1048404,1294743
852852,Monitors capable of directly connecting to and designed for use with an automatic data processing ...,0,0,0,0,0,0,6745,33425,256531,1289749
853710,"Boards, cabinets and similar combinations of apparatus for electric control or the distribution ...",85890,53663,59747,93997,439442,550943,627006,672783,715738,1281229
854239,"Electronic integrated circuits (excluding such as processors, controllers, memories and amplifiers)",240709,243335,549479,638003,511766,731846,779511,890103,736943,1279834
160521,"Shrimps and prawns, prepared or preserved, not in airtight containers (excluding smoked)",374771,589144,791827,709501,733870,656514,434969,356845,382655,1251187
252310,Cement clinkers,426330,516746,621422,439747,324806,492957,762052,811043,767809,1173784
940320,"Metal furniture (excluding for offices, seats and medical, surgical, dental or veterinary  ...",66908,88199,117584,151076,164064,182280,244778,401089,659403,1148407
621210,"Brassieres of all types of textile materials, whether or not elasticated, incl. knitted or ...",137767,154428,183058,213233,363179,561480,690134,820477,721248,1132250
940390,"Parts of furniture, n.e.s. (excluding of seats and medical, surgical, dental or veterinary ...",374314,414057,487797,595878,631338,639350,670850,844899,1120832,1072959
30462,"Frozen fillets of catfish """"Pangasius spp., Silurus spp., Clarias spp., Ictalurus spp.""""""""",1619728,1584158,1610008,1422509,1530189,1570980,1973718,1721349,1242897,1050681
392690,"Articles of plastics and articles of other materials of heading 3901 to 3914, n.e.s (excluding ...",333801,355892,438673,486320,520451,562645,667630,750748,817782,1042662
847180,"Units for automatic data-processing machines (excluding processing units, input or output units ...",7172,15446,21942,44444,25742,5639,7019,156832,291912,1022293
620463,"Women's or girls' trousers, bib and brace overalls, breeches and shorts of synthetic fibres ...",382088,511757,665902,758807,777249,786293,895858,950698,864059,1002360
620462,"Women's or girls' trousers, bib and brace overalls, breeches and shorts of cotton (excluding ...",497669,612223,542727,555999,550068,576682,722688,810519,750026,986124
610462,"Women's or girls' trousers, bib and brace overalls, breeches and shorts of cotton, knitted ...",233428,268366,326361,373028,409914,492649,554623,555469,607182,920050
721061,"Flat-rolled products of iron or non-alloy steel, of a width of >= 600 mm, hot-rolled or cold-rolled ...""",221558,344819,331719,174894,200719,324608,508578,287982,372206,916197
620342,"Men's or boys' trousers, bib and brace overalls, breeches and shorts, of cotton (excluding ...",495843,589240,619227,603436,658759,665475,727989,764007,604495,911005
392321,"Sacks and bags, incl. cones, of polymers of ethylene",396946,449274,515122,516201,541101,637727,756788,792276,762485,904378
252329,"Portland cement (excluding white, whether or not artificially coloured)",119387,263205,286647,224341,226692,190482,378412,482287,580238,894217
851829,"Loudspeakers, without enclosure",256128,284373,458970,482990,558091,685614,778495,801412,857683,887477
847160,"Input or output units for automatic data-processing machines, whether or not containing storage ...",41746,68072,55619,13984,35979,40344,27967,39467,100485,885725
401120,"New pneumatic tyres, of rubber, of a kind used for buses and lorries (excluding typres with ...",196260,187772,129197,62507,77375,143262,230957,389835,537846,881747
610990,"T-shirts, singlets and other vests of textile materials, knitted or crocheted (excluding cotton)",400673,539016,705758,803556,893999,1006157,1190022,1178020,1035429,880378
902140,Hearing aids (excluding parts and accessories),45571,46707,49538,53764,55295,74438,95608,169961,155996,860999
950450,Video game consoles and machines (excluding operated by any means of payment),0,0,0,5,119,3599,168,316465,954748,848716
851822,"Multiple loudspeakers, mounted in the same enclosure",10918,6099,6337,9661,36093,90730,70840,113119,183245,844700
844332,"Machines which only perform one of the functions of printing, copying or facsimile transmission, ...",1235520,1218803,1190505,1181063,1156814,1465910,1410023,1137962,953660,841020
901380,"Liquid crystal devices, n.e.s. and other optical appliances and instruments not elsewhere specified ...",3506,549,191,577,516323,3053276,3024161,1445286,2726,836763
850720,Lead acid accumulators (excluding spent and starter batteries),312087,348723,433029,399594,413398,491690,621269,693858,747407,821922
850450,Inductors (excluding inductors for discharge lamps or tubes),121981,174243,177974,197742,226936,285002,294941,298236,341289,820773
630790,"Made-up articles of textile materials, incl. dress patterns, n.e.s.",258742,339419,475214,553920,526194,483546,546053,670926,1916873,818840
741110,Tubes and pipes of refined copper,91444,123566,171340,199975,291245,463690,585104,712370,751591,800579
850110,"Motors of an output <= 37,5 W",600827,576224,588543,670788,615110,642320,593354,542132,466283,796356
901890,"Instruments and appliances used in medical, surgical or veterinary sciences, n.e.s.",14708,18474,20499,29136,73829,165831,210419,249338,274310,792751
940340,Wooden furniture for kitchens (excluding seats),128795,150953,168108,173159,181438,204626,287974,380470,694371,768650
340600,Candles and the like,168367,166064,161767,155388,181000,184580,234394,270094,347206,767916
391810,"Floor coverings, whether or not self-adhesive, in rolls or in the form of tiles, and wall ...""",16532,12270,4615,9518,9074,15445,17541,46765,215689,765478
850811,"Vacuum cleaners, incl. dry cleaners and wet vacuum cleaners, with self-contained electric motor, ...",18418,27505,101152,122166,114444,128039,104020,169352,354422,755861
871120,"Motorcycles, incl. mopeds, with reciprocating internal combustion piston engine of a cylinder ...",176912,357886,459749,413158,484908,558125,574223,608731,695953,736919
850760,Lithium-ion accumulators (excluding spent),93627,123910,200640,310413,322093,413896,578517,703510,553928,726907
400122,"Technically specified natural rubber """"TSNR""""""""",2150309,2136805,1460779,885691,690450,695148,702879,714320,474692,722845
81090,"Fresh tamarinds, cashew apples, jackfruit, lychees, sapodillo plums, passion fruit, carambola, ...""",391392,252146,322635,545706,1144740,1479306,1563283,1549394,1341076,722240
841459,"Fans (excluding table, floor, wall, window, ceiling or roof fans, with a self-contained electric ...",68796,68646,128659,116432,129548,191324,159240,224344,446767,714506
940190,"Parts of seats, n.e.s.",130869,143016,165359,231403,204172,215179,300198,410920,408611,713865
940169,"Seats, with wooden frames (excluding upholstered)",506386,527366,628024,679871,747747,800152,680272,749984,788230,696013
854370,"Electrical machines and apparatus, having individual functions, n.e.s. in chapter 85",13201,16236,25315,27380,38259,64876,129488,112917,237914,679531
610343,"Men's or boys' trousers, bib and brace overalls, breeches and shorts of synthetic fibres, knitted ...",95158,144621,195128,210012,293742,363440,482394,533015,520453,676470
720720,"Semi-finished products of iron or non-alloy steel containing, by weight, >= 0,25% of carbon",205974,184998,158417,16117,18381,228690,184695,212104,549136,673371
620520,"Men's or boys' shirts of cotton (excluding knitted or crocheted, nightshirts, singlets and ...",330169,442998,563243,590874,623384,655973,730842,721440,514661,644468
760120,Unwrought aluminium alloys,22838,29809,46098,111295,121522,218765,345266,317829,430406,618664
700600,"Sheets or profiles of glass, whether or not having an absorbent, reflecting or non-reflecting ...",16059,3050,5762,12456,13596,14204,14975,12943,10389,608592
720839,"Flat-rolled products of iron or non-alloy steel, of a width of >= 600 mm, in coils, simply ...",1204,3383,3293,4165,9664,50564,165768,207391,199387,594230
621040,"Men's or boys' garments of textile fabrics, rubberised or impregnated, coated, covered or laminated ...",155231,215321,303777,271886,306041,350045,406276,455029,365156,593168
721391,"Bars and rods, hot-rolled, in irregularly wound coils, of iron or non-alloy steel, of circular ...",36695,29065,16634,25611,21528,126841,257222,177633,343884,592029
441233,"Plywood consisting solely of sheets of wood <= 6 mm thick, with at least one outer ply of non-coniferous ...",0,0,0,0,0,0,77800,171315,217418,590370
90411,"Pepper of the genus Piper, neither crushed nor ground",687624,765277,1023290,1089612,1233929,961993,602448,566099,510855,580531
681099,"Articles of cement, concrete or artificial stone, whether or not reinforced (excluding prefabricated ...",54957,94431,123155,144601,179592,194544,203398,291532,340348,569545
271019,"Medium oils and preparations, of petroleum or bituminous minerals, not containing biodiesel, ...",1298855,952899,915097,575296,534517,1101632,975759,1006592,518707,567627
851761,"Base stations of apparatus for the transmission or reception of voice, images or other data",7052,1218,1294,109,759,7578,1332534,71475,66672,563920
848180,"Appliances for pipes, boiler shells, tanks, vats or the like (excluding pressure-reducing ...""",22737,74427,123512,182431,282148,337107,327203,299008,341481,563799
200819,"Nuts and other seeds, incl. mixtures, prepared or preserved (excluding prepared or preserved ...",29079,99878,70815,110329,146792,187542,264993,424664,495077,563221
540244,"Synthetic filament elastomeric yarn, single, untwisted or with a twist of <= 50 turns per metre ...",138745,159222,253847,273367,280019,301222,371417,344818,287514,559587
940179,"Seats, with metal frames (excluding upholstered, swivel seats with variable height adjustments ...",92555,102729,140381,137362,134464,173010,205835,246776,270132,557072
845020,"Laundry-type washing machines, of a dry linen capacity > 10 kg",33,37,26,3,262696,750669,484700,542733,603238,556031
420221,"Handbags, whether or not with shoulder straps, incl. those without handles, with outer surface ...",42673,84944,141930,171904,248928,180716,292754,311139,225755,554880
870840,"Gear boxes and parts thereof, for tractors, motor vehicles for the transport of ten or more ...",241048,307860,380647,315208,345644,361079,376800,391886,369034,553537
845210,Sewing machines of the household type,67439,99967,185317,214827,234943,236343,284436,278848,362954,546895
650500,"Hats and other headgear, knitted or crocheted, or made up from lace, felt or other textile ...",156150,178382,205040,229845,262141,254537,283759,323883,317914,544700
401519,"Gloves, mittens and mitts, of vulcanised rubber (excl. of a kind used for medical, surgical, ...",55587,64492,80507,76792,91940,112668,143549,152867,311629,544399
847050,Cash registers incorporating a calculating device,4,326,9,4,51,13854,33326,42117,76020,542346
440131,Wood pellets,4318,23132,120594,103432,119746,172263,361676,309220,351877,528547
610342,"Men's or boys' trousers, bib and brace overalls, breeches and shorts of cotton, knitted or ...",31780,34611,45362,71559,90111,108334,178286,252676,323042,527664
640291,"Footwear covering the ankle, with outer soles and uppers of rubber or plastics (excluding waterproof ...",142916,196825,202833,211602,224089,204764,243357,275179,328643,524869
401110,"New pneumatic tyres, of rubber, of a kind used for motor cars, incl. station wagons and racing ...",28013,32197,206571,307789,404078,588265,583637,573531,601270,515390
850220,Generating sets with spark-ignition internal combustion piston engine,1924,1917,2279,1491,496,904,198,11245,153359,506391
720712,"Semi-finished products of iron or non-alloy steel containing, by weight, < 0,25% of carbon, ...""",0,38,55,13,18,7228,207379,124142,385519,488263
600490,"Knitted or crocheted fabrics, of a width of > 30 cm, containing >= 5% by weight elastomeric ...""",2068,1121,6543,8620,9901,5053,8825,7812,5147,488214
852871,"Reception apparatus for television, whether or not incorporating radio-broadcast receivers ...",121250,144765,105624,120562,210381,205941,245077,324260,733244,484201
590220,"Tyre cord fabric of high-tenacity polyester yarn, whether or not dipped or impregnated with ...",264450,307846,326508,308504,287736,307094,344628,377004,287126,479263
390761,"Poly""""ethylene terephthalate"""", in primary forms, having a viscosity number of >= 78 ml/g""""",0,0,0,0,0,0,124946,376670,331449,477018
730890,"Structures and parts of structures, of iron or steel, n.e.s. (excluding bridges and bridge-sections, ...",113339,100629,146602,132861,190366,175026,194215,325913,324942,474381
731210,"Stranded wire, ropes and cables, of iron or steel (excluding electrically insulated products ...",117131,212485,222772,253885,261120,295969,356636,366469,270590,472004
30499,Frozen fish meat n.e.s. (excluding fillets),482571,302516,346537,355835,349798,374535,473862,459195,436821,471489
871410,"Parts and accessories of motorcycles, incl. mopeds, n.e.s.",165776,136350,179683,191029,192523,230513,270288,312022,303615,468151
732690,"Articles of iron or steel, n.e.s. (excluding cast articles or articles of iron or steel wire)",113554,117926,171068,200051,205184,224833,309133,407116,358747,464796
621050,"Women's or girls' garments of textile fabrics, rubberised or impregnated, coated, covered or ...",107083,146831,193598,170287,194464,236278,266906,300511,365917,462490
621143,"Women's or girls' tracksuits and other garments, n.e.s. of man-made fibres (excluding knitted ...",86491,116365,176843,239140,243318,261023,315781,369674,368945,450301
621133,"Men's or boys' tracksuits and other garments, n.e.s. of man-made fibres (excluding knitted ...",111470,143007,168618,191661,197002,208931,274052,322436,314700,445791
610510,"Men's or boys' shirts of cotton, knitted or crocheted (excluding nightshirts, T-shirts, singlets ...",205804,263183,259334,254090,233070,280420,304908,299500,216726,444816
281820,Aluminium oxide (excluding artificial corundum),48,47413,154648,146649,147920,347020,505121,443142,370370,443462
390210,"Polypropylene, in primary forms",109841,139383,148046,80234,96446,125298,182111,294191,321011,435828
852550,"Transmission apparatus for radio-broadcasting or television, not incorporating reception apparatus",14142,13178,14724,11002,6232,6982,3370,22729,17116,432739
842430,"Steam or sand blasting machines and similar jet projecting machines, incl. water cleaning appliances ...",454,2612,466,325,789,540,277,30887,150211,428967
854449,"Electric conductors, for a voltage <= 1.000 V, insulated, not fitted with connectors, n.e.s.",214839,293188,371350,447719,571373,756802,848735,454469,382545,428138
853669,Plugs and sockets for a voltage <= 1.000 V (excluding lamp holders),25348,34490,44439,62083,74043,85238,116331,285593,417209,423936
610520,"Men's or boys' shirts of man-made fibres, knitted or crocheted (excluding nightshirts, T-shirts, ...",181742,201010,213094,248033,294697,358643,356338,385959,290231,417989
853690,"Electrical apparatus for switching electrical circuits, or for making connections to or in ...",146007,179220,193582,157052,209496,279400,380219,373951,378850,414084
382499,"Chemical products and preparations of the chemical or allied industries, incl. those consisting ...",0,0,0,0,0,0,275462,311663,356574,409511
611430,"Special garments for professional, sporting or other purposes, n.e.s., of man-made fibres, ...",87911,112282,144722,127959,134244,169744,203722,251307,285610,398686
610822,"Women's or girls' briefs and panties of man-made fibres, knitted or crocheted",35750,44270,47506,49507,85122,168531,216488,292585,260934,395510
271012,"Light oils and preparations, of petroleum or bituminous minerals which >= 90% by volume """"incl. ...""",377012,205849,186721,159427,113685,158735,167158,131300,95821,390407
611241,"Women's or girls' swimwear of synthetic fibres, knitted or crocheted",38937,67724,100315,114887,122192,142936,197237,279640,253154,388061
850140,"AC motors, single-phase, of an output > 37,5 W",37575,50264,51521,50679,64762,56514,83674,145950,277361,379462
852859,"Monitors, not incorporating television reception apparatus (excluding with cathode ray tube ...",651,4954,23295,39757,140538,256742,677142,1185184,1500458,379248
847190,"Magnetic or optical readers, machines for transcribing data onto data media in coded form and ...",254313,323449,410055,385145,467446,460632,400160,422751,463728,376070
853650,Switches for a voltage <= 1.000 V (excluding relays and automatic circuit breakers),69160,88401,119337,127227,135157,178192,96909,118585,149315,372509
853890,"Parts suitable for use solely or principally with the apparatus of heading 8535, 8536 or 8537, ...",20797,23981,28092,42701,56722,74493,87932,113406,173239,367913
630532,"Flexible intermediate bulk containers, for the packing of goods, of synthetic or man-made textile ...",96477,124666,167323,85004,173363,204366,240901,261614,308300,367000
280470,Phosphorus,136404,146871,204057,198045,208111,232313,279835,240149,249930,362794
392620,Articles of apparel and clothing accessories produced by the stitching or sticking together ...,92713,91590,96785,98058,106896,139836,157126,174099,198558,360932
903180,"Instruments, appliances and machines for measuring or checking, not elsewhere specified in ...",11239,28446,56313,67277,47862,62857,54857,70286,127614,360555
720838,"Flat-rolled products of iron or non-alloy steel, of a width of >= 600 mm, in coils, simply ...",134,479,526,544,2341,18288,68437,86287,75520,359157
640219,Sports footwear with outer soles and uppers of rubber or plastics (excluding waterproof footwear ...,387327,308198,356454,413631,467186,452746,466081,479822,298185,358438
853120,"Indicator panels with liquid crystal devices """"LCD"""" or light emitting diodes """"LED"""" (excluding ...""",422,175,668,514,2007,127,1423,4521,9166,357487
