Code,Product label,Imported value in 2012,Imported value in 2013,Imported value in 2014,Imported value in 2015,Imported value in 2016,Imported value in 2017,Imported value in 2018,Imported value in 2019,Imported value in 2020,Imported value in 2021
TOTAL,All products,271518081,270128149,273647330,228407580,229052733,257510859,285050277,285906281,287171262,382498457
854239,"Electronic integrated circuits (excluding such as processors, controllers, memories and amplifiers)",22970676,23597907,25365041,23263494,24227814,25931437,27291286,26370178,26777905,35057985
854232,Electronic integrated circuits as memories,5573233,4818345,5431547,4931682,8295298,13264776,18157409,19234409,25586354,33781517
270900,"Petroleum oils and oils obtained from bituminous minerals, crude",35750509,33573234,32096516,16069861,12910667,16836698,23346537,21326199,12624769,19889322
848620,Machines and apparatus for the manufacture of semiconductor devices or of electronic integrated ...,7405743,8746713,6652092,6991456,9557322,7544276,6453069,12659910,11121841,17009104
854231,"Electronic integrated circuits as processors and controllers, whether or not combined with ...",2568572,2866098,3009120,2989741,3208129,3876774,4943731,7676826,9666271,12114421
271111,"Natural gas, liquefied",9862571,9795381,9950352,6334058,4920209,6379084,7972160,7585048,5510295,10997299
271019,"Medium oils and preparations, of petroleum or bituminous minerals, not containing biodiesel, ...",14342442,16269263,14498031,8859795,8035800,8966095,10061108,6832611,5516332,9518071
847330,Parts and accessories of automatic data-processing machines or for other machines of heading ...,1259678,1320102,1551401,1386398,1557216,2822434,3181798,3817384,5197863,7454859
270112,"Bituminous coal, whether or not pulverised, non-agglomerated",7585853,6556226,5754844,4714974,4467025,6629972,7296867,6017990,4211568,7263761
848690,Parts and accessories for machines and apparatus of a kind used solely or principally for the ...,1527262,2218244,2460938,2350815,2806462,3739515,3857021,5399515,5740056,6798467
999999,Commodities not elsewhere specified,2137731,3152091,4097793,4552289,3273929,3698539,3509151,3723829,3768943,4306975
740311,"Copper, refined, in the form of cathodes and sections of cathodes",3351511,3085727,3092407,2588994,2507726,3404272,3003267,2758175,2568578,3789890
260111,Non-agglomerated iron ores and concentrates (excluding roasted iron pyrites),2076676,2297202,2022149,1267157,1155706,1515486,1567562,1910753,1975842,3764318
853400,Printed circuits,1328828,1381011,1517079,1483156,1442312,1554941,1750855,1975409,2669488,3610051
851712,"Telephones for cellular networks """"mobile telephones"""" or for other wireless networks""""",2103768,2479808,2872225,3327838,2740189,3303006,2927907,2912415,2864680,3412687
381800,"Chemical elements and compounds doped for use in electronics, in the form of discs, wafers, ...",2521702,2790158,3292574,3035912,2788016,2960958,3053871,2553086,2661965,3078486
870323,"Motor cars and other motor vehicles principally designed for the transport of persons, incl. ...",1464910,1949245,2242929,2587409,2944413,3298631,3719970,3394451,3100539,2923107
300490,"Medicaments consisting of mixed or unmixed products for therapeutic or prophylactic purposes, ...""",1734434,1946118,1915615,1996596,2024074,2216463,2412718,2668381,2735461,2883589
903082,Instruments and apparatus for measuring or checking semiconductor wafers or devices,1639676,1504331,2483971,1541914,1629789,1535082,1848923,1851525,2137078,2463560
903141,Optical instruments and appliances for inspecting semiconductor wafers or devices or for inspecting ...,594546,822646,541418,639030,792519,788195,680513,1160644,1406793,2047539
852351,"Solid-state, non-volatile data storage devices for recording data from an external source [flash ...",1332500,1343417,886475,630992,748402,977151,1085863,1176452,1711229,2006601
847130,"Data-processing machines, automatic, portable, weighing <= 10 kg, consisting of at least a ...",1169284,1289999,1162902,923146,873488,1045990,1103012,1162373,1311670,1982258
851762,"Machines for the reception, conversion and transmission or regeneration of voice, images or ...",563456,668304,695530,699228,1074085,883641,1006859,1192546,1416813,1882044
903090,Parts and accessories for instruments and apparatus for measuring or checking electrical quantities ...,577290,637429,744014,901109,1017849,1098679,1355096,1264550,1644104,1858594
382499,"Chemical products and preparations of the chemical or allied industries, incl. those consisting ...",0,0,0,0,0,1471945,1612205,1497734,1545068,1825090
850440,Static converters,844372,799085,849081,753315,797978,867324,981745,1148165,1341871,1644391
720712,"Semi-finished products of iron or non-alloy steel containing, by weight, < 0,25% of carbon, ...""",1677059,1343947,1219211,760661,611150,1071855,1304057,932640,670012,1622477
853224,"Fixed electrical capacitors, ceramic dielectric, multilayer (excluding power capacitors)",382959,377491,391776,366541,545678,631315,930938,793066,1083012,1591232
260300,Copper ores and concentrates,278,1068,278,125,757133,616941,432704,871156,796457,1586348
851770,"Parts of telephone sets, telephones for cellular networks or for other wireless networks and ...",1196710,1381708,911599,740109,732433,886993,632576,1336698,1568006,1574351
852990,"Parts suitable for use solely or principally with flat panel display modules, transmission ...",557709,640294,935289,789051,787372,871180,868565,954901,1117903,1555829
120190,"Soya beans, whether or not broken (excluding seed for sowing)",0,98542,1346635,1167067,1015666,1072624,1070302,1026947,1039160,1496636
870340,"Motor cars and other motor vehicles principally designed for the transport of <10 persons, ...",0,0,0,0,0,118871,241582,608045,1214287,1457099
290243,P-Xylene,2046852,2007903,1389607,953011,920659,1142416,1728913,1609898,895212,1401277
841191,"Parts of turbojets or turbopropellers, n.e.s.",118551,196292,226022,270985,458330,1002767,1451720,1471279,1252761,1382676
100590,Maize (excluding seed for sowing),1412870,1184532,1030069,873753,784068,846947,854314,978340,886651,1322745
710813,"Gold, incl. gold plated with platinum, in semi-manufactured forms, for non-monetary purposes",1416149,1053777,950788,756574,802082,819449,804913,861208,1202319,1299090
853710,"Boards, cabinets and similar combinations of apparatus for electric control or the distribution ...",711789,697247,787817,737454,696263,808606,913509,984843,948980,1271970
853669,Plugs and sockets for a voltage <= 1.000 V (excluding lamp holders),562323,559906,600972,556305,546918,585536,665410,724776,870753,1256270
720449,"Waste and scrap of iron or steel (excluding slag, scale and other waste of the production of ...",1935893,1535189,1391430,742595,593286,682172,1146204,886035,853510,1251239
721913,"Flat-rolled products of stainless steel, of a width of >= 600 mm, not further worked than hot-rolled, ...",715191,888340,894209,670537,686750,726068,775735,648799,673887,1203443
847170,Storage units for automatic data-processing machines,1246401,1081479,1163388,1126984,1243629,1254426,1027579,853369,959553,1175897
847150,"Processing units for automatic data-processing machines, whether or not containing in the same ...",296582,371949,485055,435285,442374,637967,772354,820460,914004,1107170
847590,"Parts of machines for assembling electric or electronic lamps, tubes or valves or flashbulbs, ...",401559,310146,254619,429130,292367,273412,312997,338515,403368,1097867
880330,"Parts of aeroplanes or helicopters, n.e.s. (excluding those for gliders)",299582,315893,294812,301194,1961184,1754520,1666242,1771358,1036900,1079602
847989,"Machines and mechanical appliances, n.e.s.",761084,771724,693818,783284,754779,558366,695801,763934,835788,1051146
903149,"Optical instruments, appliances and machines for measuring or checking, not elsewhere specified ...",307231,307016,342303,395071,503199,380935,445694,608809,642266,1042846
370790,"Preparation of chemicals for photographic uses, incl. unmixed products put up in measured portions ...",792653,744442,777600,664633,641569,686910,721163,809443,939699,1024035
854140,"Photosensitive semiconductor devices, incl. photovoltaic cells whether or not assembled in ...",1221393,1098751,1328129,1434975,1390726,1274702,989660,759028,809945,1008976
740400,"Waste and scrap, of copper (excluding ingots or other similar unwrought shapes, of remelted ...",632697,646690,591060,493063,495070,653439,823173,669883,613105,977130
760120,Unwrought aluminium alloys,485812,544253,651951,594990,456125,586034,750627,569989,487625,949679
854129,Transistors with a dissipation rate >= 1 W (excluding photosensitive transistors),641871,556525,541670,452998,495701,565369,682141,661718,757576,945366
710812,"Gold, incl. gold plated with platinum, unwrought, for non-monetary purposes (excluding gold ...",714714,870063,899217,898025,671416,642346,772799,389164,775887,924304
270119,"Coal, whether or not pulverised, non-agglomerated (excluding anthracite and bituminous coal)",320807,253878,242755,131266,64025,134549,723552,901374,680800,885323
760110,"Aluminium, not alloyed, unwrought",736820,747203,849097,739270,645626,664199,814188,648671,1092600,838566
854442,"Electric conductors for a voltage <= 1.000 V, insulated, fitted with connectors, n.e.s.",282789,300739,311014,312689,325300,366238,422784,523459,593344,830682
850231,"Generating sets, wind-powered",54249,52761,5883,15023,35406,1453,11708,172105,426791,817867
300215,"Immunological products, put up in measured doses or in forms or packings for retail sale (excl. ...",0,0,0,0,0,326029,471440,527447,657576,794203
848640,Machines and apparatus specified in Note?9 C to chapter 84,393805,336148,489137,232883,376987,449810,581634,470166,646759,788907
210690,"Food preparations, n.e.s.",487157,505972,534435,559427,586656,593092,669946,688011,674757,788143
854160,Mounted piezoelectric crystals,35998,36273,45277,155201,361893,407451,384666,367122,477121,764748
392690,"Articles of plastics and articles of other materials of heading 3901 to 3914, n.e.s (excluding ...",414725,391742,418926,393647,417498,460269,504051,533228,617853,747299
330499,"Beauty or make-up preparations and preparations for the care of the skin (other than medicaments), ...",602868,606523,624555,635325,773767,743211,867852,850633,719443,731481
721912,"Flat-rolled products of stainless steel, of a width of>= 600 mm, not further worked than hot-rolled, ...",439950,507035,577747,387325,346140,436359,427459,477788,452365,719167
290220,Benzene,720451,952451,961942,506270,505297,606567,655750,600353,443901,706968
848180,"Appliances for pipes, boiler shells, tanks, vats or the like (excluding pressure-reducing ...""",359349,402893,432865,408908,428953,444472,480203,486938,581197,702962
850450,Inductors (excluding inductors for discharge lamps or tubes),248514,280545,275409,271051,371190,410666,409274,372934,493981,694692
901890,"Instruments and appliances used in medical, surgical or veterinary sciences, n.e.s.",541174,555874,558768,597116,602689,680336,618867,668118,781299,689013
852859,"Monitors, not incorporating television reception apparatus (excluding with cathode ray tube ...",287581,309493,291979,362080,385619,388378,413178,407238,445648,688947
848610,Machines and apparatus for the manufacture of boules or wafers,533569,471444,337818,385440,500430,409034,370959,439162,429757,686272
903190,"Parts and accessories for instruments, appliances and machines for measuring and checking, ...",283774,373837,392409,312752,319181,435343,425133,388072,552145,662685
900120,Sheets and plates of polarising material,1299427,1107950,1063830,737552,659015,717080,606379,542745,662814,656853
300220,Vaccines for human medicine,93739,84712,85309,99890,96421,129707,144713,195314,177802,655142
880240,"Aeroplanes and other powered aircraft of an of an unladen weight > 15.000 kg (excl. helicopters, ...",512442,356952,1460406,1959960,1265843,1601586,1105064,726069,499460,652300
870322,"Motor cars and other motor vehicles principally designed for the transport of persons, incl. ...",139743,168036,225248,255921,354839,473043,646029,556635,682242,651863
850760,Lithium-ion accumulators (excluding spent),0,138,41300,92374,128540,196465,305151,463055,468368,649412
20230,"Frozen, boneless meat of bovine animals",366408,435831,461375,438470,482490,525494,561916,608553,608930,619319
842139,Machinery and apparatus for filtering or purifying gases (excl. isotope separators and intake ...,134312,174847,170573,174290,298692,315337,388435,456309,469059,612572
852349,Optical media for the recording of sound or of other phenomena (excluding unrecorded and goods ...,0,55403,406848,347790,365689,368858,392995,423387,680969,611032
290511,"Methanol """"methyl alcohol""""""""",430983,509025,549434,378228,291656,448499,581389,357457,296713,591825
392190,"Plates, sheets, film, foil and strip, of plastics, reinforced, laminated, supported or similarly ...",541306,540589,533366,463085,424582,465969,508709,500298,506522,586349
711319,"Articles of jewellery and parts thereof, of precious metal other than silver, whether or not ...",367886,349661,418621,383401,326878,367144,463179,512179,378815,571634
702000,"Articles of glass, n.e.s.",106432,249140,417102,403940,340792,429011,411371,415510,550479,557067
391990,"Self-adhesive plates, sheets, film, foil, tape, strip and other flat shapes, of plastics, whether ...",454171,456457,437474,391665,383495,397859,413905,440198,496752,553421
220830,Whiskies,314266,334477,404330,382275,438237,453362,482538,554300,463230,552805
901380,"Liquid crystal devices, n.e.s. and other optical appliances and instruments not elsewhere specified ...",609933,932701,1005308,878665,450307,493144,518692,485372,438637,551337
720711,"Semi-finished products of iron or non-alloy steel containing, by weight, < 0,25% of carbon, ...",156740,117961,215909,79808,130579,154130,230415,204270,232936,549445
20130,"Fresh or chilled bovine meat, boneless",111964,169739,205758,238943,259616,310304,386120,372248,423205,533228
841112,Turbojets of a thrust > 25 kN,15441,31654,32989,14124,263030,189575,367182,344879,238411,524851
710691,"Silver, incl. silver plated with gold or platinum, unwrought (excluding silver in powder form)",1956374,709248,572611,76403,71809,89874,86222,77735,150365,513560
790111,"Unwrought zinc, not alloyed, containing by weight >= 99,99% of zinc",312978,331802,413274,393646,332864,520074,484619,467847,371017,512250
290250,Styrene,554204,671338,616568,362867,291082,420106,414180,304906,256024,507194
854110,Diodes (excluding photosensitive or light emitting diodes),392421,350711,360616,372345,381744,402393,423931,339504,378047,506928
851769,"Apparatus for the transmission or reception of voice, images or other data, incl. apparatus ...",310709,289647,408687,268881,310784,360894,351279,218076,501573,490665
870899,"Parts and accessories, for tractors, motor vehicles for the transport of ten or more persons, ...",362973,351954,419583,381472,363104,350288,368013,387235,405845,481472
853690,"Electrical apparatus for switching electrical circuits, or for making connections to or in ...",281712,244980,255228,208852,243617,293704,275182,302329,425686,476661
901390,"Parts and accessories for liquid crystal devices """"LCD"""", lasers and other appliances and ...""",540761,579394,529818,433603,302574,255963,280990,314726,410953,475055
871491,"Frames and forks, and parts thereof, for cycles, n.e.s. (excluding for motorcycles)",404090,400094,392409,433375,335189,334287,368237,370572,326606,464267
392073,"Plates, sheets, film, foil and strip, of non-cellular cellulose acetates, not reinforced, laminated, ...",917613,708402,642208,492447,499493,467653,509444,427453,455027,459298
720720,"Semi-finished products of iron or non-alloy steel containing, by weight, >= 0,25% of carbon",377282,121099,244103,160584,202996,195943,306529,349966,368145,458437
390110,"Polyethylene with a specific gravity of < 0,94, in primary forms",407523,364681,410739,332957,283949,362942,346855,330144,319954,456686
903180,"Instruments, appliances and machines for measuring or checking, not elsewhere specified in ...",132782,98027,84569,112596,170634,311010,183973,265221,259588,456051
852580,"Television cameras, digital cameras and video camera recorders",740392,717563,573757,444036,417550,392461,316977,315340,372202,451373
721914,"Flat-rolled products of stainless steel, of a width of >= 600 mm, not further worked than hot-rolled, ...",235884,279526,317594,190074,215787,209730,317636,301215,274501,443750
390740,"Polycarbonates, in primary forms",528418,441591,453636,381288,327428,368121,402448,349540,299627,439332
853890,"Parts suitable for use solely or principally with the apparatus of heading 8535, 8536 or 8537, ...",222782,231176,230784,218246,235783,258112,275203,251886,294264,438623
854290,"Parts of electronic integrated circuits, n.e.s.",376930,376042,369143,285131,325494,346348,314039,276624,315407,435647
870840,"Gear boxes and parts thereof, for tractors, motor vehicles for the transport of ten or more ...",477287,436555,496921,432332,390084,387112,349030,353747,365892,427279
270730,"Xylol """"xylenes"""" containing > 50% of xylenes (excluding chemically defined)""""",1215122,906205,909342,439383,563724,541378,601664,514596,265590,426553
842199,"Parts of machinery and apparatus for filtering or purifying liquids or gases, n.e.s.",265125,250275,290492,281572,286083,287762,310081,309870,362811,426542
721891,"Semi-finished products of stainless steel, of rectangular """"other than square"""" cross-section""""",7801,5379,2096,3732,2422,1877,184806,64365,160470,419001
280461,"Silicon containing >= 99,99% by weight of silicon",835811,963243,1077596,883278,920976,852709,668181,306496,264073,415442
700600,"Sheets or profiles of glass, whether or not having an absorbent, reflecting or non-reflecting ...",384709,592440,574285,493746,345845,289155,306546,337347,366066,409919
741021,"Refined copper foil, backed, of a thickness """"excluding any backing"""" of <= 0,15 mm (excluding ...""",345304,308664,305648,257711,306371,331136,355941,348634,396531,408413
260112,Agglomerated iron ores and concentrates (excluding roasted iron pyrites),560240,609757,489739,288665,168404,318062,377790,349642,197642,407726
720260,Ferro-nickel,409638,350979,402576,360855,274849,386952,459572,255047,194203,400634
721391,"Bars and rods, hot-rolled, in irregularly wound coils, of iron or non-alloy steel, of circular ...",174096,155679,132133,84057,100069,134306,172193,166697,165908,387306
382200,"Diagnostic or laboratory reagents on a backing, prepared diagnostic or laboratory reagents ...",194803,196899,192971,198299,208635,225983,233182,250997,270182,385778
841590,"Parts of air conditioning machines, comprising a motor-driven fan and elements for changing ...",85311,128024,219868,232992,208618,250047,316844,310748,377903,384512
870380,"Motor cars and other motor vehicles principally designed for the transport of <10 persons, ...",0,0,0,0,0,57393,35539,179638,322686,380001
100119,Durum wheat (excluding seed for sowing),0,36759,406167,349964,295248,350313,317376,311931,349519,376208
845611,"Machine tools for working any material by removal of material, operated by laser (excl. soldering ...",0,0,0,0,0,312002,379087,218140,248067,376197
950300,"Tricycles, scooters, pedal cars and similar wheeled toys; dolls' carriages; dolls; other toys; ...""",202306,214699,236995,271929,268443,282971,315836,312762,318500,375505
290121,Ethylene,435974,332158,192346,236378,315600,527715,463879,325480,282132,373672
470710,"Recovered """"waste and scrap"""" paper or paperboard of unbleached kraft paper, corrugated paper ...""",160268,144916,140091,101475,118556,235941,193521,171880,176044,368529
381512,"Supported catalysts with precious metal or a precious-metal compound as the active substance, ...",274167,326945,301201,171115,220489,261670,285873,273659,419898,366470
871499,"Parts and accessories, for bicycles, n.e.s.",358413,290586,306800,328275,279393,284574,275303,276079,272635,365263
281410,Anhydrous ammonia,399510,369288,329805,298330,220497,205669,239429,177654,143292,363290
392099,"Plates, sheets, film, foil and strip, of non-cellular plastics, n.e.s., not reinforced, laminated, ...",258951,277254,283324,304567,247205,262360,255915,250421,297017,356334
720851,"Flat-rolled products of iron or non-alloy steel, of a width >= 600 mm, not in coils, simply ...",171732,193137,214876,181371,76061,148309,155850,170663,275916,355787
732690,"Articles of iron or steel, n.e.s. (excluding cast articles or articles of iron or steel wire)",162351,156253,174649,178530,201218,214885,231646,254287,297044,351180
854370,"Electrical machines and apparatus, having individual functions, n.e.s. in chapter 85",195703,160797,138345,143285,143124,157904,168997,174720,329286,351094
902219,"Apparatus based on the use of X-rays (other than for medical, surgical, dental or veterinary ...",132843,107965,104003,174984,158656,60712,246294,167090,165986,349561
853222,"Fixed electrical capacitors, aluminium electrolytic (excluding power capacitors)",240698,216902,189306,152831,195205,208220,242405,214539,241608,348491
847180,"Units for automatic data-processing machines (excluding processing units, input or output units ...",83019,95136,100847,100588,86631,115480,226746,186680,254090,344320
870324,"Motor cars and other motor vehicles principally designed for the transport of persons, incl. ...",648715,565641,614389,501162,429405,337217,377831,401803,346192,338058
420221,"Handbags, whether or not with shoulder straps, incl. those without handles, with outer surface ...",162874,159388,177187,178473,204281,217146,230023,248233,259457,335745
761699,"Articles of aluminium, n.e.s.",182271,157953,167553,163412,186769,212401,235746,218887,285526,332893
853650,Switches for a voltage <= 1.000 V (excluding relays and automatic circuit breakers),226714,229889,257585,233772,225581,247599,260865,245345,251518,328545
848190,"Parts of valves and similar articles for pipes, boiler shells, tanks, vats or the like, n.e.s.",176857,166628,178536,158860,155106,182629,206494,193288,243810,326931
890690,"Vessels, incl. lifeboats (excluding warships, rowing boats and other vessels of heading 8901 ...",472654,343568,351321,210916,167655,166453,225457,284133,268592,326754
261690,Precious-metal ores and concentrates (excluding silver ores and oncentrates),21,25,7,0,47571,26277,12136,47571,143022,325074
720917,"Flat-rolled products of iron or non-alloy steel, of a width of >= 600 mm, in coils, simply ...""",49499,56348,81584,46354,82465,97739,108420,82721,109017,324381
841410,Vacuum pumps,151218,150550,163401,159486,192489,208857,208037,250041,231085,317475
370500,"Photographic plates and film, exposed and developed (excl. products made of paper, paperboard ...",0,0,0,0,85,297648,323415,301941,282233,314437
750210,"Nickel, not alloyed, unwrought",168889,90328,187741,129950,347873,521606,351529,550234,330745,312543
902780,"Instruments and apparatus for physical or chemical analysis, or for measuring or checking viscosity, ...",239529,219994,227381,224077,239684,239566,410225,326908,284277,310705
842129,Machinery and apparatus for filtering or purifying liquids (excluding such machinery and apparatus ...,87887,98083,155823,122425,131131,136206,207197,219328,259575,309894
847160,"Input or output units for automatic data-processing machines, whether or not containing storage ...",85802,76863,74884,77818,132739,159946,156952,206765,249933,304897
851830,"Headphones and earphones, whether or not combined with microphone, and sets consisting of a ...",119729,77017,70012,54625,60538,90773,120831,218645,307052,304757
390720,"Polyethers, in primary forms (excluding polyacetals and goods of 3002 10)",155235,144614,155405,132190,140223,166046,186903,212780,239118,302085
800110,"Unwrought tin, not alloyed",205933,198888,190538,154319,155359,182436,186325,142198,148935,299980
293371,"6-Hexanelactam """"epsilon-caprolactam""""""""",1002083,1058203,999489,672647,356769,348247,435430,265108,220634,298510
901320,Lasers (excluding laser diodes),85748,115403,152429,166409,148959,168736,220189,228038,253284,297651
730890,"Structures and parts of structures, of iron or steel, n.e.s. (excluding bridges and bridge-sections, ...",116131,82867,108466,84511,85484,74391,79787,212606,624318,297493
841459,"Fans (excluding table, floor, wall, window, ceiling or roof fans, with a self-contained electric ...",71470,79617,94962,98546,93615,126310,133882,185046,211019,297490
843139,"Parts of machinery of heading 8428, n.e.s.",106733,54171,46521,123309,132601,174672,101509,213826,264954,297244
390810,"Polyamides-6, -11, -12, -6,6, -6,9, -6,10 or -6,12, in primary forms",259297,257262,238230,217216,172348,212606,261380,262236,206737,297017
840734,"Spark-ignition reciprocating piston engine, of a kind used for vehicles of chapter 87, of a ...",324134,311160,321286,292434,245450,249897,202053,226010,244126,293812
30617,"Frozen shrimps and prawns, even smoked, whether in shell or not, incl. shrimps and prawns in ...",0,15439,147442,163905,177638,231573,258476,283089,327101,287794
710610,"Powder of silver, incl. silver plated with gold or platinum",467206,286900,374938,455008,610441,527506,339366,209544,302768,286326
720421,"Waste and scrap of stainless steel (excluding radioactive, and waste and scrap of batteries ...",558158,365433,373367,328791,244501,330681,351116,510852,321819,283811
401110,"New pneumatic tyres, of rubber, of a kind used for motor cars, incl. station wagons and racing ...",163155,162771,184233,194762,198618,222860,218615,228126,227446,283689
290122,"Propene """"propylene""""""""",538705,344798,209958,129095,135126,265306,265597,222173,198573,280974
853221,"Fixed electrical capacitors, tantalum (excluding power capacitors)",199157,137792,133542,144990,151854,177604,211083,163679,192501,277870
