293369,"Heterocyclic compounds with nitrogen hetero-atom[s] only, containing an unfused triazine ring, ...",4189,5454,9151,9445,10253,11210,13599,16240,18407,24303
820551,"Household hand tools, non-mechanical, with working parts of base metal, n.e.s.",166,156,231,246,468,467,995,385,465,24244
293590,Sulphonamides (excl. perfluorooctane sulphonamides),0,0,0,0,0,0,12988,16061,18843,24204
290519,"Saturated monohydric acyclic alcohols (excluding methanol """"methyl alcohol"""", propan-1-ol ...""",450,1074,6763,7118,257,286,312,2002,6068,24201
480524,"Testliner """"recycled liner board"""", uncoated, in rolls of a width > 36 cm or in square or ...""",43195,58071,61979,47626,35818,26355,37250,23113,18183,24186
741012,"Copper alloy foil, not backed, of a thickness of <= 0,15 mm (excluding stamping foils of heading ...",2443,5507,8677,11272,17666,32622,40529,37208,37296,24173
521049,"Woven fabrics of cotton, containing predominantly, but < 85% cotton by weight, mixed principally ...",7456,7776,8422,10489,9154,9236,20509,29659,16011,24137
853180,Electric sound or visual signalling apparatus (excluding indicator panels with liquid crystal ...,3919,6972,5577,10067,7062,7143,8393,9087,12115,24119
760529,"Wire, of aluminium alloys, having a maximum cross-sectional dimension of <= 7 mm (other than ...",3598,4849,6397,5699,5704,7707,6753,8255,18085,24117
821290,Parts of non-electric razors of base metal (excluding safety razor blades and razor blade blanks ...,12,37,784,4681,4828,3811,5060,9579,7281,24095
440712,"Fir """"Abies spp."""" and spruce """"Picea spp."""" sawn or chipped lengthwise, sliced or peeled, ...""",0,0,0,0,0,0,4380,9818,13464,24087
761290,"Casks, drums, cans, boxes and similar containers, incl. rigid tubular containers, of aluminium, ...",29272,21013,20946,24899,39337,43583,33132,36323,37407,24043
740931,"Plates, sheets and strip, of copper-tin base alloys """"bronze"""", of a thickness of > 0,15 mm, ...""",1510,2005,1893,1763,2117,3069,4114,3618,6572,24034
847940,Rope or cable-making machines (excluding twisting machines of the type used in spinning mills),10225,17867,21357,16320,16038,22852,19389,26604,18054,23988
830250,"Hat-racks, hat-pegs, brackets and similar fixtures of base metal",7929,7101,9797,9921,11744,13023,11334,16531,17564,23960
740821,"Wire of copper-zinc base alloys """"brass""""""""",13618,15788,16211,10405,12913,16924,19219,28660,21482,23869
721123,"Flat-rolled products of iron or non-alloy steel, of a width of < 600 mm, simply cold-rolled ...""",6393,7527,7952,7626,11411,18698,22519,21412,21761,23817
845190,"Parts of machines for washing, cleaning, wringing, drying, ironing, pressing, bleaching, dyeing, ...",3855,4374,6736,7946,8983,9799,11722,7791,5501,23804
551519,"Woven fabrics containing predominantly, but < 85% polyester staple fibres by weight, other ...",475107,513663,623614,679642,251282,440298,440558,357679,257470,23750
901790,"Parts and accessories for drawing, marking-out or mathematical calculating instruments and ...",1002,886,952,773,841,910,920,3185,8633,23749
611120,"Babies' garments and clothing accessories of cotton, knitted or crocheted (excluding hats)",170,324,250,332,1024,1111,1182,1343,2143,23734
961610,"Scent sprays and similar toilet sprays, and mounts and heads therefor",9884,9487,9267,8681,9540,5950,7590,8468,15232,23724
280469,"Silicon containing < 99,99% by weight of silicon",2128,2654,4088,6557,9409,12159,16607,13106,16728,23676
620332,"Men's or boys' jackets and blazers of cotton (excluding knitted or crocheted, and wind-jackets ...",252,470,207,294,281,174,365,458,403,23636
902830,"Electricity supply or production meters, incl. calibrating meters therefor",6808,16486,32089,18795,12793,15812,5664,6562,2335,23616
844520,Textile spinning machines (excluding extruding and drawing or roving machines),49272,68802,147366,127182,112813,75569,155076,154139,42321,23593
321511,"Black printing ink, whether or not concentrated or solid",21729,22376,24102,33365,39034,59892,74787,71718,68735,23558
292151,"O-Phenylenediamine, m-phenylenediamine, p-phenylenediamine or diaminotoluenes and their derivatives; ...",2382,3953,4302,4761,4660,9119,8986,9751,11167,23488
690390,"Retorts, crucibles, mufflers, nozzles, plugs, supports, cupels, tubes, pipes, sheaths, rods ...",11840,6841,10246,8891,10051,9535,10281,10910,11737,23463
722691,"Flat-rolled products of alloy steel other than stainless, of a width of < 600 mm, not further ...",2301,12038,52356,18051,9897,7001,9796,9579,7681,23365
120991,"Vegetable seeds, for sowing",11106,12659,14484,12587,15172,28659,15662,18315,22627,23360
841231,"Pneumatic power engines and motors, linear-acting, """"cylinders""""""""",4534,5332,7939,10353,13042,15970,20934,24527,23575,23351
271290,"Paraffin wax, microcrystalline petroleum wax, slack wax, ozokerite, lignite wax, peat wax, ...",65242,54093,52852,47457,45814,47793,46525,43159,48319,23248
510610,Carded wool yarn containing >= 85% wool by weight (excluding that put up for retail sale),47,23,68,44,35,102,873,602,1734,23237
130239,"Mucilages and thickeners derived from vegetable products, whether or not modified (excluding ...",7513,9079,10491,10461,12803,16370,19517,22136,22755,23210
701810,"Glass beads, imitation pearls, imitation precious or semi-precious stones and similar glass ...",837,1504,3153,7866,9175,15650,10846,10437,4213,23165
851539,"Machines for arc welding of metals, incl. plasma arc welding, neither fully nor partly automatic",14153,17899,20499,27933,28970,24201,31372,31555,78101,23142
902290,"X-ray generators other than X-ray tubes, high tension generators, control panels and desks, ...",4292,10649,6059,9590,11924,10407,11291,13278,15199,23138
170211,"Lactose in solid form and lactose syrup, not containing added flavouring or colouring matter, ...",17546,17760,19437,13609,14020,13516,14211,11869,16527,23119
846229,"Bending, folding, straightening or flattening machines for flat products (excl. numerically ...",36249,40260,38392,45105,50441,56079,54405,55593,32344,23116
741210,"Refined copper tube or pipe fittings """"e.g., couplings, elbows, sleeves""""""""",4874,6153,7950,6667,5683,6337,4961,7784,6792,23103
401012,"Conveyor belts or belting, of vulcanised rubber, reinforced only with textile materials",5194,7891,11840,11643,13803,11488,13866,16344,16454,23057
400291,"Synthetic rubber and factice derived from oils, in primary forms or in plates, sheets or strip ...""",9299,6582,3675,4228,5227,7313,7520,8144,7751,23035
841981,"Machinery, plant and equipment for making hot drinks or for cooking or heating food (excluding ...",2662,2788,4112,48940,13419,10751,15300,17989,14097,22976
901850,"Ophthalmic instruments and appliances, n.e.s.",12673,18049,15512,14171,20064,32119,29337,30458,23829,22964
950710,Fishing rods,554,569,753,776,955,1164,1630,1747,3054,22929
950790,"Line fishing tackle n.e.s; fish landing nets, butterfly nets and similar nets; decoys and similar ...",990,2229,2320,3418,3406,3959,5067,3922,4545,22920
940350,Wooden furniture for bedrooms (excluding seats),3210,3933,9304,9319,9097,9162,7829,12125,6601,22910
848250,Cylindrical roller bearings (excluding needle roller bearings),1249,2299,2045,6737,8260,5371,6181,6146,8849,22901
620193,"Men's or boys' anoraks, windcheaters, wind jackets and similar articles, of man-made fibres ...",419,424,1602,1026,1869,1455,1229,2172,2252,22876
700729,Laminated safety glass (excluding glass of size and shape suitable for incorporation in motor ...,2681,1047,2727,1635,17370,38747,17366,12808,16508,22859
521149,"Woven fabrics of cotton, containing predominantly, but < 85% cotton by weight, mixed principally ...",10411,8405,7152,6198,16225,22220,15547,11974,6332,22819
910212,"Wrist-watches, whether or not incorporating a stop-watch facility, electrically operated, with ...",994,1309,1524,3804,6574,6492,3348,7245,4710,22796
843610,Machinery for preparing animal feedingstuffs in agricultural holdings and similar undertakings ...,14499,8319,13931,26387,61495,43423,38316,37414,29256,22754
20220,"Frozen bovine cuts, with bone in (excluding carcases and half-carcases)",2426,2767,2394,4111,4630,5928,10968,10960,6644,22727
350400,"Peptones and their derivatives; other albuminous substances and their derivatives, n.e.s.; ...",1239,3890,3585,4064,4370,6035,7249,7432,11821,22695
284700,"Hydrogen peroxide, whether or not solidified with urea",9701,9955,10316,11070,14181,17175,30322,27249,26572,22692
611693,"Gloves, mittens and mitts, of synthetic fibres, knitted or crocheted (excl. impregnated, coated, ...",622,5410,7966,9160,9553,8513,7544,8607,10757,22689
842820,Pneumatic elevators and conveyors,3103,4223,3114,3724,4559,3134,12964,6781,7120,22675
551339,"Woven fabrics containing predominantly, but < 85% synthetic staple fibres by weight, mixed ...",34916,44480,37135,28147,25426,48369,43619,32018,22410,22571
870331,"Motor cars and other motor vehicles principally designed for the transport of persons, incl. ...""",0,0,0,0,0,411,0,0,0,22504
853529,"Automatic circuit breakers for a voltage >= 72,5 kV",5145,9851,5368,18197,10079,14606,10004,8573,5979,22503
630622,Tents of synthetic fibres (excluding umbrella and play tents),62,81,915,281,439,844,92,1384,861,22491
540832,"Woven fabrics of yarn containing predominantly, but < 85% artificial filament by weight, incl. ...",10725,14046,20906,21451,29109,26313,23298,22044,15229,22476
110900,"Wheat gluten, whether or not dried",10913,13782,20339,15604,20785,21791,27749,15206,16145,22466
830629,"Statuettes and other ornaments, of base metal, not plated with precious metal (excluding works ...",951,1391,1636,1744,1567,1554,1882,2405,2977,22457
610990,"T-shirts, singlets and other vests of textile materials, knitted or crocheted (excluding cotton)",3188,3756,8842,9123,16182,11143,14432,21721,21882,22444
851230,Electrical sound signalling equipment for cycles or motor vehicles,6738,7255,8153,9412,10330,9800,13235,13933,11548,22441
400911,"Tubes, pipes and hoses, of vulcanised rubber (excluding hard rubber), not reinforced or otherwise ...",20375,26580,25605,27087,32686,34427,33383,30537,30340,22432
851632,Electro-thermic hairdressing apparatus (excluding hairdryers),256,410,369,526,892,961,887,1145,1033,22359
700992,"Glass mirrors, framed (excluding rear-view mirrors for vehicles, optical mirrors, optically ...",818,567,1042,1616,2174,2093,1925,3014,2788,22354
842410,"Fire extinguishers, whether or not charged",14477,18529,23029,26079,36535,26205,30412,33345,34386,22301
220720,Denatured ethyl alcohol and other spirits of any strength,1263,526,634,539,807,12035,31169,31589,39731,22289
740829,"Wire of copper alloys (other than copper-zinc alloys [brass], copper-nickel alloys [cupro-nickel] ...",34589,50307,50970,67907,45029,48304,40287,39596,43190,22286
820320,"Pliers, incl. cutting pliers, pincers and tweezers for non-medical use and similar hand tools, ...",4294,3915,4471,6471,8938,7686,6222,6657,7853,22275
282720,Calcium chloride,1351,1784,3494,3104,2345,3281,4060,4447,5428,22157
330410,Lip make-up preparations,4064,4324,5931,6693,7588,9036,12128,14782,12288,22088
30752,"Octopus """"Octopus spp."""", frozen""""",0,0,0,0,0,0,36617,29610,23679,22066
950659,"Badminton and similar rackets, whether or not strung (other than tennis rackets and table-tennis ...",1544,1905,2390,2501,1872,1452,2132,2432,5097,22043
842911,"Self-propelled bulldozers and angledozers, track laying",20131,13447,16884,25417,32345,21127,22069,14534,15106,22040
480431,"Unbleached kraft paper and paperboard, uncoated, in rolls of a width > 36 cm or in square or ...",9034,9748,10398,10939,9343,11074,11600,14224,16604,22017
681182,"Sheets, panels, paving, tiles and similar articles, of cellulose fibre-cement or the like, ...",8985,7529,7363,19507,25958,25137,31925,31530,27208,22006
961210,"Typewriter or similar ribbons, inked or otherwise prepared for giving impressions, whether ...",8783,19441,26403,24553,24118,22813,26633,32747,33790,21967
844391,"Parts and accessories of printing machinery used for printing by means of plates, cylinders ...",4120,6210,8895,6159,6398,8644,11427,11677,7583,21963
841181,Gas turbines of a power <= 5.000 kW (excluding turbojets and turbopropellers),734,794,14710,4982,2721,3958,3609,503,2625,21808
844400,"Machines for extruding, drawing, texturing or cutting man-made textile materials",19357,12240,15190,32229,33741,55304,95874,87673,24084,21803
721932,"Flat-rolled products of stainless steel, of a width of >= 600 mm, not further worked than ...""",17121,14510,10870,21196,16476,20747,27769,34064,20788,21783
710231,"Non-industrial diamonds unworked or simply sawn, cleaved or bruted (excluding industrial diamonds)",80725,118812,108423,73756,59750,57380,54540,58550,33270,21765
200410,"Potatoes, prepared or preserved otherwise than by vinegar or acetic acid, frozen",3245,4904,6009,6993,14439,12129,25896,38386,24382,21753
847290,"Office machines, n.e.s.",18902,30609,27157,24718,21286,28467,28876,31746,33783,21716
480421,"Unbleached sack kraft paper, uncoated, in rolls of a width > 36 cm (excluding goods of heading ...",13354,23392,23867,22904,20211,19232,20133,20343,18727,21690
382440,"Prepared additives for cements, mortars or concretes",20388,24446,31757,28462,28736,31838,33408,35122,30827,21682
411320,"Leather further prepared after tanning or crusting """"incl. parchment-dressed leather"""", of ...""",19507,36565,38954,51627,63089,72119,42562,38474,31770,21639
820719,"Rock-drilling or earth-boring tools, interchangeable, and parts therefor, with working parts ...",8847,9237,10544,8725,6768,7181,7668,9102,10337,21601
292219,"Amino-alcohols, their ethers and esters; salts thereof (other than those containing > one ...""",4435,7732,11647,12365,13426,20048,26574,22153,23220,21515
842131,Intake air filters for internal combustion engines,12377,13256,13803,19457,21055,18775,17010,16805,16026,21507
730791,Flanges of iron or steel (excluding cast or stainless products),19986,17798,22296,35782,25576,28145,41059,55799,64871,21444
30499,Frozen fish meat n.e.s. (excluding fillets),33016,15953,16493,13061,19660,19642,30637,19478,14857,21440
400121,Smoked sheets of natural rubber,76947,31462,32309,21532,25917,42822,25976,21083,32848,21420
300320,"Medicaments containing antibiotics, not in measured doses or put up for retail sale (excluding ...",2332,6944,15621,47469,58340,37146,27164,23110,23759,21375
845630,"Machine tools for working any material by removal of material, operated by electro-discharge ...",5091,8281,13490,21105,22376,16328,20702,28551,19506,21367
940591,"Parts of lamps and lighting fittings, illuminated signs and nameplates and the like, of glass, ...",876,877,822,809,1101,860,1264,1664,3487,21325
900490,"Spectacles, goggles and the like, corrective, protective or other (excluding spectacles for ...",4347,8336,7473,4638,4337,4281,4557,5884,6978,21307
722720,"Bars and rods of silico-manganese steel, hot-rolled, in irregularly wound coils",14822,17765,24066,29310,38789,64546,97914,55213,18991,21258
851610,Electric instantaneous or storage water heaters and immersion heaters,21724,15617,19185,23704,21252,27548,34315,42317,30322,21256
441113,"Medium density fibreboard """"MDF"""" of wood, of a thickness >?5?mm but <=?9?mm""""",15522,14800,16963,19184,18588,21332,19058,18054,16473,21193
843041,Self-propelled boring or sinking machinery for boring earth or extracting minerals or ores ...,20217,20442,16133,35248,31826,21244,32498,21795,21610,21164
283531,"Sodium triphosphate """"sodium tripolyphosphate"""", whether or not chemically defined""""",9354,8831,10650,8076,8868,9056,9221,9688,9044,21078
490199,"Printed books, brochures and similar printed matter (excluding those in single sheets; dictionaries, ...",16592,19090,25613,23246,24524,24248,29563,32234,38741,21067
310230,"Ammonium nitrate, whether or not in aqueous solution (excluding that in pellet or similar forms, ...",48124,50790,54647,19768,19906,19272,25611,24462,27462,21027
691200,"Tableware, kitchenware, other household articles and toilet articles, of ceramics other than ...",642,419,516,872,1745,4558,9823,7697,6759,21016
293621,"Vitamins A and their derivatives, used primarily as vitamins",4446,4517,5828,5894,11458,11502,22546,22102,24423,20994
251990,"Fused magnesia; dead-burned """"sintered"""" magnesia, whether or not containing small quantities ...""",7647,11446,12627,10443,7914,9419,19969,16385,14213,20980
730840,"Equipment for scaffolding, shuttering, propping or pit-propping (excluding composite sheetpiling ...",81002,78563,75866,78595,52999,53899,35708,49925,47704,20937
710490,"Precious and semi-precious stones, synthetic or reconstructed, worked, whether or not graded ...",2820,3964,5044,3916,4874,4452,6567,13729,13541,20933
290919,"Acyclic ethers and their halogenated, sulphonated, nitrated or nitrosated derivatives (excluding ...",673,281,379,732,1252,6614,40789,37967,15533,20908
850211,"Generating sets with compression-ignition internal combustion piston engine """"diesel or semi-diesel ...""",11880,8438,9153,13604,14057,16592,12714,18576,15064,20879
640220,"Footwear with outer soles and uppers of rubber or plastics, with upper straps or thongs assembled ...",827,526,582,1013,633,1466,1796,1356,2588,20840
40610,"Fresh cheese """"unripened or uncured cheese"""", incl. whey cheese, and curd""""",475,2905,2406,2429,2802,6907,4637,5512,5050,20839
560121,"Wadding of cotton and articles thereof (excluding sanitary towels and tampons, napkins and ...",1140,804,532,851,788,1804,4990,9050,11718,20824
293420,"Heterocyclic compounds containing in the structure a benzothiazole ring-system, whether or ...",3657,4321,6172,5366,7332,11092,13943,12610,11374,20796
540793,"Woven fabrics of yarn containing predominantly, but < 85% synthetic filament by weight, incl. ...",17324,21506,24102,22011,18511,17410,25378,20922,15455,20784
843629,"Poultry-keeping machinery (excluding machines for sorting or grading eggs, poultry pickers ...",2611,4375,7898,6217,13064,21020,23568,23426,18590,20738
51199,"Products of animal origin, n.e.s., dead animals, unfit for human consumption (excluding fish, ...",36985,33846,44851,43877,30184,32066,29632,37894,32512,20724
291814,Citric acid,9499,10659,12512,12322,10974,14260,13229,12631,14085,20713
291411,Acetone,7753,11489,12172,7863,8216,12653,15178,10919,17589,20672
831120,"Cored wire of base metal, for electric arc-welding",12877,14508,15916,17989,22667,20410,23797,40049,42237,20663
291521,Acetic acid,7750,7581,8902,8335,7452,10289,16112,12432,10049,20644
130190,"Lac; natural gums, resins, gum-resins, balsams and other natural oleoresins (excluding gum ...",3246,6266,5831,8777,12235,16759,25949,22270,16483,20628
630533,"Sacks and bags, for the packing of goods, of polyethylene or polypropylene strip or the like ...",830,1731,4484,7087,7547,11041,10838,11603,12599,20618
750210,"Nickel, not alloyed, unwrought",7896,7898,8320,7378,5709,7186,9041,8256,13140,20617
871680,Vehicles pushed or drawn by hand and other vehicles not mechanically propelled (excluding trailers ...,4678,5918,10896,8625,7418,11954,10840,18081,11827,20598
620422,"Women's or girls' ensembles of cotton (excluding knitted or crocheted, ski overalls and swimwear)",0,16,23,29,50,51,53,105,67,20587
840731,"Spark-ignition reciprocating piston engine, of a kind used for the propulsion of vehicles of ...",0,524,675,1041,2040,2245,2503,2982,2383,20580
846620,Work holders for machine tools,14485,15063,20244,27912,22770,21331,24407,22404,19076,20526
30192,"Live eels """"Anguilla spp.""""""""",0,0,0,204,2614,7114,7812,9989,6498,20484
620333,"Men's or boys' jackets and blazers of synthetic fibres (excluding knitted or crocheted, and ...",439,781,1119,1666,1912,1772,3082,3789,2798,20397
130219,"Vegetable saps and extracts (excluding liquorice, hops and opium)",5755,5613,8661,10427,11255,13537,13967,15935,18099,20378
700711,"Toughened """"tempered"""" safety glass, of size and shape suitable for incorporation in motor ...""",5909,8379,9298,13996,19718,16451,28048,31794,25608,20352
540774,"Woven fabrics of yarn containing >= 85% synthetic filament by weight, incl. monofilament of ...",1298,1643,697,1282,1589,4706,5636,6482,4844,20337
20130,"Fresh or chilled bovine meat, boneless",4871,6402,7737,9195,10818,13159,14433,19612,21477,20327
842691,Cranes designed for mounting on road vehicles,373,396,1095,2804,3774,2606,1582,2052,459,20308
390530,"Poly""""vinyl alcohol"""", in primary forms, whether or not containing unhydrolyzed acetate groups""""",11316,11928,13589,13767,15128,16907,17733,19652,18711,20308
670300,"Human hair, dressed, thinned, bleached or otherwise worked; wool, other animal hair or other ...",38,143,196,312,221,125,570,826,1567,20307
591110,"Textile fabrics, felt and felt-lined woven fabrics, coated, covered or laminated with rubber, ...""",6184,6867,5548,4848,8907,13694,8486,7865,8208,20281
962000,"Monopods, bipods, tripods and similar articles",0,0,0,0,0,0,310,734,3359,20250
850212,"Generating sets with compression-ignition internal combustion piston engine """"diesel or semi-diesel ...""",15119,17364,17113,24909,32181,25610,20970,22073,20108,20192
520623,"Single cotton yarn containing predominantly, but < 85% cotton by weight, of combed fibres ...""",4814,10493,6826,9272,10730,5699,16407,10149,13203,20184
846722,"Saws for working in the hand, with self-contained electric motor",2739,2989,3768,4354,4662,4884,4790,4065,6447,20167
370242,"Photographic film """"incl. instant print film"""", sensitised, in rolls, unexposed, without perforations, ...""",305,181,274,277,324,244,276,361,2023,20152
844849,"Parts and accessories of weaving machines """"looms"""" and their auxiliary machinery, n.e.s.""""",6859,6808,7799,7780,11089,13067,16343,13031,8126,20133
100510,Maize seed for sowing,37882,48473,45772,36739,28136,29008,22803,24320,20123,20129
321000,"Paints and varnishes, incl. enamels, lacquers and distempers (excluding those based on synthetic ...",18834,19992,22179,19408,21401,27099,24230,29317,25221,20124
510810,Carded yarn of fine animal hair (excluding that of wool or that put up for retail sale),0,0,43,94,114,264,816,3481,2006,20119
902131,Artificial joints for orthopaedic purposes,3847,4204,4649,4655,6057,9657,19612,18735,15088,20077
853929,"Filament lamps, electric (excluding tungsten halogen lamps, lamps of a power <= 200 W and for ...",6899,5956,6123,7107,7574,8949,9048,7841,4793,20035
843930,Machinery for finishing paper or paperboard (excluding calenders),3239,4481,17125,14849,18363,12442,14825,21080,19718,20022
210500,"Ice cream and other edible ice, whether or not containing cocoa",7423,7615,8872,13664,14317,16045,19613,21699,17665,20021
851490,"Parts of electric industrial or laboratory furnaces and ovens, incl. of those functioning by ...",5174,7897,25010,6413,11807,11121,17405,12524,9308,19996
851671,"Electro-thermic coffee or tea makers, for domestic use",1173,1703,1956,2131,7411,4961,5970,6403,4517,19989
540773,"Woven fabrics of yarn containing >= 85% synthetic filament by weight, incl. monofilament of ...",1183,1435,930,873,1908,2984,4293,7158,6156,19926
300510,"Adhesive dressings and other articles having an adhesive layer, impregnated or covered with ...",17656,17982,17495,18425,21226,29620,30723,36305,28119,19921
730793,"Butt welding fittings of iron or steel (excluding cast iron or stainless steel products, and ...",3423,7266,16171,27727,18642,10680,16287,17944,28297,19916
844511,Carding machines for preparing textile fibres,12015,24216,40758,50066,35733,20210,51912,37609,14125,19901
902820,"Liquid meters, incl. calibrating meters therefor",15838,15684,19171,21822,23518,23463,22904,21033,20682,19870
340590,"Glass or metal polishes, whether or not in the form of paper, wadding, felt, nonwovens, cellular ...",6141,7502,8351,13112,22243,36643,25151,18491,15197,19845
848410,Gaskets and similar joints of metal sheeting combined with other material or of two or more ...,7205,5246,5954,8253,7349,7815,10265,11481,13962,19841
320650,"Inorganic products of a kind used as luminophores, whether or not chemically defined",8239,5344,10044,4414,6413,8599,12643,17471,19175,19835
903141,Optical instruments and appliances for inspecting semiconductor wafers or devices or for inspecting ...,2525,4884,4025,4745,7871,7070,8413,11535,8903,19827
940179,"Seats, with metal frames (excluding upholstered, swivel seats with variable height adjustments ...",2852,3076,3000,3809,7006,7169,6499,8407,10147,19805
722699,"Flat-rolled products of alloy steel other than stainless, of a width of < 600 mm, hot-rolled ...""",16491,12063,7899,7062,6328,7411,3767,1892,6930,19763
440321,"Pine """"Pinus spp."""" in the rough, of which the smallest cross-sectional dimension is =>15 ...""",0,0,0,0,0,0,5641,5872,7893,19664
700991,"Glass mirrors, unframed (excluding rear-view mirrors for vehicles, optical mirrors, optically ...",14966,15170,20170,19966,26246,26764,27365,27019,26389,19653
430110,"Raw furskins of mink, whole, with or without heads, tails or paws",0,24,10016,82670,69197,77188,53823,28910,0,19644
391690,"Monofilament of which any cross-sectional dimension > 1 mm, rods, sticks and profile shapes, ...",12772,15040,18281,19031,24556,26249,29256,28787,14708,19600
521011,"Plain woven fabrics of cotton, containing predominantly, but < 85% cotton by weight, mixed ...",1426,854,556,600,342,686,412,316,580,19570
741300,"Stranded wire, cables, plaited bands and the like, of copper (excluding electrically insulated ...",112828,119820,128332,111121,92752,13071,12246,12742,15895,19564
520822,"Plain woven fabrics of cotton, containing >= 85% cotton by weight and weighing > 100 g to 200 ...",1068,405,434,1857,4932,6087,4891,5841,5858,19545
310540,"Ammonium dihydrogenorthophosphate """"monoammonium phosphate"""", whether or not mixed with diammonium ...""",24849,21186,24755,32069,29231,32450,16500,15497,10774,19440
841920,"Medical, surgical or laboratory sterilizers",10014,14920,17052,12346,16214,23520,19483,19053,19782,19439
