903084,"Instruments and apparatus for measuring or checking electrical quantities, with recording device ...",0,1,33,4,9,30,65,324,29,941
721550,"Bars and rods, of iron or non-alloy steel, not further worked than cold-formed or cold-finished ...",1,52,15,1,54,109,146,119,386,941
722211,"Bars and rods of stainless steel, only hot-rolled, only hot-drawn or only hot-extruded, of ...",17,45,43,41,23,41,104,254,127,937
160552,"Scallops, incl. queen scallops, prepared or preserved (excluding smoked)",185,516,535,703,648,1281,1080,1245,878,936
844849,"Parts and accessories of weaving machines """"looms"""" and their auxiliary machinery, n.e.s.""""",16,0,8,3,30,86,47,1186,20,934
901420,Instruments and appliances for aeronautical or space navigation (excluding compasses and radio ...,62,0,23,17,26,48,30,1,69,932
521019,"Woven fabrics of cotton, containing predominantly, but < 85% cotton by weight, mixed principally ...",330,11,198,484,26,751,521,1155,1088,929
441810,"Windows, French windows and their frames, of wood",340,449,576,652,955,844,1177,998,1474,928
841939,"Dryers (excl. lyophilisation apparatus, freeze drying units, spray dryers, dryers for agricultural ...",2943,2083,2163,1567,2199,964,1079,2571,829,925
842832,"Continuous-action elevators and conveyors for goods or materials, bucket type (excluding for ...",791,683,637,535,631,1233,802,920,1151,923
960850,"Sets of articles from two or more of the following: ball-point pens, felt or fibre-tipped pens ...",2108,2680,966,963,695,353,37,9,15,923
521039,"Woven fabrics of cotton, containing predominantly, but < 85% cotton by weight, mixed principally ...",7422,7235,6382,5747,6572,7131,7398,7998,3285,922
750300,"Waste and scrap, of nickel (excluding ingots or other similar unwrought shapes, of remelted ...",13,17,19,13,3,13,63,264,33,921
381220,"Compound plasticisers for rubber or plastics, n.e.s.",132,70,12,53,561,358,13,29,111,918
920290,"Guitars, harps and other string musical instruments (excluding with keyboard and those played ...",1150,696,553,570,536,633,713,671,823,918
281129,"Inorganic oxygen compounds of non-metals (excluding diphosphorus pentaoxide, oxides of boron, ...",220,267,125,59,57,194,132,123,95,918
730669,"Tubes, pipes and hollow profiles, welded, of non-circular cross-section, of iron or steel (excluding ...",761,117,102,954,676,2530,2551,2614,2772,912
732391,"Table, kitchen or other household articles, and parts thereof, of cast iron, not enamelled ...",136,723,394,32,52,363,634,165,74,911
730431,"Tubes, pipes and hollow profiles, seamless, of circular cross-section, of iron or non-alloy ...""",4926,4946,5841,2514,1373,1417,1245,1557,1209,911
10620,"Live reptiles """"e.g. snakes, turtles, alligators, caymans, iguanas, gavials and lizards""""""""",103,864,586,1219,2793,2319,2084,4797,256,910
300590,"Wadding, gauze, bandages and the like, e.g. dressings, adhesive plasters, poultices, impregnated ...",517,2353,1177,886,1297,1986,2391,1915,975,910
840410,"Auxiliary plant for use with boilers of heading 8402 or 8403, e.g. economizers, superheaters, ...",285,69,307,389,308,124,1312,0,644,905
520911,"Plain woven fabrics of cotton, containing >= 85% cotton by weight and weighing > 200 g/m, ...",680,159,427,701,49,709,513,1110,935,904
851430,"Electric industrial or laboratory furnaces and ovens (excluding resistance heated, induction, ...",750,112,693,591,392,686,1083,659,1858,904
680530,"Natural or artificial abrasive powder or grain, on a base of materials other than woven textile ...",424,624,695,847,384,876,1206,2495,768,903
70511,Fresh or chilled cabbage lettuce,15,54,0,110,53,157,403,134,23,902
240210,"Cigars, cheroots and cigarillos containing tobacco",0,0,0,0,1,0,8,55,12,902
300410,"Medicaments containing penicillins or derivatives thereof with a penicillanic acid structure, ...""",1631,2302,2985,3197,2176,2620,1988,2404,3058,894
853949,Ultraviolet or infra-red lamps,23,23,78,77,119,42,340,330,723,892
846599,"Machine tools for working wood, cork, bone, hard rubber, hard plastics or similar hard materials ...""",1115,457,240,133,1061,3224,1803,1225,1762,886
850660,Air-zinc cells and batteries (excluding spent),0,157,0,40,41,3,126,40,29,884
846591,"Sawing machines for working wood, cork, bone, hard rubber, hard plastics or similar hard materials ...",1606,2601,1422,650,669,816,910,387,822,884
382490,"Chemical products and preparations of the chemical or allied industries, incl. those consisting ...",146846,160167,176522,108774,161640,222833,0,0,0,880
701919,"Glass fibre cakes """"textile cakes"""" and chopped glass fibre strands of a length >50mm""""",43,285,121,89,81,146,592,580,360,879
560229,"Felt, not impregnated, coated, covered or laminated (excluding that of wool or fine animal ...",0,3,14,30,11,2,1,25,40,879
230649,"Oilcake and other solid residues, whether or not ground or in the form of pellets, resulting ...""",83,90,239,51,519,636,846,438,536,876
291739,"Aromatic polycarboxylic acids, their anhydrides, halides, peroxides, peroxyacids and their ...",30,3,0,1,18,0,1,20,97,875
843049,"Boring or sinking machinery for boring earth or extracting minerals or ores, not self-propelled ...",3560,1297,3062,3251,714,1158,1575,692,504,875
902219,"Apparatus based on the use of X-rays (other than for medical, surgical, dental or veterinary ...",25,1624,100,326,320,698,1215,811,943,875
840734,"Spark-ignition reciprocating piston engine, of a kind used for vehicles of chapter 87, of a ...",0,4,97,11,537,79,14,126,69,874
701337,Drinking glasses (excluding glasses of glass ceramics or of lead crystal and stemware),331,445,256,129,169,127,142,95,406,874
611510,"Graduated compression hosiery [e.g., stockings for varicose veins], of textile materials, knitted ...",87,251,285,2412,40,223,126,674,226,874
390320,"Styrene-acrylonitrile copolymers """"SAN"""", in primary forms""""",216,0,0,0,113,831,1255,3446,1785,873
711019,"Platinum, in semi-manufactured forms",0,14,16,898,191,212,35,47,9,871
380290,"Activated kieselguhr and other activated natural mineral products; animal black, whether or ...",3,5,7,34,8,8,17,141,299,866
380862,"Goods of heading 3808, containing alpha-cypermethrin """"ISO"""", bendiocarb """"ISO"""", bifenthrin ...""",0,0,0,0,0,0,0,3,0,865
30569,"Fish, salted or in brine only (excluding fillets, offal, herring, cod, anchovies, tilapia, ...",1815,1792,785,563,750,1510,2081,1792,1420,865
844190,"Parts of machinery for making up paper pulp, paper or paperboard, n.e.s.",882,1028,519,830,594,285,312,246,322,855
551319,"Woven fabrics containing predominantly, but < 85% synthetic staple fibres by weight, mixed ...",2,99,91,259,407,414,534,1569,1761,854
590410,"Linoleum, whether or not cut to shape",0,0,0,0,0,12,0,0,0,854
843359,"Harvesting machinery for agricultural produce (excluding mowers, haymaking machinery, straw ...",222,118,414,520,617,413,708,394,304,843
540754,"Woven fabrics of yarn containing >= 85% by weight of textured polyester filaments, incl. monofilament ...",294,498,703,866,830,275,1182,674,551,841
910119,"Wrist-watches of precious metal or of metal clad with precious metal, whether or not incorporating ...",1,0,0,11,299,8,18,13,24,840
590110,"Textile fabrics coated with gum or amylaceous substances, of a kind used for the outer covers ...",292,143,419,370,539,386,1,11,23,839
580421,"Mechanically made lace of man-made fibres in the piece, in strips or in motifs (excluding fabrics ...",230,218,366,619,710,917,800,2075,596,839
845180,"Machinery for dressing, finishing, coating or impregnating textile yarns, fabrics or other ...",503,390,340,407,1258,1930,1328,1403,1047,838
845380,"Machinery for making or repairing articles of hides, skins or leather (excluding footwear and ...",50,60,11,83,428,401,674,522,985,838
30272,"Fresh or chilled catfish """"Pangasius spp., Silurus spp., Clarias spp., Ictalurus spp.""""""""",1731,112,30,617,19,318,1622,6046,4241,838
721914,"Flat-rolled products of stainless steel, of a width of >= 600 mm, not further worked than hot-rolled, ...",1524,5946,2100,193,15,77,149,28,36,834
410190,"Butts, bends, bellies and split raw hides and skins of bovine """"incl. buffalo"""" or equine ...""",88,176,732,1110,988,745,1077,896,366,834
520943,"Woven fabrics of cotton, containing >= 85% cotton by weight and weighing > 200 g/m, in three-thread ...",0,0,27,1,4,9,26,65,207,834
842519,"Pulley tackle and hoists (other than skip hoists or hoists of a kind used for raising vehicles), ...",158,102,54,173,47,42,136,225,64,833
180631,"Chocolate and other preparations containing cocoa, in blocks, slabs or bars of <= 2 kg, filled",122,124,257,85,356,342,93,144,69,833
521031,"Plain woven fabrics of cotton, containing predominantly, but < 85% cotton by weight, mixed ...",142,683,20,1602,536,599,381,360,489,831
960622,"Buttons of base metal, not covered with textile material (excluding press-fasteners, snap-fasteners, ...",166,191,177,343,281,232,117,643,929,829
600538,"Warp knit fabrics of synthetic fibres, of yarns of different colours """"incl. those made on ...""",0,0,0,0,0,0,228,103,100,829
970300,"Original sculptures and statuary, in any material",213,173,109,131,356,260,199,114,162,829
382100,"Prepared culture media for the development or maintenance of micro-organisms incl. viruses ...""",1,4,365,704,1093,1393,1750,2093,2033,824
630259,"Table linen of textile materials (excluding of cotton or man-made fibres, knitted or crocheted)",1043,2098,1203,1785,1594,1584,2358,1670,1300,823
60490,"Foliage, branches and other parts of plants, without flowers or flower buds, and grasses, mosses ...",1935,1769,1538,3746,5627,6561,4351,4044,3322,822
60315,"Fresh cut lilies """"Lilium spp."""" and buds, of a kind suitable for bouquets or for ornamental ...""",272,446,787,678,758,783,767,839,928,821
581100,"Quilted textile products in the piece, composed of one or more layers of textile materials ...",28,43,177,328,178,183,309,638,132,821
731940,"Safety pins and other pins of iron or steel, n.e.s.",2,2,1,10,452,1096,150,9,3,819
210610,Protein concentrates and textured protein substances,11,34,13,81,148,217,165,172,340,817
30384,"Frozen sea bass """"Dicentrarchus spp.""""""""",0,0,0,0,0,15,71,53,13,816
810420,"Magnesium waste and scrap (excluding ash and residues containing magnesium, and raspings, turnings ...",153,160,173,313,420,419,758,638,876,813
392071,"Plates, sheets, film, foil and strip, of non-cellular regenerated cellulose, not reinforced, ...",2,47,0,0,0,7,9,13,4,811
410791,"Full grains leather """"incl. parchment-dressed leather"""", unsplit, of the portions, strips ...""",0,0,0,0,0,0,0,0,0,809
520813,"Woven fabrics of cotton, containing >= 85% cotton by weight and weighing <= 200 g/m, in three-thread ...",1120,1277,1320,2576,1467,2103,5921,6636,4576,803
970500,"Collections and collector's pieces of zoological, botanical, mineralogical, anatomical, historical, ...",21,34,34,40,50,51,60,21,0,802
843680,"Agricultural, horticultural, forestry or bee-keeping machinery, n.e.s.",51,39,118,330,205,201,1597,1036,230,801
720449,"Waste and scrap of iron or steel (excluding slag, scale and other waste of the production of ...",1503,979,875,312,128,1071,418,717,371,800
845320,"Machinery for making or repairing footwear of hides, skins or leather (excluding sewing machines)",586,576,404,3009,1021,1853,1071,1145,302,799
381590,"Reaction initiators, reaction accelerators and catalytic preparations, n.e.s. (excluding rubber ...",100,1439,144,335,263,329,425,618,1003,798
440420,"Hoopwood; split poles; piles, pickets and stakes of wood, pointed but not sawn lengthwise; ...",1477,1156,776,881,957,721,889,1198,775,798
841410,Vacuum pumps,279,570,551,505,117,644,830,491,332,795
821194,"Blades of base metal for table knives, pocket knives and other knives of heading 8211",11,248,97,48,69,841,40,96,112,790
961590,"Hairpins, curling pins, curling grips, hair-curlers and the like, and parts thereof, n.e.s. ...",232,183,2116,2012,3912,1585,4746,5135,6265,790
340219,"Organic surface-active agents, whether or not put up for retail sale (excluding anionic, cationic ...",703,196,81,57,58,20,163,225,111,789
460122,"Mats, matting and screens, of rattan plaiting materials, flat-woven or bound together in parallel",178,244,155,12,62,95,74,122,255,787
30612,"Frozen lobsters """"Homarus spp."""", even smoked, whether in shell or not, incl. lobsters in ...""",2159,1173,98,42,92,506,316,731,74,786
902229,"Apparatus based on the use of alpha, beta, gamma or other ionising radiation (other than for ...",265,15,9,386,88,113,81,30,1,783
460199,"Plaiting materials, plaits and similar products of non-vegetable plaiting materials, flat-woven ...",1370,936,875,917,1135,909,1416,660,570,781
842449,Agricultural or horticultural sprayers (excl. portable),0,0,0,0,0,0,43,506,971,780
841960,Machinery for liquefying air or other gases,11,0,0,0,1,0,2,33,70,780
853510,Fuses for a voltage > 1.000 V,1663,2716,2893,1688,1427,2128,1645,1666,1704,779
30391,"Frozen fish livers, roes and milt",0,0,0,0,0,0,1897,2094,792,779
721090,"Flat-rolled products of iron or non-alloy steel, of a width of >= 600 mm, hot-rolled or cold-rolled ...""",212,240,696,343,1569,1106,515,1009,435,778
901050,"Apparatus and equipment for photographic or cinematographic laboratories, n.e.s.; negatoscopes",13,0,12,0,0,0,0,5,15,774
720510,"Granules, of pig iron, spiegeleisen, iron or steel (excluding granules of ferro-alloys, turnings ...",12884,977,5239,4365,5501,2648,930,87,161,774
842619,"Overhead travelling cranes, transporter cranes, gantry cranes, bridge cranes and mobile lifting ...",28289,10448,7573,2277,3349,46912,2903,22574,1025,774
590691,"Knitted or crocheted textile fabrics, rubberised, n.e.s.",0,11,30,0,1,9,13,8,7,774
330290,"Mixtures of odoriferous substances and mixtures, incl. alcoholic solutions, based on one or ...",3156,1816,652,1090,1295,1539,1756,1321,1557,772
480990,"Transfer papers, incl. coated or impregnated paper for duplicator stencils or offset plates, ...",11,70,99,106,95,46,23,4,2,770
870590,Special purpose motor vehicles (other than those principally designed for the transport of ...,2356,3179,293,608,1162,1418,435,1439,45,768
630419,"Bedspreads of all types of textile materials (excluding knitted or crocheted, bedlinen, quilts ...",961,1771,447,1903,6077,4378,4850,12789,7111,762
680520,"Natural or artificial abrasive powder or grain, on a base of paper or paperboard only, whether ...",748,742,676,408,441,526,298,567,645,760
722870,"Angles, shapes and sections of alloy steel other than stainless, n.e.s.",6905,8695,9080,9090,8103,13767,14175,15354,13650,758
841392,"Parts of liquid elevators, n.e.s.",70,69,59,2,146,4,116,326,1082,757
281121,Carbon dioxide,81,57,16,70,127,131,262,203,251,757
853922,Filament lamps of a power <= 200 W and for a voltage > 100 V (excluding tungsten halogen filament ...,2279,2805,1294,310,111,41,467,415,334,756
520931,"Plain woven fabrics of cotton, containing >= 85% cotton by weight and weighing > 200 g/m, ...",0,1047,891,2497,3598,987,1821,5750,2780,756
30799,"Molluscs, even in shell, smoked, dried, salted or in brine (excl. oysters, scallops of the ...""",41586,6771,5279,1422,3884,3585,102,1476,1339,753
80430,Fresh or dried pineapples,253,73,236,417,209,418,424,331,341,752
621520,"Ties, bow ties and cravats of man-made fibres (excluding knitted or crocheted)",1287,3743,5469,5938,5850,4539,3703,3453,618,752
411310,"Leather further prepared after tanning or crusting """"incl. parchment-dressed leather"""", of ...""",156,855,876,1022,1401,420,941,1188,409,752
551522,"Woven fabrics containing predominantly, but < 85% acrylic or modacrylic staple fibres by weight, ...",7114,5239,5339,6326,7019,6178,3705,3287,2779,751
721320,"Bars and rods, hot-rolled, in irregularly wound coils, of non-alloy free-cutting steel (excluding ...",131,246,245,294,81,418,47,0,0,751
740710,"Bars, rods and profiles, of refined copper, n.e.s.",299,46,633,1052,785,769,2629,2507,2803,749
610429,"Women's or girls' ensembles of textile materials (excluding of cotton or synthetic fibres, ...",13751,24294,36954,17401,10093,19591,26038,16718,12566,748
848020,"Mould bases (other than of graphite or other carbon, ceramic meterials or glass)",729,597,974,936,629,897,573,881,877,746
551339,"Woven fabrics containing predominantly, but < 85% synthetic staple fibres by weight, mixed ...",87,1,240,700,450,1542,1104,2193,1635,738
220110,"Mineral waters and aerated waters, not containing added sugar, other sweetening matter or flavoured",461,137,47,563,845,883,1028,1243,418,736
70200,"Tomatoes, fresh or chilled",411,1368,1209,813,174,113,458,559,691,736
910221,"Wrist-watches, whether or not incorporating a stop-watch facility, with automatic winding (excluding ...",71,452,540,236,615,105,44,594,1995,736
845710,Machining centres for working metal,2,38,287,455,1639,1252,133,259,293,735
846249,"Punching, notching or nibbling machines for flat products incl. combined punching and shearing ...",1598,992,2496,610,503,3868,1303,928,1927,732
71339,"Dried, shelled beans """"Vigna and Phaseolus"""", whether or not skinned or split (excluding beans ...""",0,5,0,0,16,614,1064,101,543,730
853339,"Wirewound variable electrical resistors, incl. rheostats and potentiometers, for a power handling ...",10,5,9,27,99,41,17,51,2201,728
681381,"Brake linings and pads, with a basis of mineral substances or cellulose, whether or not combined ...",26,13,23,46,19,35,46,47,67,726
845521,Hot or combination hot and cold metal-rolling mills (excluding tubes mills),2972,274,282,357,132,403,411,285,269,726
200210,"Tomatoes, whole or in pieces, prepared or preserved otherwise than by vinegar or acetic acid",573,583,1675,1015,188,651,422,438,402,723
100119,Durum wheat (excluding seed for sowing),0,2867,9,0,8,0,1400,1,395,723
401019,"Conveyor belts or belting, of vulcanised rubber (excluding reinforced only with metal or only ...",687,4287,1352,344,681,780,1203,2413,1617,722
130239,"Mucilages and thickeners derived from vegetable products, whether or not modified (excluding ...",71,387,98,371,1827,686,3119,564,1308,721
250900,Chalk,0,0,0,0,0,0,0,0,0,721
550820,"Sewing thread of artificial staple fibres, whether or not put up for retail sale",4521,4217,2526,1891,1516,956,1205,913,757,720
741539,"Screw hooks, screw rings and the like, threaded, of copper (excluding standard screws and bolts ...",626,358,926,958,865,858,858,1469,2544,719
220860,Vodka,703,894,1000,793,1244,1102,811,1032,604,719
30341,"Frozen albacore or longfinned tunas """"Thunnus alalunga""""""""",67,856,5,0,11,68,1,32,289,717
842810,Lifts and skip hoists,708,996,2285,3631,3197,1510,1672,3264,1075,716
851110,Sparking plugs of a kind used for spark-ignition or compression-ignition internal combustion ...,117,10,34,58,115,61,87,140,114,714
560290,"Felt, impregnated, coated, covered or laminated (excluding needleloom felt and stitch-bonded ...",482,507,1048,599,482,422,474,520,635,713
551512,"Woven fabrics containing predominantly, but < 85% polyester staple fibres by weight, mixed ...",541,1035,567,1535,226,3953,3534,4896,2306,710
610341,"Men's or boys' trousers, bib and brace overalls, breeches and shorts of wool or fine animal ...",80,12,59,165,102,225,466,1194,1210,710
871640,"Trailers and semi-trailers, not designed for running on rails (excluding trailers and semi-trailers ...",40,28,581,198,461,835,583,904,66,709
160249,"Prepared or preserved meat and offal of swine, incl. mixtures (excluding hams, shoulders and ...",263,353,647,388,546,561,1527,2634,1517,708
711590,"Articles of precious metal or of metal clad with precious metal, n.e.s.",2517,2586,3271,4668,2851,2448,5338,4251,551,706
710813,"Gold, incl. gold plated with platinum, in semi-manufactured forms, for non-monetary purposes",1576,1881,1677,1940,1345,1623,1580,1607,965,704
570292,"Carpets and other floor coverings, of man-made textile materials, woven, not tufted or flocked, ...",0,0,235,0,87,6,0,0,12,695
70320,"Garlic, fresh or chilled",7542,11734,3385,1231,4560,5794,1706,1143,3261,690
820830,"Knives and cutting blades, of base metal, for kitchen appliances or for machines used by the ...",86,163,70,66,43,21,24,26,37,690
70519,Fresh or chilled lettuce (excluding cabbage lettuce),60,5,33,2,4,53,23,89,128,689
761520,"Sanitary ware and parts thereof, of aluminium (excluding cans, boxes and similar containers ...",2824,4716,901,244,99,375,469,296,117,686
481850,"Articles of apparel and clothing accessories, of paper pulp, paper, cellulose wadding or webs ...",120,162,231,242,615,602,501,435,457,682
741510,"Nails, tacks, drawing pins, staples and similar articles, of copper or with shafts of iron ...",11,8,31,36,64,34,18,7,274,682
710229,"Industrial diamonds, worked, but not mounted or set (excluding unmounted stones for pick-up ...",15079,25278,5,21,120,56,6,12,102,681
390440,"Vinyl chloride copolymers, in primary forms (excluding vinyl chloride-vinyl acetate copolymers)",6800,2204,1723,1223,425,595,604,509,229,681
690100,"Bricks, blocks, tiles and other ceramic goods of siliceous fossil meals, e.g. kieselguhr, tripolite ...",61,3,76,42,27,41,109,25,25,678
730419,"Line pipe of a kind used for oil or gas pipelines, seamless, of iron or steel (excluding products ...",5899,2482,8396,2749,2295,2376,4427,4032,919,676
580190,"Woven pile fabrics and chenille fabrics (excluding those of man-made fibres, wool or fine animal ...",362,272,450,1059,854,652,312,59,25,673
262030,"Slag, ash and residues containing mainly copper",0,0,0,0,4,0,0,37,216,673
551321,"Plain woven fabrics containing predominantly, but < 85% polyester staple fibres by weight, ...",430,108,81,416,641,691,396,186,72,673
481039,"Kraft paper and paperboard, coated on one or both sides with kaolin or other inorganic substances, ...",0,32,214,163,139,1281,347,486,976,672
841710,"Industrial or laboratory furnaces and ovens, non-electric, for the roasting, melting or other ...",60,490,62,48,1317,30,1009,0,45,671
281119,"Inorganic acids (excluding hydrogen chloride """"hydrochloric acid"""", chlorosulphuric acid, ...""",2,1,0,23,10,300,7,5773,32,669
681140,"Articles of asbestos-cement, cellulose fibre-cement or the like, containing asbestos",756,261,787,934,1246,1289,1386,1628,1156,669
540341,"Multiple """"folded"""" or cabled filament yarn of viscose rayon, incl. monofilament of < 67 decitex ...""",0,0,7,76,201,372,231,42,138,667
620412,"Women's or girls' suits of cotton (excluding knitted or crocheted, ski overalls and swimwear)",6292,1008,383,351,149,2575,558,727,878,666
731590,"Parts of skid chain, stud-link chain and other chains of heading 7315 (excluding articulated ...",114,48,118,53,114,178,123,133,450,666
842211,Dishwashing machines of the household type,19,19,11,3,14,4,3,16,17,662
401220,Used pneumatic tyres of rubber,0,0,24,7,49,41,194,5,1,661
291531,Ethyl acetate,133,17,10,297,1462,3052,2797,2910,5566,660
50100,"Human hair, unworked, whether or not washed or scoured; waste of human hair",0,0,0,0,0,0,4,1,26,658
870323,"Motor cars and other motor vehicles principally designed for the transport of persons, incl. ...",2555,1511,976,385,732,580,742,5362,5079,655
80261,"Fresh or dried macadamia nuts, in shell",0,0,0,0,852,860,282,165,485,654
811299,"Articles of niobium """"columbium"""", gallium, indium, vanadium and germanium, n.e.s.""""",2,0,0,2,2,0,0,14,404,653
570210,"Kelem, Schumacks, Karamanie and similar hand-woven rugs, whether or not made up",314,249,85,30,29,0,6,3,0,652
381090,"Fluxes and other auxiliary preparations for soldering, brazing or welding; preparations of ...",1182,1410,884,830,827,649,864,1024,659,651
830400,"Filing cabinets, card-index cabinets, paper trays, paper rests, pen trays, office-stamp stands ...",1320,562,847,1114,984,874,633,448,645,651
621510,"Ties, bow ties and cravats of silk or silk waste (excluding knitted or crocheted)",4549,2197,744,612,752,781,725,814,858,650
711320,"Articles of jewellery and parts thereof, of base metal clad with precious metal (excluding ...",584,3,0,27,21,1,13,246,371,649
400259,"Acrylonitrile-butadiene rubber """"NBR"""", in primary forms or in plates, sheets or strip (excluding ...""",25,443,19,99,27,289,2,50,171,647
701939,"Webs, mattresses, boards and similar nonwoven products, of glass fibres (excluding mats and ...""",244,593,447,137,78,214,145,426,395,646
730519,"Line pipe of a kind used for oil or gas pipelines, having circular cross-sections and an external ...",15,0,1635,6995,1401,825,0,183,1252,646
120999,"Seeds, fruits and spores, for sowing (excluding leguminous vegetables and sweetcorn, coffee, ...",3367,4740,6676,5259,6395,3231,8678,10202,7905,644
901790,"Parts and accessories for drawing, marking-out or mathematical calculating instruments and ...",88,50,8,1,41,10,17,18,9,643
910400,"Instrument panel clocks and clocks of a similar type for vehicles, aircraft, vessels and other ...",186,35,138,596,1026,2693,4722,5840,4352,643
520543,"Multiple """"folded"""" or cabled cotton yarn, of combed fibres, containing >= 85% cotton by weight ...""",259,433,224,200,219,476,1154,798,1518,641
590699,"Rubberised textile fabrics (excluding knitted or crocheted textile fabrics, adhesive tape of ...",0,0,34,135,105,102,152,411,541,641
841319,"Pumps for liquids, fitted or designed to be fitted with a measuring device (excluding pumps ...",94,134,137,193,367,157,340,182,227,640
844590,Machines for producing textile yarns and machines for preparing textile yarns for use on machines ...,121,14,44,368,108,107,377,248,146,639
382484,"Mixtures and preparations containing aldrin """"ISO"""", camphechlor """"ISO"""" """"toxaphene"""", chlordane ...""",0,0,0,0,0,0,699,144,0,639
30313,"Frozen, Atlantic salmon """"Salmo salar"""" and Danube salmon """"Hucho hucho""""""""",118,248,837,355,927,2207,1684,150,636,638
520531,"Multiple """"folded"""" or cabled cotton yarn, of uncombed fibres, containing >= 85% cotton by ...""",0,54,63,55,257,173,231,509,304,637
30382,"Frozen rays and skates """"Rajidae""""""""",1267,1392,1301,979,1118,2899,3521,2517,1634,633
