740610,"Copper powders, of non-lamellar structure (excluding grains of copper)",528,1099,1542,1801,1885,2293,2483,1759,2052,5236
190300,"Tapioca and substitutes therefor prepared from starch, in the form of flakes, grains, pearls, ...",120,203,224,262,579,1916,3783,4212,3802,5229
283210,Sodium sulphites,2375,3437,4192,4174,4098,4701,4715,4171,3971,5217
150910,Virgin olive oil and its fractions obtained from the fruit of the olive tree solely by mechanical ...,1265,2267,2801,3257,3870,3178,3357,3168,5018,5208
760691,"Plates, sheets and strip, of non-alloy aluminium, of a thickness of > 0,2 mm (other than square ...",13267,16363,26290,43626,18918,22263,32211,31178,13837,5184
844833,"Spindles, spindle flyers, spinning rings and ring travellers, for machines of heading 8445",4403,6021,7000,5770,9299,8045,10623,9051,5736,5164
901510,Rangefinders,2396,1794,2327,3209,6327,5804,9599,37051,6691,5133
440395,"Birch """"Betula spp."""" in the rough, of which any cross-sectional dimension is =>15 cm, whether ...""",0,0,0,0,0,0,39,81,508,5133
903281,Hydraulic or pneumatic regulating or controlling instruments and apparatus (excluding manostats ...,2225,4478,2162,3256,2551,4315,3911,2186,2804,5123
560490,"Textile yarn, strip and the like of heading 5404 and 5405, impregnated, coated, covered or ...",24435,33631,38058,42750,47675,57588,57595,59806,58684,5113
292029,"Phosphite esters and their salts; their halogenated, sulphonated, nitrated or nitrosated derivatives ...",0,0,0,0,0,0,83,1603,1854,5112
820220,Bandsaw blades of base metal,974,1528,1765,2053,2237,2259,2367,2796,3053,5108
820840,"Knives and cutting blades, of base metal, for agricultural, horticultural or forestry machines ...",327,506,437,848,672,767,1053,926,2869,5101
903031,"Multimeters for voltage, current, resistance or electrical power, without recording device",4363,5891,6804,7432,8131,9491,7987,11126,10976,5100
902230,X-ray tubes,1810,1611,2692,3181,3451,4888,4574,6727,6785,5099
842539,"Winches and capstans, non-powered by electric motor",14751,17773,7677,8603,8571,7302,5335,6985,9049,5096
721220,"Flat-rolled products of iron or non-alloy steel, of a width of < 600 mm, hot-rolled or cold-rolled ...""",3430,2779,2716,2594,1776,2685,5179,5410,3870,5072
390529,"Vinyl acetate copolymers, in primary forms (excluding in aqueous dispersion)",16122,11468,9075,10629,9918,11826,12978,11825,11999,5071
740929,"Plates, sheets and strip, of copper-zinc base alloys """"brass"""", of a thickness of > 0,15 mm, ...""",2385,3089,2346,3920,3429,2828,4611,5431,5729,5064
540263,"Multiple """"folded"""" or cabled filament yarn of polypropylene, incl. monofilament of < 67 decitex ...""",0,0,0,0,0,0,1405,1994,1438,5057
271500,"Bituminous mastics, cut-backs and other bituminous mixtures based on natural asphalt, on natural ...",9419,3777,3507,4228,3720,3842,3720,4045,4227,5028
390512,"Poly""""vinyl acetate"""", in aqueous dispersion""""",1348,2202,1990,616,959,1555,1974,1843,2622,5024
854519,"Electrodes of graphite or other carbon, for electrical purposes (excluding those used for furnaces)",3127,9452,4189,5542,4182,6069,5965,7337,9115,5023
280120,Iodine,628,540,431,334,690,1168,962,2504,4582,5000
611529,"Pantyhose and tights of textile materials, knitted or crocheted (excluding graduated compression ...",117,66,67,307,655,469,558,313,884,4995
160249,"Prepared or preserved meat and offal of swine, incl. mixtures (excluding hams, shoulders and ...",891,870,1176,1484,1195,1433,967,1183,1075,4986
330190,"Extracted oleoresins; concentrates of essential oils in fats, fixed oils, waxes and the like, ...",1626,1652,2529,2238,4866,3521,4422,3597,3852,4972
851120,"Ignition magnetos, magneto-dynamos and magnetic flywheels, for spark-ignition or compression-ignition ...",4889,2091,2163,3557,4247,4026,4627,4413,5859,4969
901420,Instruments and appliances for aeronautical or space navigation (excluding compasses and radio ...,5029,1139,2553,6366,7116,7905,3089,2066,2082,4968
420310,"Articles of apparel, of leather or composition leather (excluding clothing accessories, footware ...",876,535,1084,1274,1423,1482,1853,1578,886,4967
890392,"Motor boats and motor yachts, for pleasure or sports (other than outboard motor boats)",16,3,16,19,228,670,3724,8094,1681,4962
440921,"Bamboo, incl. strips and friezes for parquet flooring, not assembled, continuously shaped ...""",95,73,163,78,81,37,2532,185,449,4961
621430,"Shawls, scarves, mufflers, mantillas, veils and similar articles of synthetic fibres (excluding ...",144,101,144,225,298,431,651,498,348,4958
283230,Thiosulphates,430,684,782,751,674,936,1320,1454,1725,4956
911320,"Watch straps, watch bands and watch bracelets, and parts thereof, of base metal, whether or ...",148,628,6397,6270,7899,6905,4919,2084,1115,4943
730424,"Casing and tubing, seamless, of a kind used for drilling for oil or gas, of stainless steel",25,323,8098,5760,4305,1588,627,5984,183,4935
381900,Hydraulic brake fluids and other prepared liquids for hydraulic transmission not containing ...,1971,2832,3847,4596,4291,4558,4351,4803,4268,4930
521214,"Woven fabrics of cotton, containing predominantly, but < 85% cotton by weight, other than those ...",1459,1540,1033,1086,1466,2454,3818,3752,2717,4928
840721,Spark-ignition outboard motors for marine propulsion,20724,2927,2992,4903,8222,6691,8597,5648,6236,4905
950629,"Water-skis, surfboards and other water-sport equipment (other than sailboards)",318,318,307,282,365,441,1057,8791,2872,4894
282741,Chloride oxides and chloride hydroxides of copper,33,533,820,639,2661,1622,1691,2962,4441,4893
520922,"Woven fabrics of cotton, containing >= 85% cotton by weight and weighing > 200 g/m©÷, in three-thread ...",135,479,395,220,1177,312,1522,1539,1365,4882
670100,"Skins and other parts of birds with their feathers or down, feathers, parts of feathers, down ...",40867,71434,70268,44757,22840,39957,67843,49748,41874,4879
550340,"Staple fibres of polypropylene, not carded, combed or otherwise processed for spinning",6553,5546,4350,4726,4229,4194,5061,4709,4514,4879
650699,"Headgear, whether or not lined or trimmed, n.e.s.",361,306,537,287,1663,713,1093,1197,1894,4864
843691,"Parts of poultry-keeping machinery or poultry incubators and brooders, n.e.s.",99,149,141,661,545,2167,1756,760,264,4863
760519,"Wire of non-alloy aluminium, with a maximum cross-sectional dimension of <= 7 mm (other than ...",3231,1832,2444,2451,2257,2871,4108,5221,11495,4863
846820,"Gas-operated machinery and apparatus for soldering, brazing, welding or surface tempering (excluding ...",1955,1281,1415,1944,2217,1993,1964,2602,1386,4855
500400,Silk yarn (excluding that spun from silk waste and that put up for retail sale),1157,3684,6543,3582,6652,6644,1899,1169,823,4849
680410,"Millstones and grindstones, without frameworks, for milling, grinding or pulping",969,767,1201,1028,978,1274,1856,1954,1679,4847
251611,"Granite, crude or roughly trimmed (excluding already with the characteristics of setts, curbstones ...",3,342,1262,2973,2462,882,808,229,274,4842
620292,"Women's or girls' anoraks, windcheaters, wind jackets and similar articles, of cotton (not ...",35,19,48,67,163,283,426,522,300,4841
940340,Wooden furniture for kitchens (excluding seats),1905,2269,4574,2056,3281,3475,5102,4657,4870,4830
251810,"Crude dolomite, not calcined or not sintered, incl. dolomite roughly trimmed or merely cut, ...""",1363,1620,2218,2135,1845,1870,2001,2214,2749,4826
845210,Sewing machines of the household type,634,1247,812,3753,2753,2248,57,48,325,4813
260700,Lead ores and concentrates,56,40,8,430,524,325,3961,14533,1457,4812
330730,Perfumed bath salts and other bath and shower preparations,12695,16747,18817,18420,17743,11722,4052,1000,1050,4797
846012,"Flat-surface grinding machines for finishing metal, numerically controlled",0,0,0,0,0,0,8664,11263,6372,4796
190120,"Mixes and doughs of flour, groats, meal, starch or malt extract, not containing cocoa or containing ...",3816,5205,4695,4880,3214,6256,4879,4437,3476,4783
251512,"Marble and travertine, merely cut, by sawing or otherwise, into blocks or slabs of a square ...",3759,5046,7522,6866,7570,13719,11779,8391,8826,4782
251511,"Marble and travertine, crude or roughly trimmed",58,12,1289,482,1721,1093,2033,1123,411,4779
830520,"Staples in strips, of base metal",635,1036,1422,1823,1826,1763,2111,2713,3239,4776
551030,"Yarn containing predominantly, but < 85% artificial staple fibres by weight, mixed principally ...",3537,1573,1981,1046,410,1046,631,390,792,4770
846029,"Grinding machines, for working metals, metal carbides or cermets, in which the positioning ...",14024,8056,8871,10393,19481,15526,23499,24023,14529,4759
847590,"Parts of machines for assembling electric or electronic lamps, tubes or valves or flashbulbs, ...",638,771,563,1171,5337,1624,1737,973,631,4758
293319,"Heterocyclic compounds with nitrogen hetero-atom[s] only, containing an unfused pyrazole ring, ...""",1210,1430,2129,1044,1024,1218,3169,774,655,4753
180631,"Chocolate and other preparations containing cocoa, in blocks, slabs or bars of <= 2 kg, filled",5367,7148,5799,6092,6899,9323,10848,9823,5404,4744
520941,"Plain woven fabrics of cotton, containing >= 85% cotton by weight and weighing > 200 g/m©÷, ...",16,200,161,583,96,328,334,669,551,4741
285000,"Hydrides, nitrides, azides, silicides and borides, whether or not chemically defined (excluding ...",96,88,102,174,320,781,1843,2940,2096,4722
846190,"Planing machines and other machine tools for working metals, metal carbides or cermets by removing ...",5254,8471,34534,29463,7205,7888,9787,9418,4767,4722
381511,"Supported catalysts with nickel or a nickel compound as the active substance, n.e.s.",174,180,149,241,7487,7088,697,4390,6683,4721
300211,Malaria diagnostic test kits,0,0,0,0,0,0,38,38,22,4720
30471,"Frozen fillets of cod """"Gadus morhua, Gadus ogac, Gadus macrocephalus""""""""",0,7,7,1125,298,225,74,1146,2468,4714
500300,"Silk waste, incl. cocoons unsuitable for reeling, yarn waste and garnetted stock",59,0,0,0,0,3,15,12,19,4711
842840,Escalators and moving walkways,10579,12779,11360,12900,13453,11939,20242,12809,9203,4710
901190,"Parts and accessories for compound optical microscopes, n.e.s.",791,774,701,934,1240,1597,1782,1802,1654,4710
480269,"Uncoated paper and paperboard, of a kind used for writing, printing or other graphic purposes, ...",5702,5215,10414,7717,6349,9349,9997,12421,17764,4709
540251,"Filament yarn of nylon or other polyamides, incl. monofilament of < 67 decitex, single, with ...",6304,6468,5053,3228,5042,7459,6085,5123,3601,4701
910129,"Wrist-watches of precious metal or of metal clad with precious metal, whether or not incorporating ...",6,47,40,67,190,47,125,1792,538,4693
730711,Tube or pipe fittings of non-malleable cast iron,1625,1075,1009,1491,1899,1959,3459,3061,2684,4690
430400,"Artificial fur and articles thereof (excluding gloves made of leather and artificial fur, footware ...",36078,37837,42835,48383,49257,52039,72941,39695,23472,4685
283529,"Phosphates (excluding phosphates of monosodium, disodium, potassium, calcium and mercury)",2918,2108,2929,2593,2816,3640,3191,3235,2689,4660
551642,"Woven fabrics containing predominantly, but < 85% artificial staple fibres by weight, mixed ...",1305,911,1621,1343,891,2412,2000,4733,4203,4647
911490,"Clock or watch parts, n.e.s.",206,4524,2468,5472,2625,2911,3684,1437,491,4630
10620,"Live reptiles """"e.g. snakes, turtles, alligators, caymans, iguanas, gavials and lizards""""""""",558,326,804,786,3074,6749,5271,7094,6209,4630
681410,"Plates, sheets and strips of agglomerated or reconstituted mica, whether or not on a support ...",633,996,981,843,1210,1838,3487,2658,3219,4628
482340,"Rolls, sheets and dials, printed for self-recording apparatus, in rolls of a width <= 36 cm, ...",2855,1790,2471,2846,2779,3006,2658,2141,1870,4628
291819,"Carboxylic acids with additional oxygen function and their anhydrides, halides, peroxides and ...",2938,3246,4341,4525,6602,6016,7556,8138,8430,4624
560729,"Twine, cordage, ropes and cables, of sisal or other textile fibres of the genus Agave, whether ...",3437,3557,4076,4534,4234,4626,6016,4771,4507,4622
830630,"Photograph, picture or similar frames, of base metal; mirrors of base metal (excluding optical ...",495,443,408,689,835,837,548,1378,1027,4622
530911,"Woven fabrics of flax, containing >= 85% flax by weight, unbleached or bleached",3449,4102,1256,2655,3783,4092,2019,2101,1540,4618
390220,"Polyisobutylene, in primary forms",1882,3337,3700,3300,3521,4888,3479,3145,2497,4610
820130,"Mattocks, picks, hoes and rakes, with working parts of base metal (excluding ice axes)",489,473,732,496,385,560,659,754,1254,4607
721050,"Flat-rolled products of iron or non-alloy steel, of a width of >= 600 mm, hot-rolled or cold-rolled ...""",13186,9282,9719,6738,5771,4000,5523,3857,3366,4597
761410,"Stranded wire, cables, plaited bands and the like, of aluminium, with steel core (excluding ...",6069,14594,604,9828,5729,3827,4834,15303,2571,4590
392520,"Doors, windows and their frames and thresholds for doors, of plastics",769,1789,2150,1898,1961,1742,3933,3329,3076,4582
670420,"Wigs, false beards, eyebrows and eyelashes, switches and the like, of human hair, and articles ...",2,21,12,43,74,66,172,2,29,4572
284019,"Disodium tetraborate """"refined borax"""" (excluding anhydrous)""""",3780,4676,3724,3755,5376,6164,6002,5636,4995,4567
390430,"Vinyl chloride-vinyl acetate copolymers, in primary forms",2367,2481,1960,2292,2524,3801,4188,5054,4159,4562
750610,"Plates, sheets, strip and foil, of non-alloy nickel (excluding expanded plates, sheets or strip)",3529,6429,8554,10271,8529,9724,9640,10580,7741,4561
845510,Mills for rolling metal tubes,1923,3142,8439,8836,9394,14766,7404,8674,2305,4559
481710,Envelopes of paper or paperboard (excluding letter cards),265,207,333,375,437,433,570,911,1534,4543
30351,"Frozen herrings """"Clupea harengus, Clupea pallasii""""""""",312,1042,1902,1107,1630,2391,599,2464,1347,4541
180632,"Chocolate and other preparations containing cocoa, in blocks, slabs or bars of <= 2 kg (excluding ...",3637,5977,7584,7844,8179,7824,4086,4377,2754,4538
610829,"Women's or girls' briefs and panties of textile materials, knitted or crocheted (excluding ...",604,450,436,835,757,753,1034,644,972,4531
701952,"Woven fabrics, incl. narrow fabrics, of glass filaments, of width of > 30 cm, plain weave, ...",209,206,116,242,273,205,225,250,268,4531
845690,"Machine tools for working any material by removal of material, operated by electro-chemical ...",9353,8168,13492,21069,26873,27523,17806,19715,11761,4529
860800,"Railway or tramway track fixtures and fittings (excluding sleepers of wood, concrete or steel, ...",9684,13118,6208,4885,9629,4256,2799,5646,5430,4527
551430,"Woven fabrics containing predominantly, but < 85% synthetic staple fibres by weight, mixed ...",3576,9985,4245,3073,805,1349,1841,1909,1381,4522
760320,"Powders of aluminium, of lamellar structure, and flakes of aluminium (excluding pellets of ...",462,418,836,623,1128,1206,1010,702,815,4515
401320,"Inner tubes, of rubber, of a kind used for bicycles",281,342,518,498,646,458,401,625,865,4509
420299,"Travelling-bags, shopping or tool bags, jewellery boxes, cutlery cases and similar, with outer ...",1366,1552,1611,1652,1665,1297,1112,2457,4797,4498
70810,"Fresh or chilled peas """"Pisum sativum"""", shelled or unshelled""""",32,209,301,468,467,234,176,292,119,4484
810199,"Articles of tungsten, n.e.s.",8866,15492,7951,9357,10134,8956,10405,9758,8830,4474
630532,"Flexible intermediate bulk containers, for the packing of goods, of synthetic or man-made textile ...",684,912,993,1137,5193,15537,5476,5190,7020,4464
731439,"Grill, netting and fencing, of iron or steel wire, welded at the intersection (excluding products ...",2155,899,1891,1394,2030,1773,2188,2052,1693,4453
551429,"Woven fabrics containing predominantly, but < 85% synthetic staple fibres by weight, mixed ...",30549,27548,30812,28470,25319,34041,35691,28456,22689,4442
382478,"Mixtures containing perfluorocarbons """"PFCs"""" or hydrofluorocarbons """"HFCs"""", but not containing ...""",808,1515,2186,3273,4744,5058,7624,7369,6297,4432
880390,"Parts of aircraft and spacecraft, n.e.s.",5429,1897,2038,506,2808,675,219,575,59804,4424
845899,"Lathes, incl. turning centres, for removing metal, not numerically controlled (excluding horizontal ...",25339,29647,19936,21907,18735,24702,27744,17339,9981,4423
680990,Articles of plaster or of compositions based on plaster (excluding plaster bandages for straightening ...,331,1762,447,300,630,713,811,1618,586,4422
721891,"Semi-finished products of stainless steel, of rectangular """"other than square"""" cross-section""""",565,615,349,297,651,1030,474,1024,437,4421
252310,Cement clinkers,23832,7891,9431,8243,26827,35109,19258,17048,18204,4403
520528,"Single cotton yarn, of combed fibres, containing >= 85% cotton by weight and with a linear ...""",153,524,302,1168,1098,1196,2954,5397,5979,4402
620630,"Women's or girls' blouses, shirts and shirt-blouses of cotton (excluding knitted or crocheted ...",554,604,678,838,1796,2554,2608,2254,2446,4401
961590,"Hairpins, curling pins, curling grips, hair-curlers and the like, and parts thereof, n.e.s. ...",331,306,429,452,602,1029,921,2444,2060,4392
340600,Candles and the like,413,485,824,549,825,823,574,643,1060,4384
251110,"Natural barium sulphate """"barytes""""""""",909,953,1319,1582,1778,1909,3235,2235,2763,4382
282580,Antimony oxides,1387,2678,3208,2344,2748,5616,4535,5489,5508,4378
293625,"Vitamin B6 and its derivatives, used primarily as vitamins",3742,3350,3700,3925,6916,7917,8765,6445,5670,4378
520411,"Sewing thread, containing >= 85% cotton by weight (excluding that put up for retail sale)",1236,15434,374,977,575,601,159,489,526,4372
392063,"Plates, sheets, film, foil and strip, of non-cellular unsaturated polyesters, not reinforced, ...""",249,266,125,335,514,612,995,2059,1011,4353
722490,Semi-finished products of alloy steel other than stainless,21167,9658,6312,31660,4720,5942,4895,5485,4605,4337
540490,"Strip and the like, e.g. artificial straw, of synthetic textile material, with an apparent ...",19894,4992,6185,5661,3465,7128,5302,8232,5974,4333
722219,"Bars and rods of stainless steel, only hot-rolled, only hot-drawn or only extruded (excluding ...",6156,6657,8483,7722,9419,12871,13618,7678,12076,4329
701610,"Glass cubes and other glass smallwares, whether or not on a backing, for mosaics or similar ...",509,1162,3793,1766,3238,3462,3196,2950,2243,4329
30193,"Live carp (Cyprinus carpio, Carassius carassius, Ctenopharyngodon idellus, Hypophthalmichthys ...",1,63,164,207,963,266,3116,4321,2278,4328
300670,Gel preparations designed to be used  in human or veterinary medicine as a lubricant for parts ...,1825,2772,3635,4318,5505,6493,8015,9471,7746,4317
291639,"Aromatic monocarboxylic acids, their anhydrides, halides, peroxides, peroxyacids and their ...",1950,1470,3814,2993,2885,1998,3271,5141,5568,4315
551291,"Woven fabrics containing >= 85% synthetic staple fibres by weight, unbleached or bleached (excluding ...",494,1458,1617,790,194,615,2085,1128,1033,4313
580220,"Terry towelling and similar woven terry fabrics (excluding those of cotton, narrow woven fabrics ...",3303,2806,2759,3832,8318,8605,8485,8446,7467,4312
620192,"Men's or boys' anoraks, windcheaters, wind jackets and similar articles, of cotton (not knitted ...",69,44,90,139,252,404,601,647,631,4309
950640,Articles and equipment for table-tennis,501,806,1436,1550,1769,1703,2152,2404,2590,4306
850410,Ballasts for discharge lamps or tubes,9048,10549,16906,15961,14627,11827,7475,5839,3005,4305
50800,"Coral and similar materials, shells of molluscs, crustaceans or echinoderms, cuttle-bone, powder ...",5102,4571,5591,6028,5873,5669,4044,5943,5422,4289
850750,Nickel-metal hydride accumulators (excluding spent),203,335,1311,1135,888,717,1062,990,929,4284
30311,"Frozen sockeye salmon [red salmon] """"Oncorhynchus nerka""""""""",1519,309,748,1658,5028,3452,1022,7612,13208,4283
845959,"Milling machines for metals, knee-type, not numerically controlled",1291,1479,3179,4176,4910,3041,1753,1716,784,4279
540821,"Woven fabrics of yarn containing >= 85% artificial filament by weight, incl. monofilament of ...",691,486,830,487,156,586,2274,2189,1306,4270
790200,"Zinc waste and scrap (excluding ash and residues from zinc production heading 2620"""", ingots ...""",231,0,1765,1881,0,0,2472,0,87,4270
291550,"Propionic acid, its salts and esters",986,1830,1758,820,1394,1539,2390,3192,3050,4270
920120,Grand pianos,360,201,434,672,1067,556,854,1555,1327,4259
370199,"Photographic plates and film in the flat for monochrome photography, sensitised, unexposed, ...",41317,19428,18111,16581,18229,9012,2526,36642,22057,4257
870380,"Motor cars and other motor vehicles principally designed for the transport of <10 persons, ...",0,0,0,0,0,0,273,430,670,4253
291429,"Cyclanic, cyclenic or cycloterpenic ketones, without other oxygen function (excluding cyclohexanone, ...",1211,1523,1825,1627,2958,2670,3212,2889,3570,4251
910119,"Wrist-watches of precious metal or of metal clad with precious metal, whether or not incorporating ...",6,429,126,17,9,59,14,9,103,4248
250830,Fireclay (excluding kaolin and other kaolinic clays and expanded clay),436,391,494,1913,404,634,939,807,785,4238
292215,Triethanolamine,0,0,0,0,0,0,4235,4011,3800,4238
830790,"Flexible tubing of base metal other than iron or steel, with or without fittings",2064,5122,3127,4922,7526,7314,4348,2692,565,4228
550620,"Staple fibres of polyesters, carded, combed or otherwise processed for spinning",3392,3859,5331,4390,5711,8116,9241,14087,14303,4217
291620,"Cyclanic, cyclenic or cycloterpenic monocarboxylic acids, their anhydrides, halides, peroxides, ...",612,931,4291,6683,3107,3568,6787,16878,4776,4216
520952,"Woven fabrics of cotton, containing >= 85% cotton by weight and weighing > 200 g/m©÷, in three-thread ...",873,554,783,907,4688,2063,18523,13427,1184,4212
40891,"Dried birds' eggs, not in shell, whether or not sweetened (excluding egg yolks)",1280,1850,1705,1934,1814,2957,3353,3564,3143,4205
900319,"Frames and mountings for spectacles, goggles or the like (excluding of plastics)",3278,2686,3571,3877,4596,4697,6112,7971,6344,4202
730611,"Line pipe of a kind used for oil or gas pipelines, welded, of flat-rolled products of stainless ...",4057,6359,4173,4675,4189,5044,4367,3776,4446,4191
230210,"Bran, sharps and other residues of maize """"corn"""", whether or not in the form of pellets, ...""",3766,5761,11962,24616,41101,237,35841,24783,21548,4182
845970,Threading or tapping machines for metals (excluding way-type unit head machines),7237,4296,6921,9178,10707,16300,18862,57078,7087,4163
410631,"Hides and skins of swine, in the wet state (incl. wet-blue), tanned, without wool on, whether ...",0,10,5,337,871,0,2951,1043,1298,4162
291711,"Oxalic acid, its salts and esters (excluding inorganic or organic compounds of mercury)",1876,2312,2273,2920,2595,2620,3529,3819,3473,4155
282732,Aluminium chloride,3136,4904,5285,7009,8081,9991,10655,11587,10615,4152
630130,"Blankets and travelling rugs of cotton (excluding electric, table covers, bedspreads and articles ...",16,96,331,291,94,69,393,307,119,4140
852341,"Optical media for the recording of sound or of other phenomena, unrecorded (excluding goods ...",12164,63485,4654,6940,3529,40358,5979,5740,5951,4135
30781,"Live, fresh or chilled, even in shell, abalone """"Haliotis spp.""""""""",0,0,0,0,4,3,684,3292,5715,4131
550999,"Yarn containing predominantly, but < 85% synthetic staple fibres by weight, other than that ...",4120,4320,5300,4415,3852,7687,14322,14253,13128,4128
81190,"Frozen fruit and nuts, uncooked or cooked by steaming or boiling in water, whether or not sweetened ...",1253,1081,1613,3248,5575,11229,12442,5548,5727,4127
843790,Parts of machinery used in the milling industry or for the working of cereals or dried leguminous ...,870,1794,1418,1064,1479,1242,763,1173,1411,4120
852862,Projectors capable of directly connecting to and designed for use with an automatic data processing ...,0,0,0,0,0,0,1433,1589,3308,4107
621142,"Women's or girls' tracksuits and other garments, n.e.s. of cotton (excluding knitted or crocheted)",14,24,42,178,86,182,282,468,636,4098
810419,"Unwrought magnesium, containing < 99,8% by weight of magnesium",744,566,816,785,1441,1942,3872,2536,3384,4097
110630,"Flour, meal and powder of produce of chapter 8 """"Edible fruit and nuts; peel of citrus fruits ...""",494,354,510,594,997,1130,1273,1403,1201,4093
851511,"Soldering irons and guns, electric",1881,2456,2575,3377,4770,5170,3890,4665,3087,4090
620822,"Women's or girls' nightdresses and pyjamas of man-made fibres (excluding knitted or crocheted, ...",1,3,0,18,14,13,34,57,230,4086
291734,"Esters of orthophthalic acid (excluding dioctyl, dinonyl or didecyl orthophthalates)",542,681,668,2734,1710,3039,4553,3327,4014,4082
731450,"Expanded metal, of iron or steel",1869,2520,1833,2558,2588,2779,3503,3813,5348,4078
330710,"Shaving preparations, incl. pre-shave and aftershave products",388,665,521,596,1264,1945,3418,2614,3002,4078
720711,"Semi-finished products of iron or non-alloy steel containing, by weight, < 0,25% of carbon, ...",39531,30840,36320,274882,61801,0,30,10051,9,4072
251310,Pumice stone,647,755,1582,1244,866,1124,1546,1957,2093,4059
391310,"Alginic acid, its salts and esters, in primary forms",1274,1667,3767,5410,5890,4504,6708,7551,4128,4057
340510,"Polishes, creams and similar preparations, for footwear or leather, whether or not in the form ...",1160,1727,2081,2174,1724,2260,2410,1825,2432,4049
550390,"Synthetic staple fibres, not carded, combed or otherwise processed for spinning (excluding ...",5735,5635,2379,1110,2124,2257,3150,2849,2537,4049
401590,"Articles of apparel and clothing accessories, for all purposes, of vulcanised rubber (excluding ...",30757,32974,36350,38972,35296,39689,44682,40174,34380,4029
