841392,"Parts of liquid elevators, n.e.s.",1107,3844,2546,972,941,1319,1180,635,506,439
130231,"Agar-agar, whether or not modified",1097,609,100,983,602,454,838,2325,3042,438
81120,"Frozen raspberries, blackberries, mulberries, loganberries, black-, white- or red currants ...",104,107,197,243,193,183,294,260,203,438
480449,"Kraft paper and paperboard, uncoated, in rolls of a width > 36 cm or in square or rectangular ...",1285,628,269,522,247,3391,3031,4354,10464,438
81320,Dried prunes,107,141,107,139,187,152,143,350,214,436
293331,Pyridine and its salts,194,133,239,214,427,137,433,475,355,435
320642,Lithopone and other pigments and preparations based on zinc sulphide of a kind used for colouring ...,748,1379,749,747,731,687,659,709,687,435
291812,Tartaric acid,531,409,578,343,362,366,558,337,446,434
292141,Aniline and its salts (excluding inorganic or organic compounds of mercury),5,3,88,11,12,14,24,42,12,433
845949,"Boring machines for metals, not numerically controlled (excl. way-type unit head machines and ...",0,0,0,0,0,0,1762,1573,689,432
930591,"Parts and accessories of military weapons of heading 9301, n.e.s.",0,0,0,0,0,0,0,0,0,427
902221,"Apparatus based on the use of alpha, beta, gamma or other ionising radiation, for medical, ...",3122,604,3124,787,14664,16068,18475,40541,30189,426
283090,"Sulphides (excluding sodium); polysulphides, whether or not chemically defined (excluding inorganic ...",490,245,400,611,434,307,318,265,225,426
620339,"Men's or boys' jackets and blazers of textile materials (excluding of wool, fine animal hair, ...",236,269,408,1111,856,773,415,1294,1161,426
290899,"Halogenated, sulphonated, nitrated or nitrosated derivatives of phenols or phenol-alcohols ...",935,908,1624,1163,694,691,744,645,689,425
860791,"Parts of railway or tramway locomotives, n.e.s.",10,68,51,262,58,111,470,546,116,418
30494,"Frozen meat, whether or not minced, of Alaska pollack """"Theragra chalcogramma"""" (excluding ...""",0,40,0,6,0,0,236,450,348,418
732429,Baths of steel sheet,553,108,42,56,240,262,582,699,267,417
750220,Unwrought nickel alloys,277,203,220,242,272,322,584,339,517,416
90812,"Nutmeg, crushed or ground",23,183,831,398,431,225,266,67,21,416
291469,Quinones (excluding anthraquinone),244,222,405,515,436,620,572,403,250,415
281219,"Chlorides and chloride oxides (excl. carbonyl dichloride """"phosgene"""", phosphorus oxy-, tri- ...""",0,0,0,0,0,0,412,864,1060,414
610419,"Women's or girls' suits of textile materials, knitted or crocheted (excluding of synthetic ...",9,11,9,97,21,56,122,48,75,414
846130,"Broaching machines, for working metals, metal carbides or cermets",1619,1802,2030,1461,1746,967,2424,1672,942,408
470319,"Unbleached non-coniferous chemical wood pulp, soda or sulphate (excluding dissolving grades)",4075,3879,2383,0,0,0,0,0,293,407
292122,Hexamethylenediamine and its salts,75,126,116,128,12,112,78,2,19,407
820140,"Axes, billhooks and similar hewing tools, with working parts of base metal (excluding ice axes)",171,103,365,175,1010,1211,1862,1657,1226,407
580640,"Narrow fabrics consisting of warp without weft assembled by means of an adhesive """"bolducs"""", ...""",3473,4698,5802,6257,3680,3968,4564,5153,3727,405
440111,"Fuel wood, in logs, billets, twigs, faggots or similar forms, coniferous",0,0,0,0,0,0,159,140,20,405
810210,Molybdenum powders,0,17,0,8,9,9,42,29,85,404
440420,"Hoopwood; split poles; piles, pickets and stakes of wood, pointed but not sawn lengthwise; ...",10,4,0,3,0,0,3,12,0,404
170250,Chemically pure fructose in solid form,931,880,2900,809,940,1159,929,945,1014,402
600544,"Printed warp knit fabrics of artificial fibres """"incl. those made on galloon knitting machines"""", ...""",74,556,1197,1344,1039,792,550,32,62,401
283692,Strontium carbonate,416,724,587,710,846,1079,1378,1686,1159,399
290376,"Bromochlorodifluoromethane, bromotrifluoromethane and dibromotetrafluoroethanes",0,0,1,0,1,0,0,0,0,398
330112,"Oils of sweet and bitter orange, whether or not terpeneless, incl. concretes and absolutes ...",153,110,200,230,235,317,351,423,415,398
550110,"Filament tow as specified in Note 1 to chapter 55, of nylon or other polyamides",247,129,521,124,51,119,705,97,249,397
853339,"Wirewound variable electrical resistors, incl. rheostats and potentiometers, for a power handling ...",8937,7864,7515,8966,10561,12268,11411,9390,10627,397
291713,"Azelaic acid, sebacic acid, their salts and esters",211,108,144,160,216,324,233,251,260,396
847029,"Electronic calculating machines not incorporating a printing device, with mains connection ...",909,816,811,577,463,481,883,1351,986,394
293723,Oestrogens and progestogens,304,1539,1233,1390,1952,1668,2800,842,775,393
920890,"Fairground organs, mechanical street organs, mechanical singing birds, musical saws and other ...",799,1290,2323,1161,691,1917,2319,1083,386,391
600524,"Printed cotton warp knit fabrics """"incl. those made on galloon knitting machines"""", of a width ...""",406,288,1401,780,900,4609,1856,10352,10127,391
843231,"No-till direct seeders, planters and transplanters",0,0,0,0,0,0,1449,1346,2078,391
30787,"Smoked, dried, salted or in brine, even in shell, abalone """"Haliotis spp.""""""""",0,0,0,0,0,0,31,72,7,390
120890,Flours and meal of oil seeds or oleaginous fruit (excluding soya and mustard),16,19,5,5,6,12,3,16,17,390
150190,"Poultry fat, rendered or otherwise extracted",434,412,988,394,628,729,585,390,393,389
540349,"Multiple """"folded"""" or cabled artificial filament yarn, incl. artificial monofilament of < ...""",2948,3113,2580,1971,470,657,4918,7290,1246,388
810294,"Unwrought molybdenum, incl. bars and rods obtained simply by sintering",0,1,1,1,0,1,0,0,0,388
631010,"Used or new rags, scrap twine, cordage, rope and cables and worn-out articles thereof, of textile ...",313,217,263,57,37,56,17,30,3,387
100850,"Quinoa """"Chenopodium quinoa""""""""",0,2,5,15,31,34,78,107,161,385
310560,Mineral or chemical fertilisers containing the two fertilising elements phosphorus and potassium ...,2026,2333,3033,3446,4605,6621,6487,6567,8423,384
521212,"Woven fabrics of cotton, containing predominantly, but < 85% cotton by weight, other than those ...",1443,1122,1125,855,1395,1230,1267,1027,722,384
291813,Salts and esters of tartaric acid,361,768,734,750,902,844,754,731,617,383
540500,Artificial monofilament of >= 67 decitex and with a cross sectional dimension of <= 1 mm; strip ...,83,153,236,269,238,270,189,476,203,378
620429,"Women's or girls' ensembles of textile materials (excluding of wool, fine animal hair, cotton ...",49,60,97,162,312,484,278,222,387,378
440710,"Coniferous wood sawn or chipped lengthwise, sliced or peeled, whether or not planed, sanded ...",82158,106130,149097,150042,115507,172216,0,0,0,377
401033,"Endless transmission belts of trapezoidal cross-section """"V-belts"""", of vulcanised rubber, ...""",3153,572,284,507,455,379,456,549,566,377
843142,"Bulldozer or angledozer blades, n.e.s.",468,185,138,172,179,119,159,267,93,375
100191,"Seed of wheat and meslin, for sowing (excluding durum)",78,0,8,0,0,0,0,0,0,375
740200,"Copper, unrefined; copper anodes for electrolytic refining",1716,1981,2278,2629,778,1141,1655,1435,1252,374
71340,"Dried, shelled lentils, whether or not skinned or split",7,0,5,7,81,38,140,81,139,374
450490,"Agglomerated cork, with or without a binding substance, and articles of agglomerated cork (excluding ...",166,110,172,107,147,107,242,285,195,372
271020,Petroleum oils and oils obtained from bituminous minerals (other than crude) and preparations ...,993,952,918,568,455,719,455,307,216,372
151211,Crude sunflower-seed or safflower oil,65,1,9,8,2,137,22,20,143,371
441873,"Flooring panels, assembled, of bamboo or with at least the top wear layer of bamboo",0,0,0,0,0,0,345,397,653,369
30612,"Frozen lobsters """"Homarus spp."""", even smoked, whether in shell or not, incl. lobsters in ...""",1,0,520,729,682,572,1249,819,1100,369
100710,"Grain sorghum, for sowing",0,0,0,144,365,14,0,35,0,369
500790,"Woven fabrics containing predominantly, but < 85% silk or silk waste by weight",13514,12886,10574,10804,10212,10859,10939,8758,6563,367
590290,"Tyre cord fabric of high-tenacity viscose rayon yarn, whether or not dipped in rubber or plastic",1787,3796,5745,7119,2616,1218,2727,4206,2070,367
620199,"Men's or boys' anoraks, incl. ski jackets, windcheaters, wind-jackets and similar articles ...",198,148,236,770,280,690,323,195,481,367
60312,"Fresh cut carnations and buds, of a kind suitable for bouquets or for ornamental purposes",748,819,219,399,51,63,44,108,538,365
840729,"Spark-ignition reciprocating or rotary engines, for marine propulsion (excluding outboard motors)",1558,1156,339,7741,202,389,488,136,741,364
30520,"Fish livers and roes, dried, smoked, salted or in brine",72,389,200,0,12,51,115,2258,189,363
741910,"Chain and parts thereof, of copper (excluding watch chains, necklace chains and the like)",127,316,317,275,119,163,229,107,71,361
284170,Molybdates,102,134,167,214,240,164,219,238,256,359
200540,"Peas """"Pisum Sativum"""", prepared or preserved otherwise than by vinegar or acetic acid (excluding ...""",755,1210,1187,967,924,707,667,672,526,359
852321,Cards incorporating a magnetic stripe for the recording of sound or of other phenomena,1352,3523,1701,1686,1404,2114,3133,1843,1668,358
830621,"Statuettes and other ornaments, of base metal, plated with precious metal (excluding works ...",106,136,253,534,62,259,42,183,258,357
470200,"Chemical wood pulp, dissolving grades",2735,2174,1800,1137,1953,32,261,25,69,356
600390,"Knitted or crocheted fabrics of a width of <= 30 cm (excluding of cotton, man-made fibres, ...""",548,1022,3127,3557,5486,4185,5514,4221,2322,356
40719,Fertilised birds' eggs for incubation (excluding of domestic fowls),1,14,28,113,272,350,297,257,181,355
521225,"Woven fabrics of cotton, containing predominantly, but < 85% cotton by weight, other than those ...",997,2154,1868,3069,1368,2873,3227,1569,1241,354
120929,"Seeds of forage plants for sowing (excluding of cereals and of sugar beet, alfalfa, clover ...""",440,588,842,1891,532,173,131,136,325,354
293719,"Polypeptide hormones, protein hormones and glycoprotein hormones, their derivatives and structural ...",174,363,662,597,616,711,826,714,785,354
920810,Musical boxes,0,0,0,7,80,96,153,429,426,354
970190,Collages and similar decorative plaques,19,205,140,62,406,202,162,238,240,352
262091,"Slag, ash and residues, containing antimony, beryllium, cadmium, chromium or their mixtures ...",0,0,0,0,0,0,0,0,6,351
291540,"Mono- di- or trichloroacetic acids, their salts and esters",158,272,178,156,53,109,117,236,131,350
441234,"Plywood consisting solely of sheets of wood <= 6 mm thick, with at least one outer ply of non-coniferous ...",0,0,0,0,0,0,14465,19567,16606,350
840910,"Parts suitable for use solely or principally with internal combustion piston engine for aircraft, ...",2520,200,2703,2867,5196,1276,7223,3051,746,346
910299,"Pocket-watches and the like, incl. stop-watches, with hand or automatic winding (excluding ...",103,92,214,661,590,239,762,1838,554,346
520710,"Cotton yarn containing >= 85% cotton by weight, put up for retail sale (excluding sewing thread)",3277,3905,8799,11264,17640,14560,21780,12283,6452,344
520291,Garnetted stock of cotton,31,0,2,0,0,0,0,0,0,344
440122,Wood in chips or particles (excluding those of a kind used principally for dying or tanning ...,246,6,7,189,104,62,42,543,52,343
531090,"Woven fabrics of jute or of other textile bast fibres of heading 5303, bleached, dyed, made ...",425,518,496,347,575,317,361,139,141,343
610329,"Men's or boys' ensembles of textile materials (excluding wool, fine animal hair, cotton or ...",230,684,47,46,47,208,19,387,74,343
620419,"Women's or girls' suits of textile materials (excluding of wool, fine animal hair, cotton or ...",0,35,44,120,31,31,39,24,53,342
401220,Used pneumatic tyres of rubber,157,226,188,22,138,61,142,92,25,341
220291,Non-alcoholic beer <= 0.5% vol alc,0,0,0,0,0,0,6,16,1506,340
382479,"Mixtures containing halogenated derivatives of methane, ethane or propane (excluding those ...",324,437,253,734,998,1478,1917,966,392,339
30721,"Live, fresh or chilled, scallops and other molluscs of the family Pectinidae, even in shell",0,0,0,0,3,1,64,976,1099,339
901310,"Telescopic sights for fitting to arms; periscopes; telescopes designed to form parts of machines, ...",115,802,145,237,6,28,3713,1384,586,339
740100,Copper mattes; cement copper (precipitated copper),0,0,0,0,229,0,1,31,0,338
960310,"Brooms and brushes, consisting of twigs or other vegetable materials bound together, with or ...",5193,7772,7224,7049,14473,3492,1897,1870,3740,337
70970,"Fresh or chilled spinach, New Zealand spinach and orache spinach",5,0,0,2,0,15,91,222,45,332
530820,Hemp yarn,0,0,0,0,1,0,1,6,25,331
30760,"Snails, live, fresh, chilled, frozen, salted, dried or in brine, even smoked, with or without ...",40,57,1430,59,249,78,233,45,60,331
610590,"Men's or boys' shirts of textile materials, knitted or crocheted (excluding of cotton or man-made ...",416,198,377,482,567,520,266,351,266,330
71022,"Shelled or unshelled beans """"Vigna spp., Phaseolus spp."""", uncooked or cooked by steaming ...""",1,1,1788,671,388,813,610,369,591,329
280200,"Sulphur, sublimed or precipitated; colloidal sulphur",3080,1350,977,1037,860,948,1149,1280,1538,328
420600,"Articles of gut, goldbeater's skin, bladders or tendons (excluding silkworm gut, sterile catgut, ...",0,0,12,0,0,0,0,0,0,328
30483,"Frozen fillets of flat fish """"Pleuronectidae, Bothidae, Cynoglossidae, Soleidae, Scophthalmidae ...""",0,0,0,21,30,1518,776,387,208,327
190520,"Gingerbread and the like, whether or not containing cocoa",7,3,7,18,2,40,75,112,271,327
900630,"Cameras specially designed for underwater use, for aerial survey or for medical or surgical ...",11,771,121,165,207,103,454,299,349,326
292144,Diphenylamine and its derivatives; salts thereof,79,159,216,90,140,250,319,160,179,323
722820,"Bars and rods of silico-manganese steel (excluding semi-finished products, flat-rolled products ...",2189,3268,930,546,541,579,1408,1351,436,322
330119,"Essential oils of citrus fruit, whether or not terpeneless, incl. concretes and absolutes (excluding ...",101,91,191,112,360,427,416,313,205,322
151499,"High erucic acid rape or colza oil """"fixed oil which has an erucic acid content of >= 2%"""", ...""",639,323,222,14,77,319,352,356,412,321
441919,"Tableware and kitchenware, of bamboo (excl. chopsticks, bread boards, chopping boards and similar ...",0,0,0,0,0,0,105,101,78,321
251710,"Pebbles, gravel, broken or crushed stone, for concrete aggregates, for road metalling or for ...",1698,1004,1169,1390,1040,1287,1684,1574,1043,319
852110,"Magnetic tape-type video recording or reproducing apparatus, whether or not incorporating a ...",566,417,41,52,48,16,10,0,3,317
150210,"Tallow of bovine animals, sheep or goats (excluding oil and oleostearin)",2,33,1,0,0,2,1,153,526,316
811229,"Articles of chromium, n.e.s.",283,568,765,1110,568,1319,1140,768,996,316
460122,"Mats, matting and screens, of rattan plaiting materials, flat-woven or bound together in parallel",65,22,80,402,621,8,23,82,48,315
30247,"Fresh or chilled swordfish """"Xiphias gladius""""""""",0,0,0,0,0,0,0,0,0,315
152000,"Glycerol, crude; glycerol waters and glycerol lyes",470,469,396,538,460,497,963,773,242,313
261790,"Ores and concentrates (excluding iron, manganese, copper, nickel, cobalt, aluminium, lead, ...",0,0,0,0,79,0,0,15,2,312
844090,"Parts of bookbinding machinery, n.e.s.",215,32,60,1484,1677,1296,1277,760,239,312
251741,"Marble granules, chippings and powder, whether or not heat-treated",1,5,33,7,58,1,0,2,220,310
292610,Acrylonitrile,461,394,543,368,351,363,514,531,426,307
900651,"Cameras with a through-the-lens viewfinder [single lens reflex """"SLR""""] for roll film of a ...""",0,1,0,0,0,5,0,2,1,307
240311,Water-pipe tobacco (excluding tobacco-free. See subheading note 1.),0,0,0,0,0,0,0,0,0,306
291260,Paraformaldehyde,190,138,181,79,104,135,263,140,144,305
290319,Saturated chlorinated derivatives of acyclic hydrocarbons (excluding chloromethane [methyl ...,177,828,340,243,250,245,310,201,98,304
730120,"Angles, shapes and sections, of iron or steel, welded",1987,1671,1658,947,547,393,882,1460,210,304
610349,"Men's or boys' trousers, bib and brace overalls, breeches and shorts of textile materials, ...",410,433,430,295,370,527,376,467,353,304
720690,"Iron and non-alloy steel, in puddled bars or other primary forms (excluding ingots, remelted ...",2236,745,1068,1749,506,10,54,117,109,302
20680,"Fresh or chilled edible offal of sheep, goats, horses, asses, mules and hinnies",0,0,0,0,0,0,0,0,0,301
280512,Calcium,119,176,117,155,207,222,158,188,999,301
160553,"Mussels, prepared or preserved (excluding smoked)",9,153,148,208,78,177,150,108,132,300
841630,"Mechanical stokers, incl. their mechanical grates, mechanical ash dischargers and similar appliances ...",9669,5663,47374,1793,2974,3059,2163,1980,2660,299
281290,Halides and halide oxides of non-metals (excluding chlorides and chloride oxides),20,718,1111,1190,1809,2831,162,278,373,298
630420,"Bed nets, warp knit, antimalarial",0,0,0,0,0,0,0,0,9,297
621030,"Garments of the type described in heading 6202, rubberised or impregnated, coated, covered ...",375,239,209,374,117,441,237,152,316,297
252930,"Leucite, nepheline and nepheline syenite",719,950,964,725,892,932,799,805,944,297
701322,"Drinking glasses, stemware, of lead crystal",36,18,248,91,76,57,88,387,62,296
842111,Centrifugal cream separators,12,106,2,0,472,2,1,6,0,296
570410,"Floor tiles, of felt, not tufted or flocked, with an area of <= 0,3 m©÷",0,0,0,0,28,1,0,4,282,295
200559,"Unshelled beans """"Vigna spp., Phaseolus spp."""", prepared or preserved otherwise than by vinegar ...""",298,340,412,358,499,587,481,645,471,294
170191,"Refined cane or beet sugar, containing added flavouring or colouring, in solid form",3,3,0,0,1,19,20,17,39,293
701590,"Clock or watch glasses and similar glasses, glasses for non-corrective spectacles, curved, ...",344,1021,958,419,216,452,516,565,399,291
280430,Nitrogen,128,112,119,143,645,835,624,646,526,291
20890,"Fresh, chilled or frozen meat and edible offal of pigeons, game, reindeer and other animals ...""",24,27,210,131,502,250,27,40,7,290
300650,First-aid boxes and kits,204,222,275,760,535,676,203,110,186,289
30562,"Cod """"Gadus morhua, Gadus ogac, Gadus macrocephalus"""", salted or in brine only (excluding ...""",0,0,0,0,0,0,1,0,453,288
380120,Colloidal or semi-colloidal graphite,159,479,204,213,447,1140,347,206,326,288
320110,Quebracho extract,71,620,1923,467,124,152,155,94,524,287
290629,"Aromatic cyclic alcohols and their halogenated, sulphonated, nitrated or nitrosated derivatives ...",1575,805,1498,1787,2475,1220,249,531,956,286
441875,"Flooring panels, multilayer, assembled, of wood other than bamboo (excl. for mosaic floors)",0,0,0,0,0,0,447,339,378,285
620461,"Women's or girls' trousers, bib and brace overalls, breeches and shorts of wool or fine animal ...",63,92,59,47,30,54,100,155,166,284
630499,"Articles for interior furnishing, of textile materials (excluding of cotton or synthetic fibres, ...",202,90,243,387,328,175,99,2702,8905,284
550700,"Artificial staple fibres, carded, combed or otherwise processed for spinning",0,26,29,0,0,0,0,361,557,281
150500,"Wool grease and fatty substances derived therefrom, incl. lanolin",237,356,210,192,255,362,253,288,281,281
252220,Slaked lime,137,386,123,99,82,48,35,65,67,280
851950,Telephone answering machines,19,23,18,33,23,21,18,9,13,279
251720,"Macadam of slag, dross or similar industrial waste, whether or not incorporating pebbles, gravel, ...",0,1,0,51,227,264,111,91,467,279
630239,"Bedlinen of textile materials (excluding of cotton and man-made fibres, printed, knitted or ...",40,233,127,411,114,322,378,1024,1186,279
920210,Violins and other string instruments,69,18,14,30,68,26,9,32,39,279
630319,"Curtains, incl. drapes, and interior blinds, curtain or bed valances, knitted or crocheted ...",61,109,134,73,149,193,103,94,1037,279
843330,Haymaking machinery (excluding mowers),107,226,101,150,173,182,140,154,197,279
80420,Fresh or dried figs,19,10,13,15,41,54,159,165,62,278
291249,"Aldehyde-alcohols, aldehyde-ethers, aldehyde-phenols and aldehydes with other oxygen function ...""",247,398,528,524,342,263,285,584,506,278
441600,"Casks, barrels, vats, tubs and other coopers' products parts thereof, of wood, incl. staves",64,32,4,90,194,219,151,123,185,277
20630,Fresh or chilled edible offal of swine,70,0,0,59,0,0,0,67,0,276
480220,"Paper and paperboard of a kind used as a base for photosensitive, heat-sensitive or electrosensitive ...",421,998,962,922,6166,9213,10165,7738,363,276
852210,Pick-up cartridges,82,837,148,258,115,104,159,174,180,276
630399,"Curtains, incl. drapes, and interior blinds, curtain or bed valances of textile materials (excluding ...",201,175,2777,339,756,4576,4240,933,2282,276
750810,"Cloth, grill, netting and fencing, of nickel wire",629,613,555,616,469,346,405,591,571,275
610459,"Women's or girls' skirts and divided skirts of textile materials, knitted or crocheted (excluding ...",166,284,394,566,695,728,464,310,379,274
630630,"Sails for boats, sailboards or landcraft, of textile materials",123,221,205,241,233,2734,319,268,414,274
521151,"Plain woven fabrics of cotton, containing predominantly, but < 85% cotton by weight, mixed ...",110,879,186,242,98,233,281,863,1142,273
200971,"Apple juice, unfermented, Brix value <= 20 at 20¡ÆC, whether or not containing added sugar or ...",204,257,270,378,492,927,427,841,668,273
442190,"Other articles of wood, n.e.s.",2589,2814,4253,4199,4728,6860,0,0,0,273
270600,"Tar distilled from coal, from lignite or from peat, and other mineral tars, whether or not ...",992,1022,519,553,638,477,715,743,944,273
110220,"Maize """"corn"""" flour""""",215,189,383,272,336,349,386,360,248,272
30441,"Fresh or chilled fillets of Pacific salmon """"Oncorhynchus nerka, Oncorhynchus gorbuscha, Oncorhynchus ...""",6463,3524,1157,1508,991,364,9333,5090,3062,272
30484,"Frozen fillets of swordfish """"Xiphias gladius""""""""",13,0,0,13,264,65,0,308,0,271
690590,"Ceramic chimney pots, cowls, chimney liners, architectural ornaments and other ceramic constructional ...",0,4,2,2,9,570,22,2,4,268
291242,"Ethylvanillin """"3-ethoxy-4-hydroxybenzaldehyde""""""""",312,205,210,85,136,134,276,351,217,267
843221,"Disc harrows for use in agriculture, horticulture or forestry",196,18,62,239,24,207,218,243,200,267
620191,"Men's or boys' anoraks, incl. ski jackets, windcheaters, wind-jackets and similar articles, ...",7,10,7,33,9,71,28,15,47,266
530130,"Flax tow and waste, incl. yarn waste and garnetted stock",0,0,0,0,0,1,0,0,438,266
70930,"Fresh or chilled aubergines """"eggplants""""""""",0,0,0,0,0,0,0,13,10,265
701510,"Glasses for corrective spectacles, curved, bent, hollowed or the like, but not optically worked ...",32,1,4,3,10,9,37,11,1,265
130212,Extracts of liquorice (excluding that with a sucrose content by weight of > 10% or in the form ...,8,39,39,114,64,127,255,186,140,264
860390,"Self-propelled railway or tramway coaches, vans and trucks (excluding those powered from an ...",5,0,1029,0,0,0,172,341,3335,262
441194,"Fibreboard of wood or other ligneous materials, whether or not agglomerated with resins or ...""",11027,8832,7808,10267,9201,6522,7662,6816,6704,261
291822,"O-Acetylsalicylic acid, its salts and esters",64,95,120,160,153,148,99,143,185,260
510990,"Yarn containing predominantly, but < 85% wool or fine animal hair by weight, put up for retail ...",2827,1533,3372,2576,773,1464,1418,2241,1026,260
460129,"Mats, matting and screens, of vegetable plaiting materials, flat-woven or bound together in ...",98,26,206,907,688,215,761,1732,1349,259
80430,Fresh or dried pineapples,0,0,1,15,0,15,24,7,1,259
841210,Reaction engines other than turbojets,54,5,13,131,55,746,70,112,43,258
690740,Finishing ceramics (excl. refractory),0,0,0,0,0,0,6005,5263,1122,258
810299,"Articles of molybdenum, n.e.s.",377,898,362,470,802,359,751,503,1403,254
260900,Tin ores and concentrates,5670,11445,23583,13525,19658,16283,14590,11592,10668,254
611019,"Jerseys, pullovers, cardigans, waistcoats and similar articles, of fine animal hair, knitted ...""",57,36,54,111,89,81,74,110,227,251
711100,"Base metals, silver or gold, clad with platinum, not further worked than semi-manufactured",1263,1238,920,739,622,448,316,784,193,251
293750,"Prostaglandins, thromboxanes and leukotrienes, their derivatives and structural analogues, ...",0,11,0,1,9,85,328,400,313,249
620799,"Men's or boys' singlets and other vests, bathrobes and dressing gowns of textile materials ...",14,63,14,14,24,43,35,29,94,249
570231,"Carpets and other floor coverings, of wool or fine animal hair, woven, not tufted or flocked, ...",1003,197,960,713,783,282,723,622,289,248
110620,"Flour, meal and powder of sago or of roots or tubers of manioc, arrowroot, salep, sweet potatoes ...",117,74,140,679,2146,663,448,220,377,247
200110,"Cucumbers and gherkins, prepared or preserved by vinegar or acetic acid",52,69,141,71,167,236,96,158,138,246
630120,"Blankets and travelling rugs of wool or fine animal hair (excluding electric, table covers, ...",10,1,0,2,57,129,86,243,45,246
621139,"Men's or boys' tracksuits and other garments, n.e.s. of textile materials (excluding of cotton ...",1074,1905,2042,1678,779,508,117,1759,369,245
521211,"Woven fabrics of cotton, containing predominantly, but < 85% cotton by weight, other than those ...",292,1172,1513,2237,2072,551,834,380,133,242
840220,Superheated water boilers,9333,16371,4708,69084,239181,79109,35273,4530,8908,240
80590,"Fresh or dried citrus fruit (excluding oranges, lemons """"Citrus limon, Citrus limonum"""", limes ...""",0,0,0,0,0,6862,0,6,0,240
100620,Husked or brown rice,9,6,51,4,316,78,106,154,439,240
251400,"Slate, whether or not roughly trimmed or merely cut, by sawing or otherwise, into blocks or ...",1498,12,39,5,73,117,94,131,43,239
