230650,"Oilcake and other solid residues, whether or not ground or in the form of pellets, resulting ...",7761,7136,6359,4017,2743,2789,2690,3311,3423,2781
843319,"Mowers for lawns, parks or sports grounds, powered, with the cutting device rotating in a vertical ...",2345,2880,3546,3434,3206,2715,3016,3829,3420,2779
60290,"Live plants, incl. their roots, and mushroom spawn (excluding bulbs, tubers, tuberous roots, ...",2565,3307,5309,3921,3442,3204,3380,3126,2433,2779
293214,Sucralose,0,0,0,0,0,1802,2405,2312,2077,2776
620111,"Men's or boys' overcoats, raincoats, car coats, capes, cloaks and similar articles, of wool ...",3485,3228,3205,2968,3195,3139,4194,3841,2684,2771
290899,"Halogenated, sulphonated, nitrated or nitrosated derivatives of phenols or phenol-alcohols ...",5293,5512,3295,3237,2928,3404,4086,2248,2338,2771
382313,"Tall oil fatty acids, industrial",3969,3113,3747,4130,3207,2255,2770,1565,2290,2761
846291,"Hydraulic presses for working metal (excluding forging, bending, folding, straightening and ...",7878,5510,7322,4502,2610,5052,5467,7591,8513,2759
611241,"Women's or girls' swimwear of synthetic fibres, knitted or crocheted",1871,2252,2563,2902,2774,2726,3426,3211,3157,2754
620331,"Men's or boys' jackets and blazers of wool or fine animal hair (excluding knitted or crocheted, ...",5534,4284,4764,4338,3850,3956,4117,3373,2968,2750
71332,"Dried, shelled small red """"Adzuki"""" beans """"Phaseolus or Vigna angularis"""", whether or not ...""",2897,2639,2512,3033,4131,6764,3326,2914,1267,2749
820560,Blowlamps and the like (excluding gas-powered blowlamps),158,105,180,273,327,475,635,897,1258,2748
901090,"Parts and accessories for apparatus and equipment for photographic or cinematographic laboratories, ...",3818,2799,2110,2043,5498,3810,3313,2287,2721,2744
620461,"Women's or girls' trousers, bib and brace overalls, breeches and shorts of wool or fine animal ...",3034,2275,2272,2631,2675,2495,2960,3095,2763,2741
741810,"Table, kitchen or other household articles and parts thereof, and pot scourers and scouring ...",0,63,755,906,1065,859,1404,1743,2288,2736
480525,"Testliner """"recycled liner board"""", uncoated, in rolls of a width > 36 cm or in square or ...""",7712,3199,1885,3042,1084,2132,1438,2706,3740,2735
930400,"Spring, air or gas guns and pistols, truncheons and other non-firearms (excluding swords, cutlasses, ...",1050,1168,1346,1077,1700,1644,2104,1880,2414,2735
847979,Passenger boarding bridges (excluding of a kind used in airports),0,0,0,0,2,1094,2865,3,1621,2734
481690,"Copying or transfer papers, in rolls of a width of <= 36 cm or in rectangular or square sheets ...",8393,6011,6313,6819,5561,4661,5032,4023,3212,2730
401290,"Solid or cushion tyres, interchangeable tyre treads and tyre flaps, of rubber",4058,5055,5596,4531,3181,4028,3398,3442,2888,2730
30475,"Frozen fillets of Alaska pollack """"Theragra chalcogramma""""""""",0,162,1643,1763,2238,2763,2888,3054,2626,2729
848050,Moulds for glass (excluding moulds of graphite or other carbons and ceramic moulds),6536,4016,1606,1931,1362,1562,2217,2591,2314,2723
691090,"Ceramic sinks, washbasins, washbasin pedestals, baths, bidets, water closet pans, flushing ...",1628,2363,2234,2227,2201,1932,1969,2113,2573,2715
20727,Frozen cuts and edible offal of turkeys of the species domesticus,15202,6563,4458,3449,4695,5543,3300,3203,3967,2709
630130,"Blankets and travelling rugs of cotton (excluding electric, table covers, bedspreads and articles ...",1007,928,930,1099,857,1959,2616,2906,2705,2708
680100,"Setts, curbstones and flagstones, of natural stone (excluding slate)",5091,4972,4789,4013,3137,3492,4827,3510,2915,2705
30192,"Live eels """"Anguilla spp.""""""""",659,913,3351,1566,1671,2573,947,1260,12044,2702
71090,"Mixtures of vegetables, uncooked or cooked by steaming or by boiling in water, frozen",553,334,399,921,964,1451,1761,1691,1815,2700
350110,Casein,536,508,657,1241,2569,1753,2935,2343,2099,2696
841891,Furniture designed to receive refrigerating or freezing equipment,5594,6140,4148,4447,4785,3348,3037,1666,1944,2692
160553,"Mussels, prepared or preserved (excluding smoked)",0,244,3920,2744,3788,3731,4362,6522,2077,2686
300310,"Medicaments containing penicillins or derivatives thereof with a penicillanic acid structure, ...",274,300,550,1373,2385,3926,2691,1620,3538,2682
30752,"Octopus """"Octopus spp."""", frozen""""",0,0,0,0,0,11624,5473,2868,2076,2681
280120,Iodine,3357,2061,2345,1868,2014,1776,2253,1973,2379,2679
730810,"Bridges and bridge-sections, of iron or steel",10546,212,264,383,191,1381,66,2530,1168,2676
481810,Toilet paper in rolls of a width of <= 36 cm,2967,4134,5987,11965,5175,5344,5463,3803,3594,2675
560130,Textile flock and dust and mill neps,1739,2199,2127,1844,2033,2080,2759,1922,1771,2675
871160,"Motorcycles, incl. mopeds, and cycles fitted with an auxiliary motor, with electric motor for ...",0,0,0,0,0,476,1191,971,1109,2666
840212,Watertube boilers with a steam production <= 45 t/hour (excluding central heating hot water ...,3201,4229,3749,8008,2675,3276,5291,3872,2620,2664
230649,"Oilcake and other solid residues, whether or not ground or in the form of pellets, resulting ...""",15502,19646,15094,8509,2700,2444,2358,1892,3392,2658
842099,"Parts for calendering or rolling machines, n.e.s. (other than for metals or glass and excluding ...",1017,715,1087,1180,1977,3049,1491,1964,1100,2655
200971,"Apple juice, unfermented, Brix value <= 20 at 20¡ÆC, whether or not containing added sugar or ...",699,789,1005,873,1039,1293,1388,1512,1713,2649
920930,Musical instrument strings,1509,1428,1615,1800,1811,1752,1632,1522,2020,2646
91020,Saffron,1829,1483,2022,2003,1739,2209,2751,1914,3319,2645
40490,"Products consisting of natural milk constituents, whether or not sweetened, n.e.s.",633,554,482,279,231,500,804,1501,1662,2644
830810,"Hooks, eyes and eyelets, of base metal, of a kind used for clothing, footwear, awnings, handbags, ...",1429,1242,1765,2312,2101,1781,1591,1908,1660,2643
151530,"Castor oil and fractions thereof, whether or not refined, but not chemically modified",3757,3173,2990,3427,2868,2794,2301,2855,2107,2641
290891,"Dinoseb """"ISO"""" and its salts""""",1597,2035,2020,2318,2372,2260,2727,2504,2686,2634
847730,Blow-moulding machines for working rubber or plastics,4840,6124,8292,12786,9213,5458,11032,3414,7071,2631
741122,"Tubes and pipes of copper-nickel base alloys """"cupro-nickel"""" or copper-nickel-zinc base alloys ...""",8459,2761,2008,1940,14678,2141,2596,2950,2695,2623
730240,"Fish-plates and sole plates of iron or steel, for railways or tramways",2079,1197,6103,1208,1133,677,1336,1456,766,2622
910521,"Wall clocks, electrically operated",1957,2117,2329,2275,3136,2274,2867,3032,2866,2620
911012,"Incomplete watch movements, assembled",3,1,7,18,3,26,514,10066,11849,2617
551219,"Woven fabrics containing >= 85% polyester staple fibres by weight, dyed, made of yarn of different ...",1540,1910,2167,2161,2162,1737,2341,2100,1959,2616
480840,"Kraft paper, creped or crinkled, whether or not embossed or perforated, in rolls of a width ...",0,656,4580,3498,2659,2803,2161,2341,1935,2611
540793,"Woven fabrics of yarn containing predominantly, but < 85% synthetic filament by weight, incl. ...",1507,1976,2460,2938,2287,2125,2539,2069,2235,2606
741210,"Refined copper tube or pipe fittings """"e.g., couplings, elbows, sleeves""""""""",3467,2732,2987,3177,2549,3022,3060,2463,2339,2603
380400,"Residual lyes from the manufacture of wood pulp, whether or not concentrated, desugared or ...""",5059,4711,4704,2600,2569,2787,2669,2109,2295,2598
845390,"Parts of machinery for preparing, tanning or working hides, skins or leather or for making ...",3827,3998,4969,4607,3664,3918,3579,4541,3575,2594
51110,Bovine semen,1502,1654,1531,1815,1816,2333,1989,2566,2398,2594
843991,"Parts of machinery for making pulp of fibrous cellulosic material, n.e.s.",2370,3175,1755,1986,1616,2325,4448,2970,3297,2589
481830,"Tablecloths and serviettes of paper pulp, paper, cellulose wadding or webs of cellulose fibres",2604,2253,3775,4119,3905,3337,3627,3696,3412,2588
721410,"Bars and rods, of iron or non-alloy steel, not further worked than forged (excluding in irregularly ...",1329,317,593,673,349,1010,478,625,671,2574
810320,"Unwrought tantalum, incl. bars and rods of tantalum obtained simply by sintering; tantalum ...",6062,2727,3756,3056,865,2330,1959,1670,2341,2572
846022,"Centreless grinding machines for finishing metal, numerically controlled (other than gear finishing ...",0,0,0,0,0,3193,1826,5085,24,2572
847960,"Evaporative air coolers, n.e.s.",397,772,1690,3010,4248,2990,2295,2655,2416,2569
842542,"Jacks and hoists, hydraulic (excluding built-in jacking systems used in garages)",3306,3146,3440,3289,2949,3066,3012,3107,4327,2562
842541,Built-in jacking systems of a type used in garages,1440,1290,1942,2275,1976,2302,1976,1924,2468,2558
844230,"Machinery, apparatus and equipment for preparing or making printing blocks, plates, cylinders ...",9840,6654,10136,4343,5448,2989,4771,3098,7326,2551
551624,"Woven fabrics containing predominantly, but < 85% artificial staple fibres by weight, mixed ...",22,33,41,15,17,35,40,403,1686,2549
30830,"Live, fresh, chilled, frozen, dried, salted or in brine, even smoked, jellyfish """"Rhopilema ...""",0,181,2116,2145,3258,3313,2087,3023,1946,2543
30721,"Live, fresh or chilled, scallops and other molluscs of the family Pectinidae, even in shell",1271,1643,2454,2013,2606,2264,3447,3402,2657,2542
844711,"Circular knitting machines, with cylinder diameter <= 165 mm",3324,4515,3205,2557,2515,2367,789,1964,1643,2539
400251,"Latex of acrylonitrile-butadiene rubber """"NBR""""""""",3236,3399,701,4488,4987,971,709,591,233,2533
300691,Appliances identifiable for ostomy use,2724,2628,3350,3176,4070,4216,4285,2319,2993,2532
741022,"Copper alloy foil, backed, of a thickness """"excluding any backing"""" of <= 0,15 mm (excluding ...""",549,1139,361,235,327,760,2714,2047,2100,2530
844831,Card clothing for machines for preparing textile fibres,5872,6109,4675,4090,4376,4071,3740,3619,2135,2529
210330,"Mustard flour and meal, whether or not prepared, and mustard",1577,2052,2125,1984,2164,2183,2345,2403,2591,2527
610444,"Women's or girls' dresses of artificial fibres, knitted or crocheted (excluding petticoats)",3797,4198,4247,4742,4691,3860,3725,3714,2630,2524
283210,Sodium sulphites,1541,1373,1418,1629,1807,1703,2140,1786,2096,2523
150290,"Fats of bovine animals, sheep or goats (excluding tallow, oleostearin and oleo-oil)",0,31,233,492,512,499,863,1835,744,2521
560129,Wadding of textile materials and articles thereof (excluding of cotton or man-made fibres; ...,1378,1641,2256,2015,1902,2121,2672,2107,2192,2519
842449,Agricultural or horticultural sprayers (excl. portable),0,0,0,0,0,894,1013,1653,2603,2518
870192,"Tractors, of an engine power > 18 kW but <= 37 kW (excl. those of heading 8709, pedestrian-controlled ...",0,0,0,0,0,2662,3219,2642,6504,2508
950720,"Fish-hooks, whether or not snelled",2716,1934,1946,2150,1927,1674,1860,1931,2365,2507
611130,"Babies' garments and clothing accessories of synthetic fibres, knitted or crocheted (excluding ...",810,1091,1746,1980,2527,2042,2429,2171,2020,2495
741300,"Stranded wire, cables, plaited bands and the like, of copper (excluding electrically insulated ...",2106,2254,1754,1946,1528,1612,1804,2762,1852,2495
731590,"Parts of skid chain, stud-link chain and other chains of heading 7315 (excluding articulated ...",1091,1477,1288,1212,1162,796,1213,1449,1441,2494
845420,"Ingot moulds and ladles, of a kind used in metallurgy or in metal foundries",3412,2547,2501,2311,1511,1638,3529,3247,1631,2493
283719,Cyanides and cyanide oxides (excluding sodium and mercury),2657,2451,2360,2321,2143,1938,1887,1777,1804,2492
853090,"Parts of electrical signalling, safety or traffic control equipment, n.e.s.",10625,5435,7505,7395,4264,5816,6511,7182,4623,2478
550931,Single yarn containing >= 85% acrylic or modacrylic staple fibres by weight (excluding sewing ...,2519,1060,1366,1105,832,741,1183,2685,2310,2477
620191,"Men's or boys' anoraks, incl. ski jackets, windcheaters, wind-jackets and similar articles, ...",2190,2563,3015,3775,3491,2543,2387,2220,2267,2474
851020,Hair clippers with self-contained electric motor,1267,1154,1358,916,1069,2116,2151,1638,2058,2464
570242,"Carpets and other floor coverings, of man-made textile materials, woven, not tufted or flocked, ...",2608,3481,3659,3063,2563,2134,2840,3238,2178,2463
846719,"Pneumatic tools for working in the hand, non-rotary type",2643,1990,2687,2315,2537,2773,2920,2324,1639,2459
640192,"Waterproof footwear covering the ankle, but not the knee, with outer soles and uppers of rubber ...",2907,2803,3311,3043,3536,2549,1768,2263,1874,2453
580123,"Cut weft pile fabrics, of cotton (excluding terry towelling and similar woven terry fabrics, ...",16,74,45,1559,1786,2143,2731,1574,2379,2452
680410,"Millstones and grindstones, without frameworks, for milling, grinding or pulping",2832,2092,1843,1614,1535,7287,5117,3393,2579,2451
630492,"Articles for interior furnishing, of cotton (excluding knitted or crocheted, blankets and travelling ...",1360,1334,1142,1060,1778,1363,1696,2007,2350,2451
852210,Pick-up cartridges,42,49,45,387,184,79,449,1106,846,2450
845970,Threading or tapping machines for metals (excluding way-type unit head machines),7047,5499,5819,5729,3322,2124,4276,1299,1009,2449
550932,"Multiple """"folded"""" or cabled yarn containing >= 85% acrylic or modacrylic staple fibres by ...""",4745,4559,5447,5693,2725,2912,2772,1399,694,2449
600536,"Unbleached or bleached warp knit fabrics of synthetic fibres """"incl. those made on galloon ...""",0,0,0,0,0,334,542,1225,2479,2440
901520,"Theodolites and tachymeters """"tacheometers""""""""",704,518,998,1082,1582,1888,2143,2228,1919,2431
291813,Salts and esters of tartaric acid,4325,4329,3923,2885,2498,2446,3315,1664,1955,2431
961511,"Combs, hair-slides and the like of hard rubber or plastics",2676,1899,1771,2083,2163,1823,1810,2320,2253,2429
722620,"Flat-rolled products of high-speed steel, of a width of <= 600 mm, hot-rolled or cold-rolled ...""",5154,4358,4622,4589,5234,5931,2459,2778,2104,2425
920110,Upright pianos,4622,4232,4585,3433,3593,2865,2769,2218,2465,2425
151419,"Low erucic acid rape or colza oil """"fixed oil which has an erucic acid content of < 2%"""" and ...""",37,377,657,363,264,877,970,1200,1890,2420
200310,"Mushrooms of the genus """"Agaricus"""", prepared or preserved otherwise than by vinegar or acetic ...""",982,1003,1261,1382,1587,1840,2565,2575,2064,2418
731519,"Parts of articulated link chain, of iron or steel",1428,1036,1207,1289,1792,1770,1465,1766,1811,2417
410390,"Raw hides and skins, fresh, or salted, dried, limed, pickled or otherwise preserved, whether ...""",37500,50791,61393,50080,46565,31070,13735,1296,1492,2415
391211,"Non-plasticised cellulose acetates, in primary forms",280,134,42,911,1826,2451,2255,2449,2031,2412
420329,"Gloves, mittens and mitts, of leather or composition leather (excluding special sports gloves)",2022,1880,1899,1966,1663,1594,2081,2015,1889,2405
844832,"Parts and accessories of machines for preparing textile fibres, n.e.s. (other than card clothing)",4333,3266,2640,2846,2397,2226,2909,2294,1796,2405
551229,"Woven fabrics containing >= 85% acrylic or modacrylic staple fibres by weight, dyed, made of ...",959,2677,2774,890,677,1024,3776,1291,1428,2404
330520,Preparations for permanent waving or straightening,1837,1471,1408,1655,1808,1834,2135,2441,2299,2403
630720,"Life jackets and life belts, of all types of textile materials",855,886,1030,1590,1078,1473,1387,1384,1750,2401
283421,Nitrate of potassium,6527,5813,2395,1773,1465,1114,2047,1860,1977,2401
732182,"Stoves, heaters, grates, fires, wash boilers, braziers and similar appliances, of iron or steel, ...",2294,1233,2479,1805,3004,1414,2749,526,255,2394
283321,Sulphate of magnesium,1281,1457,1106,1189,1225,1660,1705,1925,1771,2392
610453,"Women's or girls' skirts and divided skirts of synthetic fibres, knitted or crocheted (excluding ...",1275,1681,2238,2738,2762,2630,2919,2927,2668,2390
901790,"Parts and accessories for drawing, marking-out or mathematical calculating instruments and ...",3476,3364,4471,3149,2646,2975,2472,2812,2009,2389
940110,Seats for aircraft,209,569,230,128,17632,4679,1904,3347,3424,2389
580190,"Woven pile fabrics and chenille fabrics (excluding those of man-made fibres, wool or fine animal ...",204,189,624,86,191,204,395,919,940,2388
160232,"Meat or offal of fowls of the species """"Gallus domesticus"""", prepared or preserved (excluding ...""",856,869,1304,2103,1416,1544,1829,1830,2012,2385
810210,Molybdenum powders,1960,2482,2732,2508,1008,1891,2050,1190,786,2384
30732,"Mussels """"Mytilus spp., Perna spp."""", frozen, even in shell""""",0,0,0,0,0,605,293,380,494,2379
901060,Projection screens,2546,2670,2471,2734,2729,2283,3037,2727,2865,2379
621142,"Women's or girls' tracksuits and other garments, n.e.s. of cotton (excluding knitted or crocheted)",538,500,717,1188,1627,1584,1566,1654,2071,2378
520622,"Single cotton yarn containing predominantly, but < 85% cotton by weight, of combed fibres ...""",561,95,49,349,1497,4446,2722,1638,1401,2376
370320,"Photographic paper, paperboard and textiles, sensitised, unexposed, for colour photography ...""",16364,14091,12048,7430,6394,5012,4531,4468,2727,2376
610452,"Women's or girls' skirts and divided skirts of cotton, knitted or crocheted (excluding petticoats)",872,1541,2611,2780,2315,1608,2310,2565,1821,2373
490600,"Plans and drawings for architectural, engineering, industrial, commercial, topographical or ...",1625,1846,1580,3017,1852,2587,1131,1262,1321,2367
840590,Parts of producer gas or water gas generators and acetylene gas generators or similar water ...,419,478,388,277,264,100,98,162,1725,2362
291830,"Carboxylic acids with aldehyde or ketone function but without other oxygen function, their ...",1691,2065,2279,2862,1349,1986,2528,2331,2215,2354
870310,Vehicles for the transport of persons on snow; golf cars and similar vehicles,1148,2381,966,1337,1699,2290,1767,2725,2752,2353
961310,"Pocket lighters, gas fuelled, non-refillable",3098,2758,2678,2683,2714,2551,2434,2189,2410,2353
293391,"Alprazolam """"INN"""", camazepam """"INN"""", chlordiazepoxide """"INN"""", clonazepam """"INN"""", clorazepate, ...""",1621,1721,1871,941,555,1548,2312,1931,2332,2350
620341,"Men's or boys' trousers, bib and brace overalls, breeches and shorts, of wool or fine animal ...",4661,3803,4005,4045,3671,3792,3495,3250,2233,2348
830170,"Keys presented separately for padlocks, locks, clasps and frames with clasps incorporating ...",2129,1681,2010,2039,1732,2463,2290,1956,2085,2347
71022,"Shelled or unshelled beans """"Vigna spp., Phaseolus spp."""", uncooked or cooked by steaming ...""",1255,1090,935,1502,2084,1448,1235,1690,1507,2345
900659,Cameras for roll film of a width other than 35 mm or for film in the flat (excl. instant print ...,3174,2597,2264,2304,5049,3459,2516,1757,2069,2345
360490,"Signalling flares, rain rockets, fog signals and other pyrotechnic articles (excluding fireworks ...",3494,3642,3514,3816,3077,2478,2360,2297,2226,2342
610441,"Women's or girls' dresses of wool or fine animal hair, knitted or crocheted (excluding petticoats)",2611,2524,2763,2126,2275,1686,1951,1980,1669,2339
690600,"Ceramic pipes, conduits, guttering and pipe fittings (excluding of siliceous fossil meals or ...",566,594,709,429,777,759,1651,1081,1446,2332
731811,Coach screws of iron or steel,1699,1848,2189,2095,2133,2151,1861,1809,1637,2326
90421,"Fruits of the genus Capsicum or of the genus Pimenta, dried, neither crushed nor ground",0,73,939,922,1226,1570,2121,1926,1997,2325
291533,N-Butyl acetate,1650,2042,1329,1378,594,1469,462,851,2296,2320
920510,Brass-wind instruments,4165,4063,4124,4445,3396,2731,2804,2669,2184,2320
292212,Diethanolamine and its salts,2079,2194,2473,1875,1921,1872,1652,1361,1537,2318
480511,"Semi-chemical fluting paper, uncoated, in rolls of a width > 36 cm",1689,2171,1306,1399,1228,1921,480,918,1923,2317
820820,"Knives and cutting blades, of base metal, for machines or for mechanical appliances, for w ...",886,1148,1457,1717,1572,1579,1929,2125,1913,2316
293729,"Steroidal hormones, their derivatives and structural analogues, used primarily as hormones ...""",4038,3060,5166,2383,4332,3473,3789,4782,2532,2315
890391,"Sailboats and yachts, with or without auxiliary motor, for pleasure or sports",435,1487,387,1167,329,553,838,444,545,2311
110412,Rolled or flaked grains of oats,1348,1307,1018,1382,1714,1914,1337,1966,1483,2308
853510,Fuses for a voltage > 1.000 V,2168,1355,2823,1936,2225,1216,1545,1329,2157,2308
850640,Silver oxide cells and batteries (excluding spent),491,1374,1787,1793,2418,2470,2215,3872,1906,2299
630221,Printed bedlinen of cotton (excluding knitted or crocheted),2766,3106,2724,2936,3194,3261,2444,2306,1906,2293
480442,"Kraft paper and paperboard, uncoated, in rolls of a width > 36 cm or in square or rectangular ...",418,1079,2479,1788,1648,1968,3098,4281,2838,2290
841392,"Parts of liquid elevators, n.e.s.",1949,1705,1914,1920,2788,1422,1832,1601,1890,2278
845969,"Milling machines for metals, not numerically controlled (excluding way-type unit head machines, ...",2454,3647,7194,6982,10259,3949,3488,5086,3252,2275
940210,"Dentists', barbers' or similar chairs having rotating as well as both reclining and elevating ...",2340,3447,2579,3851,2466,3580,3378,3723,3163,2271
152110,"Vegetable waxes, whether or not refined or coloured (excluding triglycerides)",4154,3891,5122,3845,2649,2517,2662,2455,1838,2268
845620,"Machine tools for working any material by removal of material, operated by ultrasonic processes ...",1399,401,542,455,666,728,1335,1267,850,2256
293626,"Vitamin B12 and its derivatives, used primarily as vitamins",1236,1064,1190,1438,1747,2167,2513,3250,1443,2245
847439,"Machinery for mixing or kneading solid mineral substances, incl. those in powder or paste form ...",5453,3720,4474,2720,2283,1891,4006,6871,2906,2242
121020,"Hop cones, ground, powdered or in the form of pellets; lupulin",1145,504,644,1329,1861,737,2981,2441,2129,2239
280512,Calcium,112,97,1057,1569,1170,1945,1411,1442,1977,2233
401390,"Inner tubes, of rubber (excluding those of a kind used on motor cars, incl. station wagons ...",1874,1557,1711,1326,1378,1417,1416,2006,1812,2232
680430,Hand sharpening or polishing stones,1020,850,781,850,1039,2216,2172,1547,2120,2230
284910,"Carbides of calcium, whether or not chemically defined",2939,2928,2837,2609,2240,2727,2755,2670,1502,2228
852359,"Semiconductor media, unrecorded, for the recording of sound or of other phenomena (excluding ...",2654,5613,7201,6608,4953,3735,5696,1996,1013,2228
860711,Driving bogies and bissel-bogies for railway or tramway locomotives or rolling stock,933,578,2807,357,3058,1252,168,536,193,2219
411510,"Composition leather based on leather or leather fibre, in slabs, sheets or strip, whether or ...",2307,2211,1816,1331,1240,1636,2327,7795,5349,2217
845210,Sewing machines of the household type,1814,2165,1957,2724,2694,2673,2717,2550,3186,2210
903010,Instruments and apparatus for measuring or detecting ionising radiations,1732,2697,1786,1142,1692,4049,4159,4489,4468,2209
130120,Natural gum Arabic,824,1181,1037,881,946,988,907,1303,1157,2209
81120,"Frozen raspberries, blackberries, mulberries, loganberries, black-, white- or red currants ...",538,869,1310,1218,1860,2027,1949,2240,1433,2201
293623,"Vitamin B2 and its derivatives, used primarily as vitamins",1389,1563,1784,1813,2374,2098,2427,2031,1945,2200
846596,"Splitting, slicing or paring machines, for working wood",5377,8100,8330,5095,5806,1239,2376,1780,2942,2198
293319,"Heterocyclic compounds with nitrogen hetero-atom[s] only, containing an unfused pyrazole ring, ...""",1139,1162,1467,1596,1072,1245,1457,1517,931,2194
380910,"Finishing agents, dye carriers to accelerate the dyeing or fixing of dyestuffs and other products ...",938,1118,1651,1720,2247,1510,1913,1429,1474,2194
291260,Paraformaldehyde,1817,2571,2620,1647,1174,1447,1042,1227,1652,2194
741820,"Sanitary ware and parts thereof, of copper (excluding cooking and heating appliances of heading ...",3889,3915,4617,4019,3486,2969,2608,3096,2344,2188
854079,"Microwave tubes, e.g. travelling wave tubes and carcinotrons (excluding magnetrons and grid-controlled ...",2304,1535,1072,2047,1677,2073,1551,1111,818,2178
200860,"Cherries, prepared or preserved, whether or not containing added sugar or other sweetening ...",2799,3010,2427,2364,2351,2314,1716,1740,1510,2175
310560,Mineral or chemical fertilisers containing the two fertilising elements phosphorus and potassium ...,1729,1532,1879,1836,1653,1367,1657,1581,1699,2168
70959,"Fresh or chilled edible mushrooms and truffles (excl. Agaricus, Boletus, Cantharellus, shiitake, ...",2470,1824,2386,2592,3180,2759,2169,1875,1882,2158
491000,"Calendars of any kinds, printed, incl. calendars blocks",3405,3003,2571,2939,3038,2358,2445,2161,2093,2155
281610,Hydroxide and peroxide of magnesium,2371,2235,1785,1487,1285,1566,1540,1541,1568,2152
630612,"Tarpaulins, awnings and sunblinds of synthetic fibres (excluding flat covers of light fabrics ...",219,389,656,1126,1109,1251,1087,1082,1327,2147
441294,"Laminated wood as blockboard, laminboard or battenboard (excluding of bamboo, plywood consisting ...",3578,3666,4398,3421,2884,2415,2710,1885,1987,2135
750810,"Cloth, grill, netting and fencing, of nickel wire",277,461,650,581,457,1034,1450,663,970,2133
441919,"Tableware and kitchenware, of bamboo (excl. chopsticks, bread boards, chopping boards and similar ...",0,0,0,0,0,2913,2247,1960,2094,2128
810830,Titanium waste and scrap (excluding ash and residues containing titanium),4652,597,2804,1036,5986,6965,4808,2417,377,2122
320720,"Vitrifiable enamels and glazes, engobes """"slips"""" and similar preparations of the kind used ...""",3882,3690,3260,2496,2550,2582,2361,2566,1940,2120
